Keyword,Volume,Keyword Difficulty,CPC (USD),Competitive Density,Number of Results,Intent,SERP Features,Trend
what happens after basketball career,0,,0.00,0.00,,,,"0.00,0.00,0.00,0.00,0.00,0.00,0.00,0.00,0.00,0.00,0.00"
what happens after big south basketball,0,,0.00,0.00,,,,"0.00,0.00,0.00,0.00,0.00,0.00,0.00,0.00,0.00,0.00,0.00"
what happens after college basketball,0,,0.00,0.00,,,,"0.00,0.00,0.00,0.00,0.00,0.00,0.00,0.00,0.00,0.00,0.00"
what happens after double overtime in basketball,0,,0.00,0.00,,,,"0.00,0.00,0.00"
what happens after game 7 in basketball,0,,0.00,0.00,,,,"1.00,0.00,0.00,0.00,0.00,0.00,0.00,0.00,0.00,0.00,0.00"
what happens after regular season basketball,0,,0.00,0.00,,,,"0.00,0.00,0.00,0.00,0.00,0.00,0.00,0.00,0.00,0.00,0.00"
what happens after regular season basketball college,0,,0.00,0.00,,,,"0.00,0.00,0.00,0.00,0.00,0.00,0.00,0.00,0.00,0.00,0.00"
what happens after second overtime in basketball,0,,0.00,0.00,,,,"0.00,0.00,0.00,0.00,0.00,0.00,0.00,0.00,0.00,0.00,0.00"
what happens after you score an and one in basketball,0,,0.00,0.00,,,,"0.00,0.00,0.00,0.00,0.00,0.00,0.00,0.00,0.00,0.00,0.00"
what happens after you score in basketball,0,,0.00,0.00,,,,"0.00,0.00,0.00,0.00,0.00,0.00,0.00,0.00,0.00,0.00,0.00"
what happens at a basketball showcase,0,,0.00,0.00,,,,"0.00,0.00,0.00,0.00,0.00,0.00,0.00,0.00,0.00,0.00,0.00"
what happens at a basketball tryout,0,,0.00,0.00,,,,"0.00,0.00,0.00,0.00,0.00,0.00,0.00,0.00,0.00,0.00,0.00"
what happens at a referee basketball clinic,0,,0.00,0.00,,,,"0.00,0.00,0.00,0.00,0.00,0.00,0.00,0.00,0.00,0.00,0.00"
what happens at basketball camps,0,,0.00,0.00,,,,"0.00,0.00,0.00,0.00,0.00,0.00,0.00,0.00,0.00,0.00,0.00"
what happens at basketball coaching clinics,0,,0.00,0.00,,,,"0.00,0.00,0.00,0.00,0.00,0.00,0.00,0.00,0.00,0.00,0.00"
what happens at halftime in basketball,0,,0.00,0.00,,,,"0.00,0.00,0.00,0.00,0.00,0.00,0.00,0.00,0.00,0.00,0.00"
what happens at middle school basketball tryouts,0,,0.00,0.00,,,,"0.00,0.00,0.00,0.00,0.00,0.00,0.00,0.00,0.00,0.00,0.00"
what happens at the celebrity all star nba basketball,0,,0.00,0.00,,,,"0.00,0.00,0.00,0.00,0.00,0.00,0.00,0.00,0.00,0.00,0.00"
what happens at the end of last chance u basketball,0,,0.00,0.00,,,,"0.00,0.00,0.00,0.00,0.00,0.00,0.00,0.00,0.00,0.00,0.00"
what happens at the end of love and basketball,0,,0.00,0.00,,,,"0.00,0.00,0.00,0.00,0.00,0.00,0.00,0.00,0.00,0.00,0.00"
what happens at the end of the basketball diaries,0,,0.00,0.00,,,,"0.00,0.00,0.00,0.00,0.00,0.00,0.00,0.00,0.00,1.00,0.00"
what happens at the start of a basketball game,0,,0.00,0.00,,,,"0.00,0.00,0.00,0.00,0.00,0.00,0.00,0.00,0.00,0.00,0.00"
what happens before a pro basketball game,0,,0.00,0.00,,,,"0.00,0.00,0.00,0.00,0.00,0.00,0.00,0.00,0.00,0.00,0.00"
what happens during basketball tryouts,0,,0.00,0.00,,,,"0.00,0.00,0.00,0.00,0.00,1.00,0.00,0.00,0.00,0.00,0.00"
what happens during halftime in basketball,0,,0.00,0.00,,,,"0.00,0.00,0.00,0.00,0.00,0.00,0.00,0.00,0.00,0.00,0.00"
what happens during the basketball game,0,,0.00,0.00,,,,"0.00,0.00,0.00,0.00,0.00,0.00"
what happens during the basketball game part time indian,0,,0.00,0.00,,,,"0.00,0.00,0.00,0.00,0.00,0.00,0.00,0.00,0.00,0.00,0.00"
what happens if a basketball game is tied,0,,0.00,0.00,,,,"0.00,0.00,0.00,0.00,0.00,0.00,0.00,0.00,0.00,0.00,0.00"
what happens if a basketball gets wet,0,,0.00,0.00,,,,"0.00,0.00,0.00,0.00,0.00,0.00,0.00,0.00,0.00,0.00,0.00"
what happens if a basketball player gets 5 fouls,0,,0.00,0.00,,,,"0.00,0.00,0.00,0.00,0.00,0.00,0.00,0.00,0.00,0.00,0.00"
what happens if a basketball stores too much food,0,,0.00,0.00,,,,"0.00,0.00,0.00,0.00,0.00,0.00,0.00,0.00,0.00,0.00,0.00"
what happens if a basketball team runs out of players,0,,0.00,0.00,,,,"0.00,0.00,0.00,0.00,0.00,0.00,0.00,0.00,0.00,0.00,0.00"
what happens if a college basketball player is injured,0,,0.00,0.00,,,,"0.00,0.00,0.00,0.00,0.00,0.00,0.00,0.00,0.00,0.00,0.00"
what happens if a college basketball player smokes weed,0,,0.00,0.00,,,,"0.00,0.00,0.00,0.00,0.00,0.00,0.00,0.00,0.00,0.00,0.00"
what happens if a player changes number during.basketball game,0,,0.00,0.00,,,,"0.00,0.00,0.00,0.00,0.00,0.00,0.00,0.00,0.00,0.00,0.00"
what happens if a player gets ejected during basketball,0,,0.00,0.00,,,,"0.00,0.00,0.00,0.00,0.00,0.00,0.00,0.00,0.00,0.00,0.00"
what happens if all players foul out in basketball,0,,0.00,0.00,,,,"0.00,0.00,0.00,0.00,0.00,0.00,0.00,0.00,0.00,0.00,0.00"
what happens if basketball game is tied,0,,0.00,0.00,,,,"0.00,0.00,0.00,0.00,0.00,0.00,0.00,0.00,0.00,0.00,0.00"
what happens if basketball goes in but comes back out,0,,0.00,0.00,,,,"0.00,0.00,0.00,0.00,0.00,0.00,0.00,0.00,0.00,0.00,0.00"
what happens if basketball player gets 5 fouls,0,,0.00,0.00,,,,"0.00,0.00,0.00,0.00,0.00,0.00,0.00,0.00,0.00,0.00,0.00"
what happens if basketball tie,0,,0.00,0.00,,,,"0.00,0.00,0.00"
what happens if everyone fouls out in basketball,0,,0.00,0.00,,,,"0.00,0.00,0.00,0.00,0.00,0.00,0.00,0.00,0.00,0.00,0.00"
what happens if i cancel a waiver claim basketball fantasy,0,,0.00,0.00,,,,"0.00,0.00,0.00,0.00,0.00,0.00,0.00,0.00,0.00,0.00,0.00"
what happens if i play basketball everyday,0,,0.00,0.00,,,,"0.00,0.00,0.00,0.00,0.00,0.00,0.00,0.00,0.00,0.00,0.00"
what happens if iowa state men's basketball wins tonight,0,,0.00,0.00,,,,"0.00,0.00,0.00,0.00,0.00,0.00,0.00,0.00,0.00,0.00,0.00"
what happens if it is a tie in basketball,0,,0.00,0.00,,,,"0.00,0.00,0.00,0.00,0.00,0.00,0.00,0.00,0.00,0.00,0.00"
what happens if no one passes a ball in basketball,0,,0.00,0.00,,,,"0.00,0.00,0.00,0.00,0.00,0.00,0.00,0.00,0.00,0.00,0.00"
what happens if other team has ball basketball,0,,0.00,0.00,,,,"0.00,0.00,0.00,0.00,0.00,0.00,0.00,0.00,0.00,0.00,0.00"
what happens if ou beats kansas state in mens basketball,0,,0.00,0.00,,,,"0.00,0.00,0.00,0.00,0.00,0.00,0.00,0.00,0.00,0.00,0.00"
what happens if the ball hits the referee in basketball,0,,0.00,0.00,,,,"0.00,0.00,0.00,0.00,0.00,0.00,0.00,1.00,1.00,1.00,0.00"
what happens if the glass breaks in basketball,0,,0.00,0.00,,,,"0.00,0.00,0.00,0.00,0.00,0.00,0.00,0.00,0.00,0.00,0.00"
what happens if the other team scores in basketball,0,,0.00,0.00,,,,"0.00,0.00,0.00,0.00,0.00,0.00,0.00,0.00,0.00,0.00,0.00"
what happens if the score is tied in basketball,0,,0.00,0.00,,,,"0.00,0.00,0.00,0.00,0.00,0.00,0.00,0.00,0.00,0.00,0.00"
what happens if there is a tie in basketball,0,,0.00,0.00,,,,"0.00,0.00,0.00,0.00,0.00,0.00,0.00,0.00,0.00,0.00,0.00"
what happens if u fall with thr ball basketball,0,,0.00,0.00,,,,"0.00,0.00,0.00,0.00,0.00,0.00,0.00,0.00,0.00,0.00,0.00"
what happens if u foul a player in basketball,0,,0.00,0.00,,,,"0.00,0.00,0.00,0.00,0.00,0.00,0.00,0.00,0.00,0.00,0.00"
what happens if you break the glass in basketball,0,,0.00,0.00,,,,"0.00,0.00,0.00,0.00,0.00,0.00,0.00,0.00,0.00,0.00,0.00"
what happens if you cut a basketball in half,0,,0.00,0.00,,,,"0.00,0.00,0.00,0.00,0.00,0.00,0.00,0.00,0.00,0.00,0.00"
what happens if you don dribble in basketball,0,,0.00,0.00,,,,"0.00,0.00,0.00,0.00,0.00,0.00,0.00,0.00,0.00,0.00,0.00"
what happens if you double dribble in basketball,0,,0.00,0.00,,,,"0.00,0.00,0.00,0.00,0.00,0.00,0.00,0.00,0.00,0.00,0.00"
what happens if you draft after the first game basketball,0,,0.00,0.00,,,,"0.00,0.00,0.00,0.00,0.00,0.00,0.00,0.00,0.00,0.00,0.00"
what happens if you foul out in basketball,0,,0.00,0.00,,,,"0.00,0.00,0.00,0.00,0.00,0.00,0.00,0.00,0.00,0.00,0.00"
what happens if you get 3 fouls in basketball,0,,0.00,0.00,,,,"1.00,0.00,0.00,0.00,0.00,0.00,0.00,1.00,0.00,0.00,0.00"
what happens if you get 5 team fouls in basketball,0,,0.00,0.00,,,,"0.00,0.00,0.00,0.00,0.00,0.00,0.00,0.00,0.00,0.00,0.00"
what happens if you get 6 fouls in basketball,0,,0.00,0.00,,,,"1.00,0.00,0.00,0.00,0.00,0.00,0.00,0.00,0.00,0.00,0.00"
what happens if you get a foul in basketball,0,,0.00,0.00,,,,"0.00,0.00,0.00,0.00,0.00,0.00,0.00,0.00,0.00,0.00,0.00"
what happens if you get ejected from a basketball game,0,,0.00,0.00,,,,"0.00,0.00,0.00,0.00,0.00,0.00,0.00,0.00,0.00,1.00,0.00"
what happens if you get faster handles 1v1 basketball,0,,0.00,0.00,,,,"0.00,0.00,0.00,0.00,0.00,0.00,0.00,0.00,0.00,0.00,0.00"
what happens if you get faster handles in basketball,0,,0.00,0.00,,,,"0.00,0.00,0.00,0.00,0.00,0.00,0.00,0.00,0.00,0.00,0.00"
what happens if you get too many fouls in basketball,0,,0.00,0.00,,,,"0.00,0.00,0.00,0.00,0.00,0.00,0.00,0.00,0.00,0.00,0.00"
what happens if you go undefeayed in conferenced2 college basketball,0,,0.00,0.00,,,,"0.00,0.00,0.00,0.00,0.00,0.00,0.00,0.00,0.00,0.00,0.00"
what happens if you go undefeayed in d2 college basketball,0,,0.00,0.00,,,,"0.00,0.00,0.00,0.00,0.00,0.00,0.00,0.00,0.00,0.00,0.00"
what happens if you goaltend in basketball,0,,0.00,0.00,,,,"0.00,0.00,0.00,0.00,0.00,0.00,0.00,0.00,0.00,0.00,0.00"
what happens if you hit a referee in basketball,0,,0.00,0.00,,,,"0.00,0.00,0.00,0.00,0.00,0.00,0.00,0.00,0.00,0.00,0.00"
what happens if you jump without shooting basketball,0,,0.00,0.00,,,,"0.00,0.00,0.00,0.00,0.00,0.00,0.00,0.00,0.00,0.00,0.00"
what happens if you kick a basketball,0,,0.00,0.00,,,,"0.00,0.00,0.00,0.00,0.00,0.00,0.00,0.00,0.00,0.00,0.00"
what happens if you kick the ball in basketball,0,,0.00,0.00,,,,"0.00,0.00,0.00,0.00,0.00,0.00,0.00,0.00,0.00,0.00,0.00"
what happens if you leave a basketball in the sun,0,,0.00,0.00,,,,"0.00,0.00,0.00,0.00,0.00,0.00,0.00,0.00,0.00,0.00,0.00"
what happens if you miss a basketball game uf,0,,0.00,0.00,,,,"0.00,0.00,0.00,0.00,0.00,0.00,0.00,0.00,0.00,0.00,0.00"
what happens if you over inflate a basketball,0,,0.00,0.00,,,,"0.00,0.00,0.00,0.00,0.00,0.00,0.00,0.00,0.00,0.00,0.00,1.00"
what happens if you stop playing basketball,0,,0.00,0.00,,,,"0.00,0.00,0.00,0.00,0.00,0.00,0.00,0.00,0.00,0.00,0.00"
what happens if you tie in basketball,0,,0.00,0.00,,,,"0.00,0.00,0.00"
what happens if you tie in fantasy basketball playoffs,0,,0.00,0.00,,,,"0.00,0.00,0.00,0.00,0.00,0.00,0.00,0.00,0.00,1.00,1.00"
what happens if you tie in fantasy playoffs espn basketball,0,,0.00,0.00,,,,"0.00,0.00,0.00,0.00,0.00,0.00,0.00,0.00,0.00,0.00,0.00"
what happens if you trade ir players fantasy basketball,0,,0.00,0.00,,,,"0.00,0.00,0.00,0.00,0.00,0.00,0.00,0.00,0.00,0.00,0.00"
what happens if you travel in basketball,0,,0.00,0.00,,,,"0.00,0.00,0.00,0.00,0.00,0.00,0.00,0.00,0.00,0.00,0.00"
what happens if you win fantany basketball,0,,0.00,0.00,,,,"0.00,0.00,0.00,0.00,0.00,0.00,0.00,0.00,0.00,0.00,0.00"
what happens in 2k17 usa basketball,0,,0.00,0.00,,,,"0.00,0.00,0.00,0.00,0.00,0.00,0.00,0.00,0.00,0.00,0.00"
what happens in a basketball game,0,,0.00,0.00,,,,"0.00,0.00,0.00,0.00,0.00,0.00,0.00,0.00,0.00,0.00,0.00"
what happens in basketball if the ball gets stuck,0,,0.00,0.00,,,,"0.00,0.00,0.00,0.00,0.00,0.00,0.00,0.00,0.00,0.00,0.00"
what happens in basketball when they tie,0,,0.00,0.00,,,,"0.00,0.00,0.00,0.00,0.00,0.00,0.00,0.00,0.00,0.00,0.00"
what happens in dobule overtime basketball,0,,0.00,0.00,,,,"0.00,0.00,0.00,0.00,0.00,0.00,0.00,0.00,0.00,0.00,0.00"
what happens in june basketball,0,,0.00,0.00,,,,"0.00,0.00,0.00,0.00,0.00,0.00,0.00,0.00,0.00,0.00,0.00"
what happens in last chance u basketball,0,,0.00,0.00,,,,"0.00,0.00,0.00,0.00,0.00,0.00,0.00,0.00,0.00,0.00,0.00"
what happens in love and basketball,0,,0.00,0.00,,,,"0.00,0.00,0.00,0.00,1.00,0.00,0.00,0.00,0.00,0.00,0.00"
what happens in overtime in basketball,0,,0.00,0.00,,,,"0.00,0.00,0.00,0.00,0.00,0.00,0.00,0.00,0.00,0.00,0.00"
what happens in overtime in college basketball,0,,0.00,0.00,,,,"0.00,0.00,0.00,0.00,0.00,0.00,0.00,0.00,0.00,0.00,0.00"
what happens in the beginning of a basketball game,0,,0.00,0.00,,,,"0.00,0.00,0.00,0.00,0.00,0.00,0.00,0.00,0.00,0.00,0.00"
what happens in vegas basketball scene,0,,0.00,0.00,,,,"0.00,0.00,0.00,0.00,0.00,0.00,0.00,0.00,0.00,0.00,0.00"
what happens now with ky basketball,0,,0.00,0.00,,,,"0.00,0.00,0.00,0.00,0.00,0.00,0.00,0.00,0.00,0.00,0.00"
what happens on a basketball official visit,0,,0.00,0.00,,,,"0.00,0.00,0.00,0.00,0.00,0.00,0.00,0.00,0.00,0.00,0.00"
what happens on a flagrant foul in basketball,0,,0.00,0.00,,,,"0.00,0.00,0.00,0.00,0.00,0.00,0.00,0.00,0.00,0.00,0.00"
what happens on a lane violation in basketball,0,,0.00,0.00,,,,"0.00,0.00,0.00,0.00,0.00,0.00,0.00,0.00,0.00,0.00,0.00"
what happens on a non shooting foul in basketball,0,,0.00,0.00,,,,"0.00,0.00,0.00,0.00,0.00,0.00,0.00,0.00,0.00,0.00,0.00"
what happens on a tie in basketball,0,,0.00,0.00,,,,"0.00,0.00,0.00,0.00,0.00,0.00,0.00,0.00,0.00,0.00,0.00"
what happens on basketball game day,0,,0.00,0.00,,,,"0.00,0.00,0.00,0.00,0.00,0.00,0.00,0.00,0.00,0.00,0.00"
what happens on the court stays on the court basketball,0,,0.00,0.00,,,,"0.00,0.00,0.00,0.00,0.00,0.00,0.00,0.00,0.00,0.00,0.00"
what happens ot the bodu during a basketball game,0,,0.00,0.00,,,,"0.00,0.00,0.00,0.00,0.00,0.00,0.00,0.00,0.00,0.00,0.00"
what happens to 2013 mens basketball title,0,,0.00,0.00,,,,"0.00,0.00,0.00,0.00,0.00,0.00,0.00,0.00,0.00,0.00,0.00"
what happens to a athlete who swears in a basketball,0,,0.00,0.00,,,,"0.00,0.00,0.00,0.00,0.00,0.00,0.00,0.00,0.00,0.00,0.00"
what happens to a basketball when in cold weather,0,,0.00,0.00,,,,"0.00,0.00,0.00,0.00,0.00,0.00,0.00,0.00,0.00,0.00,0.00"
what happens to a basketball when in fire,0,,0.00,0.00,,,,"0.00,0.00,0.00,0.00,0.00,0.00,0.00,0.00,0.00,0.00,0.00"
what happens to a really fast basketball,0,,0.00,0.00,,,,"0.00,0.00,0.00,0.00,0.00,0.00,0.00,0.00,0.00,0.00,0.00"
what happens to college basketball players after college,0,,0.00,0.00,,,,"0.00,0.00,0.00,0.00,0.00,0.00,0.00,0.00,0.00,0.00,0.00"
what happens to college basketball players not drafted,0,,0.00,0.00,,,,"0.00,0.00,0.00,0.00,0.00,0.00,0.00,0.00,0.00,0.00,0.00"
what happens to fan tickets if basketball game is cancelled,0,,0.00,0.00,,,,"0.00,0.00,0.00,0.00,0.00,0.00,0.00,0.00,0.00,0.00,0.00"
what happens to fantasy basketball,0,,0.00,0.00,,,,"0.00,0.00,0.00,0.00,0.00,0.00,0.00,0.00,0.00,0.00,0.00"
what happens to fantasy basketball coronavirus,0,,0.00,0.00,,,,"0.00,0.00,0.00,0.00,0.00,0.00,0.00,0.00,0.00,0.00,0.00"
what happens to gpe when a basketball reaches the basket,0,,0.00,0.00,,,,"0.00,0.00,0.00,0.00,0.00,0.00,0.00,0.00,0.00,0.00,0.00"
what happens to guys who come onto basketball courts reddit,0,,0.00,0.00,,,,"0.00,0.00,0.00,0.00,0.00,0.00,0.00,0.00,0.00,0.00,0.00"
what happens to jerseys of the losers of basketball tournament,0,,0.00,0.00,,,,"0.00,0.00,0.00,0.00,0.00,0.00,0.00,0.00,0.00,0.00,0.00"
what happens to junior at basketball tryouts,0,,0.00,0.00,,,,"0.00,0.00,0.00,0.00,0.00,0.00,0.00,0.00,0.00,0.00,0.00"
what happens to ncaa basketball floors,0,,0.00,0.00,,,,"0.00,0.00,0.00,0.00,0.00,0.00,0.00,0.00,0.00,0.00,0.00"
what happens to notre dame women's basketball,0,,0.00,0.00,,,,"0.00,0.00,0.00,0.00,0.00,0.00,0.00,0.00,0.00,0.00,0.00"
what happens to the bodies of basketball players,0,,0.00,0.00,,,,"0.00,0.00,0.00,0.00,0.00,0.00,0.00,0.00,0.00,0.00,0.00"
what happens to the ncaa basketball courts,0,,0.00,0.00,,,,"0.00,0.00,0.00,0.00,0.00,0.00,0.00,0.00,0.00,0.00,1.00"
what happens to undrafted basketball players,0,,0.00,0.00,,,,"0.00,0.00,0.00,0.00,0.00,0.00,0.00,0.00,0.00,0.00,0.00"
what happens to undrafted college basketball players,0,,0.00,0.00,,,,"0.00,0.00,0.00,0.00,0.00,0.00,0.00,0.00,0.00,0.00,0.00"
what happens to wedgie balls in basketball,0,,0.00,0.00,,,,"0.00,0.00,0.00,0.00,0.00,0.00,0.00,0.00,0.00,0.00,0.00"
what happens uf a basketball player get 4 fouls,0,,0.00,0.00,,,,"0.00,0.00,0.00,0.00,0.00,0.00,0.00,0.00,0.00,0.00,0.00"
what happens whem a highschool basketball wins state,0,,0.00,0.00,,,,"0.00,0.00,0.00,0.00,0.00,0.00,0.00,0.00,0.00,0.00,0.00"
what happens when a basketball game is tied,0,,0.00,0.00,,,,"0.00,0.00,0.00,0.00,0.00,0.00,0.00,0.00,0.00,0.00,0.00"
what happens when a basketball gets old,0,,0.00,0.00,,,,"0.00,0.00,0.00,0.00,0.00,0.00,0.00,0.00,0.00,0.00,0.00"
what happens when a basketball gets stuck in the rim,0,,0.00,0.00,,,,"0.00,0.00,0.00,0.00,0.00,0.00,0.00,0.00,0.00,0.00,0.00"
what happens when a basketball hits your head,0,,0.00,0.00,,,,"1.00,1.00,0.00,0.00,0.00,0.00"
what happens when a basketball is thrown into the air,0,,0.00,0.00,,,,"0.00,0.00,0.00,0.00,0.00,0.00,0.00,0.00,0.00,0.00,0.00"
what happens when a basketball player break the backboard,0,,0.00,0.00,,,,"0.00,0.00,0.00,0.00,0.00,0.00,0.00,0.00,0.00,0.00,0.00"
what happens when a basketball player gets 4 fouls,0,,0.00,0.00,,,,"0.00,0.00,0.00,0.00,0.00,0.00,0.00,0.00,0.00,0.00,0.00"
what happens when a basketball player gets 5 fouls,0,,0.00,0.00,,,,"0.00,1.00,0.00,0.00,0.00,0.00,0.00,0.00,0.00,0.00,0.25"
what happens when a basketball player gets injured,0,,0.00,0.00,,,,"0.00,0.00,0.00,0.00,0.00,0.00,0.00,0.00,0.00,0.00,0.00"
what happens when a basketball player gets waived,0,,0.00,0.00,,,,"0.00,0.00,0.00,0.00,0.00,0.00,0.00,0.00,0.00,0.00,0.00"
what happens when a basketball player is traded,0,,0.00,0.00,,,,"0.00,0.00,0.00,0.00,0.00,0.00,0.00,0.00,0.00,0.00,0.00"
what happens when a coach gets a technical in basketball,0,,0.00,0.00,,,,"0.00,0.00,0.00,0.00,0.00,0.00,0.00,0.00,0.00,0.00,0.00"
what happens when a player fouls out in basketball,0,,0.00,0.00,,,,"0.00,1.00,0.00,0.00,0.00,0.00,0.00,0.00,0.00,0.00,0.00"
what happens when a spinning basketball,0,,0.00,0.00,,,,"0.00,0.00,0.00,0.00,0.00,0.00,0.00,0.00,0.00,0.00,0.00"
what happens when a violation occurs in basketball,0,,0.00,0.00,,,,"0.00,0.00,0.00"
what happens when basketball gets stuck,0,,0.00,0.00,,,,"0.00,0.00,0.00,0.00,0.00,0.00,0.00,0.00,0.00,0.00,0.00"
what happens when basketball score 100,0,,0.00,0.00,,,,"0.00,0.00,0.00,0.00,0.00,0.00,0.00,0.00,0.00,0.00,0.00"
what happens when college basketball gets 10 team fouls,0,,0.00,0.00,,,,"0.00,0.00,0.00,0.00,0.00,0.00,0.00,0.00,0.00,0.00,0.00"
what happens when its a turnover in basketball,0,,0.00,0.00,,,,"0.00,0.00,0.00,0.00,0.00,0.00,0.00,0.00,0.00,0.00,0.00"
what happens when just your finger tips shoot in basketball,0,,0.00,0.00,,,,"0.00,0.00,0.00,0.00,0.00,0.00,0.00,0.00,0.00,0.00,0.00"
what happens when someone double dribbles in basketball,0,,0.00,0.00,,,,"0.00,0.00,0.00,0.00,0.00,0.00,0.00,0.00,0.00,0.00,0.00"
what happens when someone fouls out in basketball,0,,0.00,0.00,,,,"0.00,0.00,0.00,0.00,0.00,0.00,0.00,0.00,0.00,0.00,0.00"
what happens when someone gets 5 fouls in basketball,0,,0.00,0.00,,,,"0.00,0.00,0.00,0.00,0.00,0.00,0.00,0.00,0.00,0.00,0.00"
what happens when someone shatters a basketball rim,0,,0.00,0.00,,,,"0.00,0.00,0.00,0.00,0.00,0.00,0.00,0.00,0.00,0.00,0.00"
what happens when someone travels in basketball,0,,0.00,0.00,,,,"0.00,0.00,0.00,0.00,0.00,0.00,0.00,1.00,0.00,0.00,0.00"
what happens when teams are tied in basketball,0,,0.00,0.00,,,,"0.00,0.00,0.00,0.00,0.00,0.00,0.00,0.00,0.00,0.00,0.00"
what happens when the basketball stays on the rim,0,,0.00,0.00,,,,"0.00,0.00,0.00,0.00,0.00,0.00,0.00,0.00,0.00,0.00,0.00"
what happens when the glass breaks in basketball,0,,0.00,0.00,,,,"0.00,0.00,0.00,0.00,0.00,0.00,0.00,0.00,0.00,0.00,0.00"
what happens when the glass shatters in basketball,0,,0.00,0.00,,,,"0.00,0.00,0.00,0.00,0.00,0.00,0.00,0.00,0.00,0.00,0.00"
what happens when there is a tie in basketball,0,,0.00,0.00,,,,"0.00,0.00,0.00,0.00,0.00,0.00,0.00,0.00,0.00,0.00,0.00"
what happens when there is a violation in basketball,0,,0.00,0.00,,,,"0.00,0.00,0.00,0.00,0.00,0.00,0.00,0.00,0.00,0.00,0.00"
what happens when two players fight over ball basketball,0,,0.00,0.00,,,,"0.00,0.00,0.00,0.00,0.00,0.00,0.00,0.00,0.00,0.00,0.00"
what happens when u break the rim in basketball,0,,0.00,0.00,,,,"0.00,0.00,0.00,0.00,0.00,0.00,0.00,0.00,0.00,0.00,0.00"
what happens when u breal the rim in basketball,0,,0.00,0.00,,,,"0.00,0.00,0.00,0.00,0.00,0.00,0.00,0.00,0.00,0.00,0.00"
what happens when u get shots and then play basketball,0,,0.00,0.00,,,,"0.00,0.00,0.00,0.00,0.00,0.00,0.00,0.00,0.00,0.00,0.00"
what happens when women basketball players play the men,0,,0.00,0.00,,,,"0.00,0.00,0.00,0.00,0.00,0.00,0.00,0.00,0.00,0.00,0.00"
what happens when you call out traveling basketball,0,,0.00,0.00,,,,"0.00,0.00,0.00,0.00,0.00,0.00,0.00,0.00,0.00,0.00,0.00"
what happens when you double dribble in basketball,0,,0.00,0.00,,,,"0.00,0.00,0.00,0.00,0.00,0.00,0.00,0.00,0.00,0.00,0.00"
what happens when you drop a basketball,0,,0.00,0.00,,,,"0.00,0.00,0.00,0.00,0.00,0.00,0.00,0.00,0.00,0.00,0.00"
what happens when you get 3 fouls in basketball,0,,0.00,0.00,,,,"0.00,0.00,0.00,0.00,0.00,0.00,0.00,0.00,0.00,0.00,0.00"
what happens when you get 30 on basketball on messenger,0,,0.00,0.00,,,,"0.00,0.00,0.00,0.00,0.00,0.00,0.00,0.00,0.00,0.00,0.00"
what happens when you get 6 fouls in basketball,0,,0.00,0.00,,,,"0.00,0.00,0.00,0.00,0.00,0.00,0.00,0.00,0.00,0.00,0.00"
what happens when you get a foul in basketball,0,,0.00,0.00,,,,"0.00,0.00,0.00"
what happens when you get a rebound in basketball,0,,0.00,0.00,,,,"0.00,0.00,0.00,0.00,0.00,0.00,0.00,0.00,0.00,0.00,0.00"
what happens when you get a tech in basketball,0,,0.00,0.00,,,,"0.00,0.00,0.00,0.00,0.00,0.00,0.00,0.00,0.00,0.00,1.00"
what happens when you get a technical foul in basketball,0,,0.00,0.00,,,,"0.00,0.00,0.00,0.00,0.00,0.00,0.00,0.00,0.00,0.00,0.00"
what happens when you get a technical in basketball,0,,0.00,0.00,,,,"0.00,0.00,0.00,0.00,0.00,0.00,0.00,0.00,0.00,0.00,0.00"
what happens when you get fouled out in basketball,0,,0.00,0.00,,,,"0.00,0.00,0.00,0.00,0.00,0.00,0.00,0.00,0.00,0.00,0.00"
what happens when you goaltending in basketball,0,,0.00,0.00,,,,"0.00,0.00,0.00"
what happens when you have 5 fouls in basketball,0,,0.00,0.00,,,,"0.00,0.00,0.00,0.00,0.00,0.00,0.00,0.00,0.00,0.00,0.00"
what happens when you incur for files in professional basketball,0,,0.00,0.00,,,,"0.00,0.00,0.00,0.00,0.00,0.00,0.00,0.00,0.00,0.00,0.00"
what happens when you jam your finger playing basketball,0,,0.00,0.00,,,,"0.00,0.00,0.00,0.00,0.00,0.00,0.00,0.00,0.00,0.00,0.00"
what happens when you spin a basketball off a dam,0,,0.00,0.00,,,,"0.00,0.00,0.00,0.00,0.00,0.00,0.00,0.00,0.00,0.00,0.00"
what happens when you stop then go on basketball,0,,0.00,0.00,,,,"0.00,0.00,0.00,0.00,0.00,0.00,0.00,0.00,0.00,0.00,0.00"
what happens when you throw a basketball from 98m,0,,0.00,0.00,,,,"0.00,0.00,0.00,0.00,0.00,0.00,0.00,0.00,0.00,0.00,0.00"
what happens when you use an indoor basketball outdoors,0,,0.00,0.00,,,,"0.00,0.00,0.00,0.00,0.00,0.00,0.00,0.00,0.00,0.00,0.00"
what happens with a technical foul in basketball,0,,0.00,0.00,,,,"0.00,0.00,0.00,0.00,0.00,0.00,0.00,0.00,0.00,0.00,1.00"
what happens with your circulatory system during basketball,0,,0.00,0.00,,,,"0.00,0.00,0.00,0.00,0.00,0.00,0.00,0.00,0.00,0.00,0.00"
what has happened to cbs sports franchise basketball,0,,0.00,0.00,,,,"0.00,0.00,0.00,0.00,0.00,0.00,0.00,0.00,0.00,0.00,0.00"
what has happened to duke basketball,0,,0.00,0.00,,,,"0.00,0.00,0.00,0.00,0.00,0.00,0.00,0.00,0.00,0.00,0.00"
what has happened to fsu basketball,0,,0.00,0.00,,,,"0.00,0.00,0.00,0.00,0.00,0.00,0.00,0.00,0.00,0.00,0.00"
what has happened to iu basketball,0,,0.00,0.00,,,,"0.00,0.00,0.00,0.00,0.00,0.00,0.00,0.00,0.00,0.00,0.00"
what has happened to kentucky basketball,0,,0.00,0.00,,,,"0.00,0.00,0.00,0.00,0.00,0.00,0.00,0.00,0.00,0.00,0.00"
what has happened to north carolina basketball,0,,0.00,0.00,,,,"0.00,0.00,0.00,0.00,0.00,0.00,0.00,0.00,0.00,0.00,0.00"
what has happened to wis badgers basketball team,0,,0.00,0.00,,,,"0.00,0.00,0.00,0.00,0.00,0.00,0.00,0.00,0.00,0.00,0.00"
what has happened to wis badgers basketball team 2017,0,,0.00,0.00,,,,"0.00,0.00,0.00,0.00,0.00,0.00,0.00,0.00,0.00,0.00,0.00"
what has happened to wisconsin basketball,0,,0.00,0.00,,,,"0.00,0.00,0.00,0.00,0.00,0.00,0.00,0.00,0.00,0.00,0.00"
what is happening in june basketball,0,,0.00,0.00,,,,"0.00,0.00,0.00,0.00,0.00,0.00,0.00,0.00,0.00,0.00,0.00"
what is happening with kansas basketball program,0,,0.00,0.00,,,,"0.00,0.00,0.00,0.00,0.00,0.00,0.00,0.00,0.00,0.00,0.00"
what is happening with ku men's basketball,0,,0.00,0.00,,,,"0.00,0.00,0.00,0.00,0.00,0.00,0.00,0.00,0.00,0.00,0.00"
what is happenning with kentucky basketball coach,0,,0.00,0.00,,,,"0.00,0.00,0.00,0.00,0.00,0.00,0.00,0.00,0.00,0.00,0.00"
what just happened basketball,0,,0.00,0.00,,,,"0.00,0.00,0.00,0.00,0.00,0.00,0.00,0.00,0.00,0.00,0.00"
what just happened basketball gif,0,,0.00,0.00,,,,"0.00,0.00,0.00,0.00,0.00,0.00,0.00,0.00,0.00,0.00,0.00"
what just happened meme basketball,0,,0.00,0.00,,,,"0.00,0.00,0.00,0.00,0.00,0.00,0.00,0.00,0.00,0.00,0.00"
what just happened northwestern basketball,0,,0.00,0.00,,,,"0.00,0.00,0.00,0.00,0.00,0.00,0.00,0.00,0.00,0.00,0.00"
what just happened to roy williams basketball coach,0,,0.00,0.00,,,,"0.00,0.00,0.00,0.00,0.00,0.00,0.00,0.00,0.00,0.00,0.00"
what just happened washington basketball scream,0,,0.00,0.00,,,,"0.00,0.00,0.00,0.00,0.00,0.00,0.00,0.00,0.00,0.00,0.00"
what usually happens at high school basketball tryouts,0,,0.00,0.00,,,,"0.00,0.00,0.00,0.00,0.00,0.00,0.00,0.00,0.00,0.00,0.00"
what usually happens in single basketball tryouts,0,,0.00,0.00,,,,"0.00,0.00,0.00,0.00,0.00,0.00,0.00,0.00,0.00,0.00,0.00"
what vcu basketball game happened on 3 7 19,0,,0.00,0.00,,,,"0.00,0.00,0.00,0.00,0.00,0.00,0.00,0.00,0.00,0.00,0.00"
what's happened to the north carolina men's basketball team,0,,0.00,0.00,,,,"0.00,0.00,0.00,0.00,0.00,0.00,0.00,0.00,0.00,0.00,0.00"
what's happening in basketball right now,0,,0.00,0.00,,,,"1.00,0.00,0.00,0.00,0.00,0.00,0.00,0.00,0.00,0.00,0.00"
what's happening in june basketball,0,,0.00,0.00,,,,"0.00,0.00,0.00,0.00,0.00,0.00,0.00,0.00,0.00,0.00,0.00"
what's happening playing basketball,0,,0.00,0.00,,,,"0.00,0.00,0.00,0.00,0.00,0.00,0.00,0.00,0.00,0.00,0.00"
what's happening to university of oregon men's basketball,0,,0.00,0.00,,,,"0.00,0.00,0.00,0.00,0.00,0.00,0.00,0.00,0.00,0.00,0.00"
