Keyword,Volume,Keyword Difficulty,CPC (USD),Competitive Density,Number of Results,Intent,SERP Features,Trend
how much are basketball tickets,260,75,0.35,0.18,0,Informational,"Carousel, Featured snippet, Image, People also ask, Site links","0.53,0.53,0.53,0.43,0.35,0.53,0.82,0.66,1.00,0.82,0.82,0.66"
how to buy big ten basketball tournament tickets,260,33,0.00,0.00,231000000,Informational,"Featured snippet, People also ask, Reviews, Site links, Video","0.00,0.00,0.72,0.00,0.00,0.72,1.00,0.00,0.01,0.01,0.00"
how much are tickets to the ncaa basketball tournament,90,59,0.15,0.38,1920000000,Informational,"Featured snippet, People also ask, Reviews, Site links","0.01,0.04,1.00,0.04,0.00,0.00,0.00,0.04,0.04,0.04,0.15,0.09"
how to get cheap basketball tickets,90,62,1.59,0.49,9000000,Informational,"People also ask, Reviews, Site links, Video","0.23,0.23,0.14,0.14,0.14,0.66,1.00,0.66,0.52,0.52,0.66,0.23"
when do duke basketball tickets go on sale,90,55,0.00,0.23,96,Informational,"People also ask, Reviews, Site links","0.06,1.00,0.34,0.34,0.43,0.09,0.09,0.09,0.09,0.09,0.06,0.06"
where to buy ncaa basketball tickets,90,74,2.16,0.63,359000000,"Informational, Transactional","Image, People also ask, Reviews, Site links","0.00,0.04,1.00,0.00,0.04,0.04,0.04,0.04,0.04,0.04,0.05,0.02"
a&m basketball tickets,70,28,0.79,0.47,92,Informational,"Image pack, People also ask, Reviews, Site links","0.09,0.09,0.00,0.09,0.09,0.09,0.09,0.34,1.00,0.15,0.34,0.06"
how much are duke basketball tickets,70,51,0.17,0.19,51100000,Informational,"People also ask, Reviews, Site links, Video","0.12,0.12,0.09,0.09,0.09,0.09,0.34,0.09,0.09,0.09,0.34,0.09"
how much are tickets to basketball games,70,70,0.00,0.09,543000000,Informational,"People also ask, Site links","0.42,0.14,0.14,0.23,1.00,0.23,0.14,0.42,0.66,0.14,0.09,0.09"
when do unc basketball tickets go on sale,70,41,0.72,0.23,99,Informational,"People also ask, Reviews, Site links","1.00,0.11,0.19,0.26,0.65,0.53,0.11,0.11,0.11,0.11,0.07,0.42"
where can i buy basketball tickets,70,73,3.48,0.52,77200000,Transactional,"People also ask, Site links","0.14,0.66,1.00,0.52,0.14,0.14,0.14,0.14,0.14,0.14,0.09,0.09"
a basketball team sells tickets that cost,50,6,0.00,0.00,23400000,Informational,Image pack,"1.00,0.11,0.11,0.11,0.11,0.11,0.11,0.11,0.00,0.11,0.07,0.07"
are basketball tickets cheaper day of,50,34,0.00,0.00,224000000,Informational,"People also ask, Reviews, Site links","0.14,0.14,0.14,0.14,0.14,0.14,0.14,0.14,0.14,0.14,0.09,0.09"
how much are courtside basketball tickets,50,51,0.39,0.10,7640000,Informational,"Featured snippet, Image, People also ask, Site links","1.00,0.17,0.17,0.17,0.17,0.17,0.17,0.29,0.23,0.17,0.17,0.11"
how much are ncaa basketball tickets,50,63,0.19,0.41,219000000,Informational,"FAQ, Featured snippet, People also ask, Reviews, Site links","1.00,0.17,0.17,0.00,0.17,0.17,0.17,0.17,0.17,0.17,1.00,0.23"
how much are ohio state basketball tickets,50,49,0.17,0.27,71100000,Informational,"Featured snippet, People also ask, Reviews, Site links, Video","1.00,0.14,0.14,0.14,0.14,0.14,0.14,0.14,0.14,0.14,0.09,0.09"
how much are sdsu basketball tickets,50,35,0.00,0.00,89,Informational,"Featured snippet, People also ask, Reviews, Site links","0.00,0.11,0.11,0.11,0.00,0.11,0.11,0.11,0.11,0.11,0.07,0.00"
how much are syracuse basketball tickets,50,36,0.20,0.40,94,Informational,"Featured snippet, People also ask, Reviews, Site links, Video","1.00,0.17,0.17,0.17,0.17,0.17,0.17,0.17,0.17,0.17,0.11,0.11"
how much do basketball tickets cost,50,56,0.29,0.09,0,Informational,"Carousel, Featured snippet, People also ask, Site links","0.09,0.27,0.27,0.27,0.27,0.27,0.27,1.00,1.00,0.27,1.00,1.00"
how much is a basketball game ticket,50,72,0.17,0.15,109000000,Informational,"Featured snippet, People also ask, Site links","1.00,0.27,0.27,0.27,0.27,0.27,1.00,0.27,0.27,0.27,0.18,0.18"
how much is a ticket to a basketball game,50,72,0.00,0.03,108000000,Informational,"Featured snippet, People also ask, Site links","0.11,0.11,0.11,0.11,0.11,0.11,0.11,0.11,0.11,0.11,0.07,0.07"
how much is a ticket to a duke basketball game,50,59,0.12,0.07,31000000,Informational,"Featured snippet, People also ask, Reviews, Site links","0.09,0.00,0.09,0.09,0.09,0.52,0.09,1.00,0.19,0.09,0.09,0.09"
how to get duke basketball tickets,50,49,0.86,0.22,54000000,Informational,"People also ask, Reviews, Site links, Video","0.07,1.00,0.21,0.21,0.35,0.21,0.78,0.21,0.21,0.21,0.14,0.14"
how to get tickets for duke basketball,50,54,0.51,0.38,64300000,Informational,"Featured snippet, People also ask, Reviews, Site links, Video","1.00,0.14,0.14,0.14,0.14,0.14,0.14,0.14,0.14,0.14,0.09,0.09"
when do texas tech basketball tickets go on sale,50,39,0.00,0.43,63,Informational,"People also ask, Site links","0.14,0.14,0.14,1.00,0.14,0.14,0.14,0.14,0.14,0.14,0.09,0.09"
when do uk basketball tickets go on sale,50,52,0.00,0.29,30900000,"Informational, Transactional","People also ask, Reviews, Site links","1.00,0.11,0.11,0.11,0.11,0.15,0.11,0.11,0.11,0.11,0.07,0.00"
when will duke basketball tickets go on sale,50,51,0.00,0.18,88,"Informational, Transactional","People also ask, Reviews, Site links, Video","0.78,0.28,0.35,0.78,1.00,0.35,0.21,0.21,0.21,0.21,0.14,0.14"
can you buy basketball tickets at the door,40,69,0.00,0.00,28200000,Commercial,"Featured snippet, People also ask, Reviews, Site links","0.17,0.17,0.17,0.17,0.17,0.17,0.17,0.17,0.17,0.17,0.11,0.11"
do basketball tickets get cheaper,40,31,2.23,0.35,242000000,Informational,"People also ask, Reviews, Site links, Video","0.50,0.21,0.21,0.21,0.21,0.21,0.21,0.21,0.28,0.28,0.14,0.14"
how much are duke unc basketball tickets,40,56,0.15,0.15,6920000,Informational,"Featured snippet, People also ask, Reviews, Site links, Video","0.14,0.14,0.14,0.14,0.14,0.14,0.14,0.14,0.14,0.14,1.00,0.19"
how much are duke vs north carolina basketball tickets,40,,0.19,0.26,,,,"0.00,0.27,0.27,0.00,0.27,0.27,0.27,0.27,0.27,1.00,0.63"
how much are kentucky basketball season tickets,40,49,0.00,0.00,29200000,Informational,"People also ask, Reviews, Site links","1.00,0.21,0.21,0.21,0.21,0.21,0.21,0.21,0.21,0.21,0.14,0.14"
how much are ku basketball season tickets,40,,0.00,0.00,,,,"0.78,0.21,0.21,0.21,0.21,0.21,0.21,0.21,0.21,0.21,0.14,0.14"
how much are nba basketball tickets,40,74,0.64,0.31,100,Informational,"Featured snippet, People also ask, Site links","0.27,0.27,0.27,0.27,0.27,0.27,0.27,0.27,0.27,0.27,0.18,0.18"
how much are purdue basketball season tickets,40,43,0.00,0.01,7490000,Informational,"Featured snippet, People also ask, Site links","0.17,0.17,0.17,0.17,0.17,0.17,0.23,0.17,0.23,0.23,0.11,0.11"
how much are razorback basketball tickets,40,,0.00,0.19,,,,"1.00,0.27,0.27,0.27,0.27,0.27,0.27,0.27,0.27,0.27,0.18,0.18"
how much are sec basketball tournament tickets,40,39,0.14,0.33,23700000,Informational,"Featured snippet, People also ask, Reviews, Site links","0.27,0.27,0.27,0.27,0.27,0.27,0.27,0.27,0.27,0.27,1.00,0.18"
how much are the ace family basketball tickets,40,21,0.00,0.00,83,Informational,"Featured snippet, Image pack, Reviews, Site links, Video","1.00,0.14,0.00,0.00,0.00,0.00,0.00,0.00,0.00,0.00,0.00,0.00"
how much are uk basketball tickets,40,55,0.17,0.24,35800000,Informational,"Featured snippet, People also ask, Reviews, Site links","0.17,0.17,0.17,0.17,0.17,0.17,0.17,0.17,0.17,0.17,0.11,0.11"
how to buy cheap basketball tickets,40,62,1.76,0.58,8420000,"Informational, Transactional","Adwords top, People also ask, Reviews, Site links, Video","0.14,0.14,0.00,0.00,0.14,0.00,0.14,0.14,0.14,0.14,0.09,0.09"
how to get tickets to sierra canyon basketball game,40,24,0.00,0.10,3500000,Transactional,"People also ask, Reviews, Site links, Video","0.33,0.33,0.33,0.33,0.33,0.33,0.33,0.55,0.55,0.33,0.22,0.22"
how to get unc basketball tickets,40,44,0.00,0.14,19500000,"Informational, Transactional","People also ask, Site links","0.00,0.14,0.14,0.14,0.14,0.14,0.14,0.14,0.14,0.14,0.09,0.09"
how to sell basketball tickets,40,68,1.36,0.37,62200000,Informational,"FAQ, People also ask, Reviews, Site links, Video","1.00,0.33,0.33,0.33,0.33,0.33,0.33,0.33,0.44,0.33,0.44,0.22"
how to surprise someone with basketball tickets,40,32,0.00,0.78,55,Informational,"Image pack, People also ask, Reviews, Video","0.11,0.11,0.00,0.11,0.11,0.11,0.11,0.42,0.11,0.11,0.07,0.07"
when do kentucky basketball tickets go on sale,40,,0.00,0.00,,,,"0.07,0.21,0.21,0.21,1.00,0.35,0.21,0.21,0.21,0.21,0.14,0.14"
when do msu basketball tickets go on sale,40,50,0.54,0.23,72,Informational,"People also ask, Reviews, Site links","1.00,0.17,0.17,0.17,0.17,0.17,0.17,0.17,0.17,0.17,0.11,0.11"
when do purdue basketball tickets go on sale,40,,0.00,0.00,,,,"1.00,0.33,0.33,0.33,0.77,0.33,0.33,0.33,0.33,0.33,0.22,0.22"
when do syracuse basketball tickets go on sale,40,45,0.52,0.37,54,Informational,"Featured snippet, People also ask, Reviews, Site links, Twitter","0.50,0.21,0.21,0.21,1.00,0.21,0.21,0.21,0.21,0.21,0.14,0.14"
when do wvu basketball tickets go on sale,40,,0.00,0.00,,,,"1.00,0.14,0.14,0.14,0.14,0.14,0.14,0.14,0.00,0.00,0.00,0.00"
where to buy basketball tickets,40,73,2.45,0.58,94800000,"Informational, Transactional","People also ask, Site links","0.33,0.33,0.33,0.33,0.33,0.55,0.44,0.44,0.55,0.33,1.00,0.22"
where to buy cheap basketball tickets,40,61,1.93,0.58,9120000,"Informational, Transactional","People also ask, Reviews, Site links","1.00,0.33,0.33,0.33,0.33,0.33,0.33,0.33,0.33,0.33,0.22,0.22"
where to find cheap basketball tickets,40,66,1.91,0.56,11700000,Informational,"People also ask, Reviews, Site links","0.14,0.14,0.00,0.14,0.14,0.14,0.14,0.14,0.14,0.14,0.09,0.09"
where to sell basketball tickets,40,67,2.11,0.50,230000000,Informational,"People also ask, Reviews, Site links","0.14,0.14,0.14,0.00,0.00,0.14,0.14,0.14,0.14,0.14,0.09,0.09"
do basketball tickets get cheaper closer to the date,30,,2.70,0.14,,,,"1.00,1.00,1.00,1.00,1.00,1.00,1.00,1.00,1.00,1.00,0.66,0.66"
do duke students get free basketball tickets,30,,0.00,0.00,,,,"0.42,0.42,0.00,0.42,0.42,0.42,0.42,0.42,0.42,0.42,0.28,0.28"
do duke students pay for basketball tickets,30,,0.00,0.00,,,,"0.33,0.33,0.33,0.33,0.33,0.33,0.33,0.33,0.33,0.33,0.22,0.22"
how much are all star basketball tickets,30,,0.00,0.00,,,,"0.14,0.14,0.14,0.14,0.00,0.14,0.14,0.14,0.14,0.14,0.09,0.09"
how much are arkansas razorback basketball tickets,30,,0.00,0.00,,,,"0.00,1.00,1.00,1.00,1.00,1.00,1.00,1.00,1.00,0.66,0.66"
how much are auburn basketball season tickets,30,,0.00,0.00,,,,"0.09,0.18,0.36,0.18,0.09,0.09,0.27,0.27,1.00,0.27,0.18,0.18"
how much are basketball courtside tickets,30,,0.00,0.02,,,,"0.14,0.42,0.42,0.42,0.42,0.42,0.42,0.42,0.42,0.42,0.28,0.28"
how much are basketball hall of fame tickets,30,,0.00,0.01,,,,"0.17,0.17,0.17,0.17,0.17,0.17,0.17,0.17,0.17,0.17,0.11,0.11"
how much are basketball playoff tickets,30,,0.17,0.15,,,,"0.00,1.00,1.00,1.00,1.00,1.00,1.00,1.00,1.00,1.00,0.66,1.00"
how much are basketball season tickets,30,,0.00,0.01,,,,"0.27,0.27,0.27,0.27,0.27,0.27,0.27,0.27,0.27,0.27,0.18,0.18"
how much are byu basketball season tickets,30,,0.00,0.00,,,,"1.00,0.42,0.42,0.42,0.42,0.42,0.42,0.42,0.42,0.42,0.28,0.28"
how much are byu basketball tickets,30,,0.00,0.00,,,,"0.00,0.33,0.33,0.33,0.33,0.33,0.33,0.33,0.33,0.33,0.22,0.22"
how much are creighton basketball season tickets,30,,0.00,0.04,,,,"0.18,0.27,0.27,0.27,0.27,0.27,0.27,0.36,0.27,0.27,0.18,0.18"
how much are duke basketball season tickets,30,,0.00,0.00,,,,"0.00,0.60,0.60,0.60,0.60,0.60,0.60,0.60,0.60,1.00,0.40"
how much are duke vs unc basketball tickets,30,,0.16,0.21,,,,"0.42,0.42,0.00,0.42,0.42,0.42,0.42,0.42,0.42,0.42,0.28,0.28"
how much are front row basketball tickets,30,,0.00,0.01,,,,"0.28,0.42,0.42,0.42,0.42,0.42,0.42,0.42,0.42,0.42,0.28,0.28"
how much are front row tickets to a basketball game,30,,0.00,0.11,,,,"0.14,0.21,0.35,0.21,0.21,0.21,0.21,0.21,0.21,0.21,0.14,0.14"
how much are gonzaga basketball season tickets,30,,0.00,0.00,,,,"0.14,0.14,0.14,0.14,0.14,0.14,0.14,0.14,0.14,0.14,0.09,0.09"
how much are gonzaga basketball tickets,30,,0.00,0.00,,,,"0.42,0.42,0.42,0.42,0.42,0.42,0.57,0.42,0.42,0.42,0.28,0.28"
how much are iu basketball season tickets,30,,0.00,0.01,,,,"0.33,0.33,0.33,0.33,0.33,0.33,0.33,0.33,0.33,0.33,0.22,0.22"
how much are iu basketball tickets,30,,0.00,0.00,,,,"0.42,0.42,0.42,0.42,0.42,0.42,0.42,0.42,0.42,0.42,0.28,0.28"
how much are kentucky basketball tickets,30,,0.00,0.10,,,,"1.00,1.00,1.00,1.00,1.00,1.00,1.00,1.00,1.00,1.00,0.66,0.66"
how much are ku basketball tickets,30,,0.23,0.14,,,,"0.40,0.60,0.60,0.60,0.60,0.60,0.80,0.80,0.60,0.60,1.00,0.40"
how much are michigan basketball season tickets,30,,0.00,0.00,,,,"0.14,0.21,0.21,0.21,0.21,0.21,0.21,0.21,0.21,0.21,0.14,0.14"
how much are michigan basketball tickets,30,,0.00,0.00,,,,"0.17,0.17,0.17,0.17,0.17,0.17,0.17,0.17,0.17,0.17,0.11,0.11"
how much are msu basketball season tickets,30,,0.00,0.00,,,,"0.14,0.14,0.14,0.14,0.14,0.14,0.14,0.14,0.14,0.14,0.09,0.09"
how much are msu basketball tickets,30,,0.00,0.00,,,,"0.33,0.14,0.14,0.14,0.14,0.14,0.14,0.14,0.14,0.14,0.09,0.09"
how much are ncaa basketball championship tickets,30,,0.17,0.17,,,,"0.00,0.42,0.42,0.42,0.00,0.42,0.42,0.42,0.42,0.42,0.42,1.00"
how much are ncaa basketball tournament tickets,30,,0.21,0.20,,,,"0.00,0.18,0.00,0.18,0.00,0.18,0.18,1.00,0.18,0.81,0.18,0.18"
how much are pitt basketball tickets,30,,0.00,0.00,,,,"0.00,1.00,1.00,1.00,1.00,1.00,1.00,1.00,1.00,1.00,0.66,0.66"
how much are purdue basketball tickets,30,,0.00,0.07,,,,"0.60,0.60,0.60,0.60,0.60,0.60,0.60,0.60,0.60,0.60,0.40,0.40"
how much are rutgers basketball tickets,30,,0.00,0.00,,,,"0.00,1.00,1.00,1.00,1.00,1.00,1.00,1.00,1.00,1.00,0.66,0.66"
how much are season tickets for uk basketball,30,,0.00,0.00,,,,"1.00,1.00,0.00,1.00,1.00,1.00,1.00,1.00,1.00,1.00,0.66,0.66"
how much are season tickets for unc basketball,30,,0.00,0.00,,,,"1.00,1.00,1.00,1.00,1.00,0.00,1.00,1.00,1.00,1.00,0.66,0.66"
how much are season tickets to duke basketball,30,,0.00,0.00,,,,"1.00,1.00,0.00,1.00,1.00,1.00,1.00,1.00,1.00,1.00,0.66,0.66"
how much are sierra canyon basketball tickets,30,,0.00,0.00,,,,"0.50,0.75,0.75,0.75,0.75,0.75,0.75,0.75,1.00,0.75,0.50,0.50"
how much are syracuse basketball season tickets,30,,0.00,0.00,,,,"0.00,1.00,1.00,1.00,1.00,1.00,1.00,1.00,1.00,1.00,0.66,0.66"
how much are tickets to a duke basketball game,30,,0.00,0.10,,,,"0.00,0.75,0.75,0.75,0.75,0.75,0.75,0.75,0.75,0.75,1.00,0.50"
how much are tickets to ncaa basketball tournament,30,,0.14,0.19,,,,"0.00,0.27,0.00,0.00,0.00,0.27,0.27,0.00,0.27,1.00,0.63"
how much are ucla basketball tickets,30,,0.00,0.09,,,,"1.00,1.00,1.00,1.00,1.00,1.00,1.00,1.00,1.00,1.00,0.66,0.66"
how much are uconn women's basketball tickets,30,,0.00,0.13,,,,"0.52,0.17,0.17,0.17,0.17,0.17,0.17,0.17,0.17,0.17,0.11,0.11"
how much are uk basketball season tickets,30,,0.00,0.00,,,,"0.27,0.27,0.27,0.27,0.27,0.27,0.27,0.27,0.27,0.27,0.18,0.18"
how much are unc basketball season tickets,30,,0.00,0.01,,,,"0.33,0.33,0.33,0.33,0.33,0.33,0.33,0.33,0.44,0.44,0.33,0.44"
how much are unc basketball tickets,30,,0.18,0.10,,,,"0.00,1.00,1.00,1.00,1.00,1.00,1.00,1.00,1.00,1.00,0.66,0.66"
how much are ut basketball tickets,30,,0.00,0.00,,,,"0.00,1.00,1.00,1.00,1.00,1.00,1.00,1.00,1.00,1.00,0.66,0.66"
how much are uva basketball season tickets,30,,0.00,0.00,,,,"1.00,1.00,1.00,1.00,1.00,1.00,1.00,1.00,1.00,1.00,0.66,0.66"
how much are vcu basketball tickets,30,,0.00,0.00,,,,"0.14,0.14,0.00,0.14,0.14,0.14,0.14,0.14,0.14,0.14,0.09,0.09"
how much are villanova basketball tickets,30,,0.00,0.00,,,,"0.33,0.33,0.33,0.33,0.33,0.33,0.33,0.33,0.33,0.33,0.22,0.22"
how much are wvu basketball tickets,30,,0.00,0.00,,,,"0.52,0.17,0.17,0.17,0.17,0.17,0.17,0.17,0.17,0.17,0.11,0.00"
how much do basketball season tickets cost,30,,0.00,0.01,,,,"0.14,0.14,0.14,0.14,0.14,0.14,0.14,0.14,0.14,0.14,0.09,0.09"
how much do courtside basketball tickets cost,30,,0.00,0.01,,,,"0.14,0.14,0.14,0.14,0.14,0.14,0.14,0.14,0.14,0.14,0.09,0.09"
how much do duke basketball season tickets cost,30,,0.00,0.00,,,,"0.00,1.00,1.00,1.00,1.00,1.00,1.00,1.00,1.00,1.00,0.66,0.66"
how much do duke basketball tickets cost,30,,0.00,0.07,,,,"0.14,0.14,0.14,0.14,0.14,0.14,0.14,0.14,0.14,0.14,0.09,0.09"
how much do front row basketball tickets cost,30,,0.00,0.04,,,,"1.00,0.27,0.27,0.27,0.00,0.27,0.27,0.27,0.27,0.27,0.18,0.18"
how much do unc basketball season tickets cost,30,,0.00,0.00,,,,"0.11,0.11,0.11,0.11,0.11,0.11,0.11,0.11,0.11,0.11,0.07,0.07"
how much does a basketball game ticket cost,30,,0.00,0.14,,,,"0.14,0.14,0.14,0.14,0.14,0.14,0.14,0.14,0.14,0.14,0.09,0.09"
how much is a duke basketball ticket,30,,0.00,0.17,,,,"0.42,0.42,0.42,0.42,0.00,0.42,0.42,0.42,0.42,0.42,0.57,0.28"
how much is a ticket for a basketball game,30,,0.00,0.04,,,,"0.27,0.27,0.27,0.27,0.27,0.27,0.27,0.27,0.27,0.27,0.18,0.18"
how much is nba basketball tickets,30,,0.49,0.30,,,,"0.50,0.75,0.75,0.75,0.75,0.75,0.75,0.75,0.75,0.75,0.50,0.50"
how to buy basketball tickets,30,,1.73,0.51,,,,"0.14,0.14,0.14,0.14,0.14,0.14,0.14,0.14,0.14,0.14,0.09,0.09"
how to buy duke basketball tickets,30,,0.00,0.29,,,,"0.17,0.17,0.17,0.17,0.17,0.17,0.17,0.17,0.17,0.17,0.11,0.11"
how to buy gonzaga basketball tickets,30,,0.00,0.14,,,,"0.00,0.11,0.11,0.11,0.11,0.11,0.11,0.11,0.11,0.11,0.07,0.07"
how to buy ku basketball tickets,30,,0.00,0.14,,,,"1.00,0.42,0.42,0.00,0.42,0.42,0.42,0.42,0.42,0.42,0.28,0.28"
how to buy unc basketball tickets,30,,0.00,0.07,,,,"0.00,1.00,1.00,1.00,1.00,1.00,1.00,1.00,1.00,0.66,0.66"
how to get basketball tickets,30,,1.04,0.47,,,,"0.14,0.42,0.42,0.42,0.42,0.42,0.42,0.42,0.42,0.42,0.28,0.28"
how to get courtside basketball tickets,30,,0.00,0.11,,,,"1.00,0.42,0.00,0.42,0.00,0.42,0.42,0.42,0.42,0.42,0.28,0.28"
how to get free basketball tickets,30,,1.53,0.25,,,,"0.00,1.00,1.00,1.00,1.00,1.00,1.00,1.00,1.00,1.00,0.66,0.66"
how to get fsu student basketball tickets,30,,0.00,0.00,,,,"0.42,0.42,0.42,0.42,0.42,0.42,0.42,0.42,0.42,0.42,0.28,0.00"
how to get gonzaga basketball tickets,30,,0.00,0.14,,,,"0.09,0.27,0.27,0.27,0.27,0.27,1.00,0.27,0.27,0.27,0.18,0.18"
how to get sierra canyon basketball tickets,30,,0.00,0.00,,,,"0.00,1.00,1.00,1.00,1.00,1.00,1.00,1.00,1.00,1.00,0.66,0.66"
how to get tickets to duke basketball games,30,,0.00,0.29,,,,"0.60,0.60,0.60,0.60,0.60,0.60,0.60,0.60,0.60,0.60,0.40,0.40"
how to get tickets to ncaa basketball tournament,30,,0.00,0.14,,,,"0.09,0.09,0.00,0.00,0.00,0.09,0.09,0.09,0.09,0.09,0.43,0.06"
how to gift basketball tickets,30,,0.00,0.71,,,,"0.00,0.00,0.27,0.27,0.27,0.27,1.00,0.27,0.27,0.18,0.18"
when are basketball tickets the cheapest,30,,3.25,0.33,,,,"0.33,0.14,0.14,0.14,0.14,0.14,0.14,0.14,0.14,0.14,0.09,0.09"
when do acc basketball tickets go on sale,30,,0.00,0.00,,,,"0.14,0.42,0.42,0.42,0.42,0.42,0.42,0.42,0.42,0.42,0.28,0.28"
when do basketball tickets go on sale,30,,0.84,0.19,,,,"0.40,0.60,0.60,0.60,0.60,0.60,0.60,0.60,0.60,0.60,0.40,0.40"
when do gonzaga basketball tickets go on sale,30,,0.00,0.00,,,,"0.00,1.00,1.00,1.00,1.00,1.00,1.00,1.00,1.00,0.66,0.66"
when do illini basketball tickets go on sale,30,,0.00,0.16,,,,"0.00,0.21,0.21,0.21,0.21,1.00,0.21,0.21,0.21,0.21,0.14,0.14"
when do illinois basketball tickets go on sale,30,,0.00,0.16,,,,"0.27,0.27,0.27,1.00,0.27,0.18,0.00,0.27,0.27,0.27,0.00,0.18"
when do indiana basketball tickets go on sale,30,,0.00,0.57,,,,"1.00,0.27,0.27,0.27,0.27,0.27,0.27,0.27,0.27,0.00,0.18,0.18"
when do iu basketball tickets go on sale,30,,0.00,0.10,,,,"0.33,0.33,0.33,0.33,0.77,0.55,0.33,0.33,0.33,0.33,0.22,0.22"
when do ku basketball tickets go on sale,30,,0.00,0.00,,,,"0.33,1.00,1.00,1.00,1.00,1.00,1.00,1.00,1.00,1.00,0.66,0.66"
when do louisville basketball tickets go on sale,30,,0.00,0.11,,,,"1.00,0.33,0.00,0.33,0.33,0.33,0.33,0.00,0.33,0.00,0.22,0.22"
when do michigan state basketball tickets go on sale,30,,0.00,0.00,,,,"0.33,1.00,1.00,1.00,1.00,1.00,1.00,1.00,1.00,1.00,0.66,0.00"
when do ncaa basketball tickets go on sale,30,,1.35,0.24,,,,"0.14,0.14,0.14,0.14,0.14,0.14,0.14,0.14,0.14,0.14,0.09,0.09"
when do ncaa basketball tournament tickets go on sale,30,,0.00,0.10,,,,"0.27,0.27,0.00,0.27,0.27,0.27,0.27,0.27,0.27,0.27,0.18,0.18"
when do notre dame basketball tickets go on sale,30,,0.00,0.00,,,,"0.00,0.60,0.60,0.60,1.00,0.60,0.60,0.60,0.60,0.60,0.00,0.40"
when do ohio state basketball tickets go on sale,30,,0.00,0.00,,,,"0.42,0.42,0.57,0.42,0.71,1.00,0.42,0.42,0.42,0.42,0.00,0.28"
when do osu basketball tickets go on sale,30,,0.00,0.00,,,,"1.00,0.33,0.33,0.33,0.33,0.33,0.33,0.33,0.00,0.00,0.00,0.00"
when do tennessee basketball tickets go on sale,30,,0.00,0.38,,,,"1.00,0.42,0.00,0.42,0.42,0.42,0.42,0.42,0.42,0.42,0.28,0.28"
when is the best time to buy basketball tickets,30,,2.29,0.42,,,,"0.42,0.42,0.42,0.42,0.42,0.42,0.42,0.42,0.42,0.42,0.57,0.28"
when to buy basketball tickets,30,,1.71,0.19,,,,"0.42,0.42,0.42,0.42,0.42,0.42,0.42,0.42,0.42,0.42,0.28,0.28"
where to buy duke basketball tickets,30,,0.00,0.19,,,,"1.00,1.00,1.00,1.00,1.00,1.00,1.00,1.00,1.00,1.00,0.66,0.66"
where to get cheap basketball tickets,30,,2.45,0.55,,,,"0.75,0.75,0.75,0.75,0.75,0.75,0.75,0.75,0.75,0.75,1.00,0.50"
why are basketball tickets so expensive,30,,0.00,0.08,,,,"0.33,1.00,1.00,1.00,1.00,1.00,1.00,1.00,1.00,1.00,0.66,0.66"
why are duke basketball tickets so expensive,30,,0.00,0.00,,,,"0.00,1.00,1.00,1.00,1.00,1.00,1.00,1.00,1.00,0.66,0.66"
a basketball team sells tickets that cost $10,20,,0.00,0.07,,,,"0.00,0.33,0.33,0.00,0.33,0.33,0.33,0.33,0.33,0.33,0.22,0.22"
a basketball team sells tickets that cost $10 $20,20,,0.00,0.00,,,,"0.00,0.11,0.11,0.00,0.11,0.11,0.11,0.00,0.00,0.11,0.07,0.07"
a shortage in tickets for an nba basketball game,20,,0.00,0.00,,,,"0.00,0.14,0.14,0.00,0.14,0.14,0.00,0.00,0.14,0.14,0.09,0.00"
a&m women's basketball tickets,20,,0.00,0.00,,,,"0.00,0.00,0.00,1.00,1.00,1.00,1.00,1.00,1.00,0.66,0.66"
a&t basketball tickets,20,,0.00,0.00,,,,"0.00,0.00,0.60,0.60,0.60,0.60,0.60,1.00,0.60,0.40,0.00"
de la salle basketball tickets,20,,0.00,0.00,,,,"0.00,0.00,1.00,0.00,0.00,1.00,1.00,1.00,1.00,0.66,0.00"
how do duke students get basketball tickets,20,,0.00,0.01,,,,"0.27,0.09,0.09,0.09,0.36,0.09,0.09,0.09,0.09,0.09,1.00,0.18"
how much are alabama basketball tickets,20,,0.00,0.00,,,,"0.33,0.33,0.00,0.33,0.33,0.33,0.33,0.33,0.33,0.33,0.22,0.00"
how much are asu basketball tickets,20,,0.00,0.00,,,,"0.41,0.17,0.17,0.17,0.00,0.00,0.17,0.17,0.17,0.17,0.00,0.00"
how much are basketball hall of fame induction tickets,20,,0.00,0.00,,,,"1.00,0.42,0.00,0.42,0.42,0.00,0.42,0.00,0.42,0.42,0.28,0.00"
how much are basketball tickets in new york,20,,0.00,0.19,,,,"0.42,0.42,0.00,0.00,0.42,0.42,0.42,0.42,0.42,0.42,0.28,0.28"
how much are baylor basketball tickets,20,,0.00,0.00,,,,"0.00,0.00,1.00,1.00,1.00,1.00,1.00,1.00,1.00,0.66,0.66"
how much are big 3 basketball tickets,20,,0.00,0.00,,,,"0.00,1.00,1.00,1.00,0.00,1.00,1.00,0.00,0.00,0.00,0.66"
how much are clemson basketball tickets,20,,0.00,0.05,,,,"0.33,0.33,0.00,0.00,0.33,0.00,0.33,0.33,0.33,0.33,0.22,0.22"
how much are college basketball tickets,20,,0.00,0.00,,,,"0.52,0.17,0.00,0.00,0.00,0.00,0.00,0.05,0.00,0.00,0.17,0.11"
how much are creighton basketball tickets,20,,0.00,0.14,,,,"0.00,0.00,0.00,1.00,1.00,1.00,1.00,1.00,1.00,0.66,0.66"
how much are duke basketball student tickets,20,,0.00,0.00,,,,"0.00,0.00,1.00,1.00,0.00,1.00,1.00,1.00,1.00,0.66,0.00"
how much are high school basketball tickets,20,,0.00,0.00,,,,"0.11,0.11,0.00,0.00,0.00,0.00,0.03,0.07,0.15,0.19,0.03,0.00"
how much are louisville basketball season tickets,20,,0.00,0.02,,,,"0.27,0.27,0.00,0.00,0.27,0.00,0.27,0.27,0.27,0.27,0.18,0.18"
how much are lsu basketball tickets,20,,0.00,0.14,,,,"0.00,0.00,1.00,1.00,1.00,1.00,1.00,1.00,1.00,0.66,0.66"
how much are michigan state basketball tickets,20,,0.00,0.03,,,,"0.33,1.00,0.00,1.00,1.00,1.00,1.00,1.00,1.00,1.00,0.66,0.66"
how much are ncaa basketball national championship tickets,20,,0.00,0.00,,,,"1.00,0.42,0.00,0.00,0.42,0.00,0.42,0.42,0.00,0.42,0.28,0.28"
how much are notre dame basketball tickets,20,,0.00,0.00,,,,"0.00,0.17,0.17,0.00,0.17,0.17,0.17,0.17,0.17,0.17,0.11,0.00"
how much are ole miss basketball tickets,20,,0.00,0.00,,,,"0.00,0.14,0.00,0.14,0.00,0.14,0.14,0.14,0.14,0.00,0.09,0.09"
how much are olympic basketball tickets,20,,0.00,0.00,,,,"0.20,0.60,0.60,0.60,0.60,0.60,0.60,0.60,0.60,0.60,0.00,0.00"
how much are season tickets for duke basketball,20,,0.00,0.03,,,,"0.00,0.42,0.00,0.42,0.42,0.42,0.42,0.42,0.42,0.42,0.28,0.28"
how much are su basketball season tickets,20,,0.00,0.00,,,,"1.00,1.00,1.00,1.00,0.00,1.00,1.00,1.00,1.00,0.00,0.66,0.00"
how much are su basketball tickets,20,,0.00,0.29,,,,"0.00,1.00,1.00,0.00,1.00,1.00,1.00,1.00,1.00,0.66,0.66"
how much are uab basketball tickets,20,,0.00,0.00,,,,"0.00,0.00,0.00,0.00,1.00,1.00,1.00,1.00,1.00,0.66,0.00"
how much are uconn basketball season tickets,20,,0.00,0.02,,,,"0.00,0.11,0.33,0.11,0.33,0.33,0.33,0.33,0.33,0.55,0.22,0.22"
how much are uconn basketball tickets,20,,0.00,0.02,,,,"0.00,0.17,0.00,0.17,0.17,0.17,0.17,0.17,0.17,0.17,0.11,0.11"
how much are ud basketball season tickets,20,,0.00,0.00,,,,"0.00,0.27,0.00,0.27,0.00,0.27,0.27,0.27,0.27,0.27,0.18,0.18"
how much are uva basketball tickets,20,,0.00,0.00,,,,"0.42,0.42,0.00,0.42,0.42,0.42,0.42,0.42,0.00,0.42,0.28,0.00"
how much do duke students pay for basketball tickets,20,,0.00,0.07,,,,"0.00,0.75,0.75,0.00,0.75,0.75,0.75,0.75,0.75,1.00,0.50"
how much do kentucky basketball tickets cost,20,,0.00,0.00,,,,"1.00,0.42,0.00,0.00,0.42,0.00,0.42,0.42,0.00,0.00,0.28,0.00"
how much do ku basketball tickets cost,20,,0.00,0.00,,,,"0.00,0.00,0.00,1.00,1.00,1.00,1.00,0.00,1.00,0.66,0.66"
how much do uk basketball tickets cost,20,,0.00,0.00,,,,"0.00,0.00,1.00,1.00,1.00,1.00,0.00,1.00,1.00,0.00,0.00"
how much do unc basketball tickets cost,20,,0.00,0.00,,,,"0.00,0.00,1.00,1.00,1.00,1.00,1.00,1.00,1.00,0.66,0.66"
