Keyword,Volume,Keyword Difficulty,CPC (USD),Competitive Density,Number of Results,Intent,SERP Features,Trend
how much does a duke basketball ticket cost,20,,0.00,0.00,,,,"0.00,0.60,0.60,0.60,0.60,0.60,0.60,0.00,0.60,0.60,0.40,0.00"
how to buy iu basketball tickets,20,,0.00,0.00,,,,"0.00,0.00,0.00,1.00,1.00,1.00,1.00,1.00,0.00,0.66,0.00"
how to buy msu basketball season tickets,20,,0.00,0.02,,,,"0.00,1.00,1.00,1.00,0.66,0.66"
how to buy uk basketball tickets,20,,0.00,0.00,,,,"0.00,0.00,0.00,1.00,1.00,1.00,1.00,1.00,1.00,0.66,0.00"
how to buy uva basketball tickets,20,,0.00,0.00,,,,"0.00,0.00,1.00,1.00,1.00,1.00,1.00,1.00,0.00,0.00,0.00"
how to find cheap basketball tickets,20,,2.19,0.48,,,,"0.28,0.42,0.00,0.42,0.00,0.42,0.42,0.42,0.42,0.42,0.28,0.28"
how to get cheap duke basketball tickets,20,,0.00,0.00,,,,"0.00,0.00,1.00,1.00,1.00,1.00,1.00,1.00,1.00,0.00,0.00"
how to get kentucky basketball season tickets,20,,0.00,0.00,,,,"0.00,0.00,0.00,0.00,1.00,1.00,1.00,1.00,1.00,0.00,0.66"
how to get ncaa basketball tickets,20,,0.00,0.62,,,,"0.66,1.00,1.00,1.00,0.00,1.00,0.00,1.00,1.00,1.00,0.66,0.66"
how to get tickets to gonzaga basketball,20,,0.00,0.00,,,,"0.00,0.00,1.00,1.00,1.00,1.00,1.00,1.00,1.00,0.66,0.00"
how to get uk basketball season tickets,20,,0.00,0.00,,,,"0.00,1.00,1.00,0.00,1.00,1.00,1.00,1.00,1.00,0.66,0.66"
how to get uk basketball tickets,20,,0.00,0.57,,,,"0.00,0.42,0.00,0.00,0.42,0.42,0.42,0.42,0.42,0.42,0.28,0.28"
how to give basketball tickets as a gift,20,,0.00,0.26,,,,"0.00,0.00,1.00,0.00,1.00,1.00,1.00,1.00,1.00,0.66,0.66"
how to sell basketball tickets online,20,,0.00,0.29,,,,"0.00,0.00,1.00,1.00,1.00,1.00,1.00,1.00,1.00,0.66,0.66"
how to surprise boyfriend with basketball tickets,20,,0.00,0.00,,,,"0.00,0.00,1.00,0.00,1.00,1.00,1.00,1.00,1.00,0.66,0.66"
how to surprise your boyfriend with basketball tickets,20,,0.00,1.00,,,,"0.00,0.00,1.00,1.00,1.00,1.00,1.00,1.00,1.00,0.66,0.66"
how to transfer michigan basketball tickets,20,,0.00,0.00,,,,"0.00,0.00,0.00,0.00,1.00,1.00,1.00,1.00,1.00,0.66,0.00"
what are baseline tickets for basketball,20,,0.00,0.00,,,,"0.33,0.33,0.33,0.33,0.33,0.33,0.00,0.33,0.33,0.00,0.22,0.22"
when do acc basketball tournament tickets go on sale,20,,0.00,0.29,,,,"0.00,1.00,0.00,0.00,1.00,1.00,1.00,1.00,1.00,1.00,0.66,0.66"
when do acc men's basketball tournament tickets go on sale,20,,0.00,0.00,,,,"0.00,0.42,0.00,0.42,0.42,0.42,0.42,0.42,0.42,0.42,0.28,0.28"
when do badger basketball tickets go on sale,20,,0.00,0.00,,,,"1.00,0.42,0.42,0.42,0.42,0.42,0.00,0.00,0.00,0.42,0.28,0.00"
when do big 12 basketball tournament tickets go on sale,20,,0.00,0.00,,,,"0.00,1.00,1.00,1.00,0.00,1.00,1.00,1.00,1.00,0.66,0.00"
when do college basketball tickets go on sale,20,,0.00,0.00,,,,"0.00,1.00,0.45,0.18,0.45,0.27,0.00,0.00,0.00,0.00,0.00,0.09"
when do creighton basketball tickets go on sale,20,,0.00,0.00,,,,"0.33,0.33,0.33,0.33,0.33,0.33,0.33,0.33,0.00,0.00,0.22,0.22"
when do georgetown basketball tickets go on sale,20,,0.00,0.00,,,,"0.00,0.00,1.00,1.00,1.00,1.00,1.00,1.00,1.00,0.00,0.00"
when do iowa basketball tickets go on sale,20,,0.00,0.00,,,,"0.00,1.00,1.00,1.00,1.00,1.00,1.00,0.00,0.00,1.00,0.00,0.00"
when do iowa state basketball tickets go on sale,20,,0.00,0.14,,,,"0.00,1.00,1.00,1.00,1.00,1.00,1.00,1.00,1.00,0.00,0.00,0.66"
when do marquette basketball tickets go on sale,20,,0.00,0.00,,,,"0.00,0.75,0.75,0.75,1.00,1.00,0.75,0.75,0.00,0.00,0.00,0.00"
when do michigan basketball tickets go on sale,20,,0.00,0.00,,,,"0.00,0.75,0.75,0.75,1.00,0.75,0.75,0.75,0.00,0.75,0.50,0.50"
when do michigan state basketball season tickets go on sale,20,,0.00,0.00,,,,"0.66,1.00,0.00,1.00,1.00,1.00,1.00,1.00,0.00,0.00,0.00,0.00"
when do northwestern basketball tickets go on sale,20,,0.00,0.57,,,,"1.00,0.42,0.00,0.42,0.42,0.42,0.42,0.42,0.42,0.00,0.00,0.28"
when do uconn basketball tickets go on sale,20,,0.00,0.00,,,,"0.00,0.00,1.00,1.00,1.00,1.00,0.00,1.00,1.00,0.00,0.66"
when do uconn women's basketball tickets go on sale,20,,0.00,0.14,,,,"0.33,0.33,0.33,0.33,0.33,0.33,0.33,0.33,0.00,0.00,0.22,0.22"
when do vcu basketball tickets go on sale,20,,0.00,0.00,,,,"0.00,0.42,0.42,0.42,0.42,0.42,0.00,0.42,0.42,0.42,0.00,0.00"
when do villanova basketball tickets go on sale,20,,0.00,0.50,,,,"0.00,1.00,0.00,0.00,1.00,1.00,1.00,0.00,1.00,1.00,0.66,0.66"
where can i buy cheap basketball tickets,20,,0.00,0.00,,,,"0.00,1.00,0.00,0.00,1.00,0.00,1.00,1.00,1.00,1.00,0.66,0.00"
where to buy arkansas razorback basketball tickets,20,,0.00,0.57,,,,"0.00,0.00,1.00,1.00,0.00,1.00,1.00,1.00,1.00,0.66,0.66"
where to buy iu basketball tickets,20,,0.00,0.00,,,,"0.00,0.00,0.00,1.00,1.00,1.00,1.00,1.00,1.00,0.00,0.00"
where to buy ku basketball tickets,20,,0.00,0.00,,,,"0.00,0.00,1.00,1.00,1.00,1.00,1.00,1.00,1.00,0.66,0.66"
where to buy syracuse basketball tickets,20,,0.00,0.00,,,,"0.00,0.00,1.00,1.00,0.00,1.00,1.00,1.00,1.00,0.66,0.00"
where to buy uk basketball tickets,20,,0.00,0.00,,,,"0.00,0.00,1.00,0.00,1.00,1.00,1.00,1.00,1.00,0.00,0.00"
where to buy unc basketball tickets,20,,0.00,0.43,,,,"0.00,0.00,0.00,1.00,1.00,1.00,1.00,1.00,1.00,0.66,0.66"
a 10 basketball tournament tickets,10,,0.00,0.00,,,,"0.00,0.00,0.00,1.00,0.00,1.00,0.00,0.00,1.00,0.66,0.00"
a-10 basketball tournament tickets,10,,0.00,0.00,,,,"0.00,0.00,0.00,0.00,1.00,0.00,1.00,0.00,0.00,1.00,1.00,0.00"
are basketball tickets cheaper closer to the date,10,,1.46,0.10,,,,"0.00,0.00,0.00,0.00,0.00,0.00,0.00,1.00,1.00,1.00,0.66,0.66"
do duke students get basketball tickets,10,,0.00,0.00,,,,"0.00,1.00,0.00,0.00,0.00,1.00,0.00,1.00,0.00,0.00,0.66,0.66"
how do ku students get basketball tickets,10,,0.00,0.04,,,,"0.00,0.00,0.00,0.00,0.00,0.00,0.33,1.00,1.00,0.66,0.66"
how do ncaa basketball tournament tickets work,10,,0.00,0.29,,,,"0.00,0.00,0.00,1.00,0.00,0.00,1.00,1.00,1.00,0.66,0.66"
how much are acc basketball tournament tickets,10,,0.00,0.00,,,,"0.00,0.00,1.00,0.00,1.00,0.00,0.00,1.00,1.00,0.00,0.00"
how much are auburn basketball tickets,10,,0.00,0.00,,,,"0.00,0.00,0.00,0.00,0.00,0.00,0.20,1.00,0.40,0.00,0.00"
how much are drake basketball tickets,10,,0.00,0.00,,,,"0.00,0.00,0.00,0.00,0.00,1.00,1.00,1.00,0.00,0.00,0.00"
how much are final four basketball tickets,10,,0.19,0.42,,,,"0.00,0.00,0.00,1.00,0.00,0.00,1.00,0.00,1.00,0.66,0.66"
how much are iowa women's basketball season tickets,10,,0.00,0.00,,,,"1.00,0.00"
how much are mizzou basketball season tickets,10,,0.00,0.00,,,,"0.00,0.00,0.00,0.00,1.00,0.00,0.00,1.00,1.00,0.66,0.66"
how much are ncaa national championship tickets basketball,10,,0.00,0.50,,,,"0.00,0.00,0.00,0.00,0.00,0.00,0.00,0.00,1.00,0.66,0.66"
how much are texas tech basketball tickets,10,,0.00,0.07,,,,"0.00,0.00,0.00,0.00,1.00,0.00,0.00,0.33,0.00,0.00,0.33,0.66"
how much are tickets to the big 12 basketball tournament,10,,0.00,0.00,,,,"0.00,0.00,0.00,1.00,1.00,1.00,0.00,0.00,1.00,0.66,0.00"
how much are ucla basketball tickets for students,10,,0.00,0.00,,,,"0.00,0.00,0.00,0.00,0.00,1.00,1.00,1.00,1.00,0.66,0.66"
how much are virtual basketball tickets,10,,0.00,0.00,,,,"0.00,0.00,0.00,1.00,1.00,1.00,1.00,1.00,0.00,0.00,0.00"
how much do college basketball tickets cost,10,,0.00,0.00,,,,"1.00,0.33,0.00,0.00,0.00,0.00,0.00,0.00,0.00,0.00,0.00,0.00"
how much does a basketball ticket cost,10,,0.38,0.10,,,,"0.00,0.00,0.00,1.00,0.00,0.00,0.00,0.66,0.00,0.00,0.33,0.66"
how much does basketball tickets cost,10,,0.38,0.10,,,,"0.00,0.00,0.00,0.00,0.00,0.00,0.00,0.50,0.50,0.00,0.50,1.00"
how much is a basketball ticket,10,,0.29,0.17,,,,"1.00,1.00,0.00,0.00,0.00,0.25,0.25,0.00,0.00,0.00,0.00,0.00"
how much is a ncaa basketball ticket,10,,0.21,0.19,,,,"0.33,0.33,0.00,0.33,0.00,0.33,0.00,0.33,0.33,0.00,0.66,1.00"
how much were ncaa basketball championship tickets,10,,0.00,0.00,,,,1.00
how much were the ace family basketball tickets,10,,0.00,0.00,,,,"1.00,1.00,1.00,0.00,1.00,0.00,0.00,0.00,0.00,0.00,0.66,0.66"
how to buy basketball tickets online,10,,0.00,0.00,,,,"0.00,0.00,0.00,0.00,1.00,0.00,0.00,1.00,1.00,0.00,0.00"
how to buy high school basketball tickets,10,,0.00,0.00,,,,"0.00,0.00,0.00,0.00,0.00,0.00,0.25,0.00,1.00,0.25,0.00"
how to buy ncaa basketball tickets,10,,0.00,0.43,,,,"0.00,0.00,0.00,0.00,0.00,1.00,1.00,1.00,1.00,0.66,0.66"
how to buy sierra canyon basketball tickets,10,,0.00,0.00,,,,"0.50,0.25,0.00,0.00,0.00,0.25,0.25,1.00,0.25,1.00,0.50,0.00"
how to buy tickets for high school basketball games,10,,0.00,0.00,,,,"1.00,0.00,0.00"
how to get basketball tickets for cheap,10,,1.59,0.49,,,,"0.00,0.00,0.00,0.00,0.00,0.25,0.50,0.75,1.00,1.00,0.00,0.25"
how to get duke basketball tickets cheap,10,,0.00,0.00,,,,"0.00,0.00,0.00,0.00,1.00,0.00,1.00,0.00,0.00,0.00,0.00"
how to get kentucky basketball tickets,10,,0.00,0.00,,,,"0.00,0.00,0.00,1.00,1.00,0.00,0.00,0.00,0.00,0.66,0.00"
how to pull tickets tamu basketball,10,,0.00,0.00,,,,"0.27,0.27,0.00,0.00,0.00,0.00,0.27,0.27,0.27,0.00,0.18,0.00"
how to register for uf basketball tickets,10,,0.00,0.00,,,,"0.00,0.00,0.00,0.00,1.00,1.00,0.00,1.00,0.00,0.66,0.66"
how to transfer ku student basketball tickets,10,,0.00,0.00,,,,"0.00,1.00,1.00,0.00,0.00,0.00,0.00,0.00,1.00,0.00,0.00"
how to transfer umich basketball tickets,10,,0.00,0.00,,,,"0.00,0.00,0.00,0.00,0.00,1.00,0.00,1.00,1.00,0.00,0.00"
when do asu basketball tickets go on sale,10,,0.00,0.00,,,,"0.00,0.00,0.00,1.00,0.00,1.00,0.00,0.00,0.00,0.00,0.00"
when do basketball tickets go on sale 2018,10,,0.00,0.00,,,,"0.00,0.00,1.00,0.00,0.00,0.00,1.00,0.00,0.00,0.00,0.00"
when do iowa hawkeye basketball tickets go on sale,10,,0.00,0.00,,,,"0.00,0.00,1.00,1.00,0.00,0.00,0.00,0.00,0.00,0.66,0.00"
when do iowa state men's basketball tickets go on sale,10,,0.00,0.00,,,,"0.00,0.00,1.00,1.00,1.00,0.00,0.00,0.00,0.00,0.00,0.00"
when do mizzou basketball single game tickets go on sale,10,,0.00,0.00,,,,"0.00,0.00,1.00,0.00,1.00,0.00,1.00,1.00,0.00,0.00,0.00"
when do mizzou basketball tickets go on sale,10,,0.00,0.00,,,,"0.00,0.00,1.00,0.00,1.00,0.00,0.00,0.00,0.00,0.00,0.00"
when do nc state basketball tickets go on sale,10,,0.00,0.00,,,,"0.00,1.00,1.00,1.00,1.00,0.00,0.00,0.00,0.00,0.00,0.00"
when do ohio state mens basketball tickets go on sale,10,,0.00,0.00,,,,"0.00,0.00,1.00,1.00,1.00,0.00,0.00,1.00,0.00,0.00,0.00"
when do st john's basketball tickets go on sale,10,,0.00,0.00,,,,"0.00,0.00,1.00,1.00,0.00,0.00,0.00,0.00,0.00,0.00,0.00"
when do su basketball tickets go on sale,10,,0.00,0.00,,,,"0.00,1.00,1.00,1.00,1.00,1.00,0.00,0.00,0.00,0.00,0.00"
where to buy basketball tickets in new york,10,,0.00,0.00,,,,"0.42,0.14,0.00,0.00,0.00,0.00,0.00,0.00,0.00,0.00,0.00,0.00"
where to buy michigan state basketball tickets,10,,0.00,0.00,,,,"0.00,0.00,0.00,0.00,1.00,1.00,1.00,1.00,0.00,0.00,0.00"
where to buy pba basketball tickets,10,,0.00,0.00,,,,"0.00,1.00,0.00,0.00,0.00,0.00,0.00,1.00,0.00,0.00,0.00"
a 10 basketball tickets,0,,0.00,0.00,,,,"0.00,0.00,0.00,0.00,0.00,0.00,0.00,0.00,0.00,0.00,0.00"
a 10 mens basketball tournament tickets,0,,0.00,0.00,,,,"0.00,0.00,0.00,0.00,0.00,0.00,0.00,0.00,0.00,0.00,0.00"
a and m basketball tickets,0,,0.00,0.00,,,,"0.00,0.00,0.00,0.00,0.00,0.00,0.00,0.00,0.00,0.00,0.00"
a basketball game tickets,0,,0.00,0.00,,,,"0.00,0.00,0.00,0.00,0.00,0.00,0.00,0.00,0.00,0.00,0.00"
a high school basketball team is selling $10 raffle tickets,0,,0.00,0.00,,,,"0.00,0.00,0.00,0.00,0.00,1.00,0.00,0.00,0.50,0.00,0.00"
a state basketball tickets,0,,0.00,0.00,,,,"0.00,0.00,0.00,0.00,0.00,0.00,0.00,0.00,0.00,0.00,0.00"
a&m mens basketball tickets,0,,0.00,0.00,,,,"0.00,0.00,0.00,0.00,0.00,0.00,0.00,0.00,0.00,0.00,0.00"
a&m vs kentucky basketball tickets,0,,0.00,0.00,,,,"1.00,0.00,0.00,0.00"
a&m vs ut basketball tickets,0,,0.00,0.00,,,,"0.00,0.00,0.00,0.00,0.00,0.00,0.00,0.00,0.00,0.00,0.00"
a&t vs nccu basketball tickets,0,,0.00,0.00,,,,"0.00,0.00,0.00,0.00,0.00,0.00,0.00,1.00,0.00,0.00,0.00"
a-state basketball tickets,0,,0.00,0.00,,,,"0.00,0.00,0.00,0.00,0.00,0.00,0.00,0.00,0.00,0.00,0.00"
are 15.50 basketball tickets good barclays,0,,0.00,0.00,,,,"0.00,0.00,0.00,0.00,0.00,0.00,0.00,0.00,0.00,0.00,0.00"
are all tickets to sec womens basketball tournament ga,0,,0.00,0.00,,,,"0.00,0.00,0.00,0.00,0.00,0.00,0.00,0.00,0.00,0.00,0.00"
are basketball tickets free for uci students,0,,0.00,0.00,,,,"0.00,0.00,0.00,0.00,0.00,0.00,0.00,0.00,0.00,0.00,0.00"
are basketball tickets free to georgetown studenst,0,,0.00,0.00,,,,"0.00,0.00,0.00,0.00,0.00,0.00,0.00,0.00,0.00,0.00,0.00"
are basketball tickets on sale,0,,0.00,0.00,,,,"0.00,0.00,0.00,0.00,0.00,0.00,0.00,0.00,0.00,0.00,0.00"
are basketball tickets wholesale or retail,0,,0.00,0.00,,,,"0.00,0.00,0.00,0.00,0.00,0.00,0.00,0.00,0.00,0.00,0.00"
are basketball tickets worth it,0,,0.00,0.00,,,,"0.00,0.00,0.00,0.00,0.00,0.00,0.00,0.00,0.00,0.00,0.00"
are computer selected basketball tickets based on best seat available,0,,0.00,0.00,,,,"0.00,0.00,0.00,0.00,0.00,0.00,0.00,0.00,0.00,0.00,0.00"
are division 3 basketball tickets free,0,,0.00,0.00,,,,"0.00,0.00,0.00,0.00,0.00,0.00,0.00,0.00,0.00,0.00,0.00"
are duke basketball tickets free for students,0,,0.00,0.00,,,,"0.00,0.00,0.00,0.00,0.00,0.00,0.00,0.00,0.00,0.00,0.00"
are exhibition games part of season tickets iowa basketball,0,,0.00,0.00,,,,"0.00,0.00,0.00,0.00,0.00,0.00,0.00,0.00,0.00,0.00,0.00"
are george mason basketball tickets general admission,0,,0.00,0.00,,,,"0.00,0.00,0.00,0.00,0.00,0.00,0.00,0.00,0.00,0.00,0.00"
are iu basketball tickets refundable,0,,0.00,0.00,,,,"0.00,0.00,0.00,0.00,0.00,0.00,0.00,0.00,0.00,0.00,0.00"
are loft tickets good for basketball games,0,,0.00,0.00,,,,"0.00,0.00,0.00,0.00,0.00,0.00,0.00,0.00,0.00,0.00,0.00"
are michael jordan basketball tickets worth anything,0,,0.00,0.00,,,,"0.00,0.00,0.00,0.00,0.00,0.00,0.00,0.00,0.00,0.00,0.00"
are my kentucky basketball tickets real,0,,0.00,0.00,,,,"0.00,0.00,0.00,0.00,0.00,0.00,0.00,0.00,0.00,0.00,0.00"
are phase 1 ticketes to basketball good,0,,0.00,0.00,,,,"0.00,0.00,0.00,0.00,0.00,0.00,0.00,0.00,0.00,0.00,0.00"
are tennessee basketball tickets for sale,0,,0.00,0.00,,,,"0.00,0.00,0.00,0.00,0.00,0.00,0.00,0.00,0.00,0.00,0.00"
are there guest tickets for gator basketball,0,,0.00,0.00,,,,"0.00,0.00,0.00,0.00,0.00,0.00,0.00,0.00,0.00,0.00,0.00"
are tickets availabale for the bellarmine vs indinaapolis basketball game,0,,0.00,0.00,,,,"0.00,0.00,0.00,0.00,0.00,0.00,0.00,0.00,0.00,0.00,0.00"
are tickets availabale for the bellarmine vs indy basketball game,0,,0.00,0.00,,,,"0.00,0.00,0.00,0.00,0.00,0.00,0.00,0.00,0.00,0.00,0.00"
are tickets sold out for ky vs tn basketball,0,,0.00,0.00,,,,"0.00,0.00,0.00,0.00,0.00,0.00,0.00,0.00,0.00,0.00,0.00"
are wake forest men's basketball season tickets worth it,0,,0.00,0.00,,,,"0.00,0.00,0.00,0.00,0.00,0.00,0.00,0.00,0.00,0.00,0.00"
are womens georgia basketball tickets all general admission,0,,0.00,0.00,,,,"0.00,0.00,0.00,0.00,0.00,0.00,0.00,0.00,0.00,0.00,0.00"
can a basketball ticket expire,0,,0.00,0.00,,,,"0.00,0.00,0.00,0.00,0.00,0.00,0.00,0.00,0.00,0.00,0.00"
can duke students sell college basketball tickets,0,,0.00,0.00,,,,"0.00,0.00,0.00,0.00,0.00,0.00,0.00,0.00,0.00,0.00,0.00"
can duke students sell their basketball tickets,0,,0.00,0.00,,,,"0.00,0.00,0.00,0.00,0.00,0.00,0.00,0.00,0.00,0.00,0.00"
can i buy basketball student guest tickets,0,,0.00,0.00,,,,"0.00,0.00,0.00,0.00,0.00,0.00,0.00,0.00,0.00,0.00,0.00"
can i buy ticket at marshall basketball game gate,0,,0.00,0.00,,,,"0.00,0.00,0.00,0.00,0.00,0.00,0.00,0.00,0.00,0.00,0.00"
can i pre buy randolph macon mens basketball tickets 2019,0,,0.00,0.00,,,,"0.00,0.00,0.00,0.00,0.00,0.00,0.00,0.00,0.00,0.00,0.00"
can i purchase marshall basketball tickets at the gate,0,,0.00,0.00,,,,"0.00,0.00,0.00,0.00,0.00,0.00,0.00,0.00,0.00,0.00,0.00"
can i transfer my wichita state basketball tickets,0,,0.00,0.00,,,,"0.00,0.00,0.00,0.00,0.00,0.00,0.00,0.00,0.00,0.00,0.00"
can i use my phone for iowa men's basketball tickets,0,,0.00,0.00,,,,"0.00,0.00,0.00,0.00,0.00,0.00,0.00,0.00,0.00,0.00,0.00"
can iupui students get student tickets at iu basketball games,0,,0.00,0.00,,,,"0.00,0.00,0.00,0.00,0.00,0.00,0.00,0.00,0.00,0.00,0.00"
can ncaa basketball all-season ticket be sold separate,0,,0.00,0.00,,,,"0.00,0.00,0.00,0.00,0.00,0.00,0.00,0.00,0.00,0.00,0.00"
can ncaa basketball all-season ticket be sold separately,0,,0.00,0.00,,,,"0.00,0.00,0.00,0.00,0.00,0.00,0.00,0.00,0.00,0.00,0.00"
can santa fe students get uf basketball tickets,0,,0.00,0.00,,,,"0.00,0.00,0.00,0.00,0.00,0.00,0.00,0.00,0.00,0.00,0.00"
can students buy syracuse basketball tickets at the door,0,,0.00,0.00,,,,"0.00,0.00,0.00,0.00,0.00,0.00,0.00,0.00,0.00,0.00,0.00"
can students buy uf basketball tickets cheaper than normal prices,0,,0.00,0.00,,,,"0.00,0.00,0.00,0.00,0.00,0.00,0.00,0.00,0.00,0.00,0.00"
can ticket price decrease for basketball games,0,,0.00,0.00,,,,"0.00,0.00,0.00,0.00,0.00,0.00,0.00,0.00,0.00,0.00,0.00"
can u make pymts on season tickets to duke basketball,0,,0.00,0.00,,,,"0.00,0.00,0.00,0.00,0.00,0.00,0.00,0.00,0.00,0.00,0.00"
can use sell gcu basketball tickets,0,,0.00,0.00,,,,"0.00,0.00,0.00,0.00,0.00,0.00,0.00,0.00,0.00,0.00,0.00"
can uva studens buy guest basketball tickets,0,,0.00,0.00,,,,"0.00,0.00,0.00,0.00,0.00,0.00,0.00,0.00,0.00,0.00,0.00"
can you buy basketball only tickets mizzou student,0,,0.00,0.00,,,,"0.00,0.00,0.00,0.00,0.00,0.00,0.00,0.00,0.00,0.00,0.00"
can you buy basketball tickets,0,,0.00,0.00,,,,"0.00,0.00,0.00,0.00,0.00,0.00,0.00,0.00,0.00,0.00,0.00"
can you buy ncaa women's basketball tickets at gill,0,,0.00,0.00,,,,"0.00,0.00,0.00,0.00,0.00,0.00,0.00,0.00,0.00,0.00,0.00"
can you buy ncaa women's basketball tickets at the gate,0,,0.00,0.00,,,,"0.00,0.00,0.00,0.00,0.00,0.00,0.00,0.00,0.00,0.00,0.00"
can you buy providence college basketball tickets day of game,0,,0.00,0.00,,,,"0.00,0.00,0.00,0.00,0.00,0.00,0.00,0.00,0.00,0.00,0.00"
can you buy su women's basketball tickets day of game,0,,0.00,0.00,,,,"0.00,0.00,0.00,0.00,0.00,0.00,0.00,0.00,0.00,0.00,0.00"
can you buy su womens basketball tickets day of game,0,,0.00,0.00,,,,"0.00,0.00,0.00,0.00,0.00,0.00,0.00,0.00,0.00,0.00,0.00"
can you buy tickets for uncg basketball at gate,0,,0.00,0.00,,,,"0.00,0.00,0.00,0.00,0.00,0.00,0.00,0.00,0.00,0.00,0.00"
can you buy tickets to missouri high school basketball championships,0,,0.00,0.00,,,,"0.00,0.00,0.00,0.00,0.00,0.00,0.00,0.00,0.00,0.00,0.00"
can you buy ul basketball tickets in person,0,,0.00,0.00,,,,"0.00,0.00,0.00,0.00,0.00,0.00,0.00,0.00,0.00,0.00,0.00"
can you buy unlv basketball tickets,0,,0.00,0.00,,,,"0.00,0.00,0.00,0.00,0.00,0.00,0.00,0.00,0.00,0.00,0.00"
can you buy unlv basketball tickets at box office,0,,0.00,0.00,,,,"0.00,0.00,0.00,0.00,0.00,0.00,0.00,0.00,0.00,0.00,0.00"
can you buy unlv basketball tickets at the door,0,,0.00,0.00,,,,"0.00,0.00,0.00,0.00,0.00,0.00,0.00,0.00,0.00,0.00,0.00"
can you buy unlv basketball tickets on site,0,,0.00,0.00,,,,"0.00,0.00,0.00,0.00,0.00,0.00,0.00,0.00,0.00,0.00,0.00"
can you buy wholesale basketball tickets,0,,0.00,0.00,,,,"0.00,0.00,0.00,0.00,0.00,0.00,0.00,0.00,0.00,0.00,0.00"
can you buy womens basketball tickets day of game,0,,0.00,0.00,,,,"0.00,0.00,0.00,0.00,0.00,0.00,0.00,0.00,0.00,0.00,0.00"
can you exchange ticketmaster basketball tickets,0,,0.00,0.00,,,,"0.00,0.00,0.00,0.00,0.00,0.00,0.00,0.00,0.00,0.00,0.00"
can you give away your sdsu basketball ticket,0,,0.00,0.00,,,,"0.00,0.00,0.00,0.00,0.00,0.00,0.00,0.00,0.00,0.00,0.00"
can you give away your sdsu basketball ticket reddit,0,,0.00,0.00,,,,"0.00,0.00,0.00,0.00,0.00,0.00,0.00,0.00,0.00,0.00,0.00"
can you pre buy randolph macon mens basketball tickets,0,,0.00,0.00,,,,"0.00,0.00,0.00,0.00,0.00,0.00,0.00,0.00,0.00,0.00,0.00"
can you pre buy randolph macon mens basketball tickets 2019,0,,0.00,0.00,,,,"0.00,0.00,0.00,0.00,0.00,0.00,0.00,0.00,0.00,0.00,0.00"
can you resell basketball tickets with your name on them,0,,0.00,0.00,,,,"0.00,0.00,0.00,0.00,0.00,0.00,0.00,0.00,0.00,0.00,0.00"
can you return byu basketball season tickets for a rerund,0,,0.00,0.00,,,,"0.00,0.00,0.00,0.00,0.00,0.00,0.00,0.00,0.00,0.00,0.00"
can you take a picture of a basketball ticket,0,,0.00,0.00,,,,"0.00,0.00,0.00,0.00,0.00,0.00,0.00,0.00,0.00,0.00,0.00"
can you transfer ku basketball tickets,0,,0.00,0.00,,,,"0.00,0.00,0.00,0.00,0.00,0.00,0.00,0.00,0.00,0.00,0.00"
can you upgrade basketball tickets,0,,0.00,0.00,,,,"0.00,0.00,0.00,0.00,0.00,0.00,0.00,0.00,0.00,0.00,0.00"
can you upgrade uf basketball student tickets,0,,0.00,0.00,,,,"0.00,0.00,0.00,0.00,0.00,0.00,0.00,0.00,0.00,0.00,0.00"
can you use your phone for uc bearcats basketball tickets,0,,0.00,0.00,,,,"0.00,0.00,0.00,0.00,0.00,0.00,0.00,0.00,0.00,0.00,0.00"
did obama pay for his basketball tickets,0,,0.00,0.00,,,,"0.00,0.00,0.00,0.00,0.00,0.00,0.00,0.00,0.00,0.00,0.00"
did you chexk the college basketball ticket,0,,0.00,0.00,,,,"0.00,0.00,0.00,0.00,0.00,0.00,0.00,0.00,0.00,0.00,0.00"
do 3 year old mees ticket louisville basketball,0,,0.00,0.00,,,,"0.00,0.00,0.00,0.00,0.00,0.00,0.00,0.00,0.00,0.00,0.00"
do alum get discount on u of w basketball tickets,0,,0.00,0.00,,,,"0.00,0.00,0.00,0.00,0.00,0.00,0.00,0.00,0.00,0.00,0.00"
do asu students get free basketball tickets,0,,0.00,0.00,,,,"0.00,0.00,0.00,0.00,0.00,0.00,0.00,0.00,0.00,0.00,0.00"
do clemson students get basketball tickets,0,,0.00,0.00,,,,"0.00,0.00,0.00,0.00,0.00,0.00,0.00,0.00,0.00,0.00,0.00"
do college basketball players get free tickets for family,0,,0.00,0.00,,,,"0.00,0.00,0.00,0.00,0.00,0.00,0.00,0.00,0.00,0.00,0.00"
do duke athletes get basketball tickets for north carolina,0,,0.00,0.00,,,,"0.00,0.00,0.00,0.00,0.00,0.00,0.00,0.00,0.00,0.00,0.00"
do duke students get free men's basketball tickets,0,,0.00,0.00,,,,"0.00,0.00,0.00,0.00,0.00,0.00,0.00,0.00,0.00,0.00,0.00"
do duke students get free men's basketball tickets reddit,0,,0.00,0.00,,,,"0.00,0.00,0.00,0.00,0.00,0.00,0.00,0.00,0.00,0.00,0.00"
do duke students get free mens basketball tickets,0,,0.00,0.00,,,,"0.00,0.00,0.00,0.00,0.00,0.00,0.00,0.00,0.00,0.00,0.00"
do ex basketball players get free tickets,0,,0.00,0.00,,,,"0.00,0.00,0.00,0.00,0.00,0.00,0.00,0.00,0.00,0.00,0.00"
do fsu students get free basketball tickets,0,,0.00,0.00,,,,"0.00,0.00,0.00,0.00,0.00,0.00,0.00,0.00,0.00,0.00,0.00"
do i get discounted guest tickets basketball gatech,0,,0.00,0.00,,,,"0.00,0.00,0.00,0.00,0.00,0.00,0.00,0.00,0.00,0.00,0.00"
do i get free tickets unlv basketball,0,,0.00,0.00,,,,"0.00,0.00,0.00,0.00,0.00,0.00,0.00,0.00,0.00,0.00,0.00"
do i have to print lsu basketball tickets,0,,0.00,0.00,,,,"0.00,0.00,0.00,0.00,0.00,0.00,0.00,0.00,0.00,0.00,0.00"
do lafayette basketball season tickets include the lehigh game,0,,0.00,0.00,,,,"0.00,0.00,0.00,0.00,0.00,0.00,0.00,0.00,0.00,0.00,0.00"
do ncaa basketball players family get free tickets,0,,0.00,0.00,,,,"0.00,0.00,0.00,0.00,0.00,0.00,0.00,0.00,0.00,0.00,0.00"
do people sell basketball tickets for less closer to gam,0,,0.00,0.00,,,,"0.00,0.00,0.00,0.00,0.00,0.00,0.00,0.00,0.00,0.00,0.00"
do people sell basketball tickets for less closer to game,0,,0.00,0.00,,,,"0.00,0.00,0.00,0.00,0.00,0.00,0.00,0.00,0.00,0.00,0.00"
do student tickets work for postseason basketball baylor womes,0,,0.00,0.00,,,,"0.00,0.00,0.00,0.00,0.00,0.00,0.00,0.00,0.00,0.00,0.00"
do students at uk get tickets for basketball games,0,,0.00,0.00,,,,"0.00,0.00,0.00,0.00,0.00,0.00,0.00,0.00,0.00,0.00,0.00"
do students need tickets to alabama basketball games,0,,0.00,0.00,,,,"0.00,0.00,0.00,0.00,0.00,0.00,0.00,0.00,0.00,0.00,0.00"
do tickets for the acc men's basketball championship sell out,0,,0.00,0.00,,,,"0.00,0.00,0.00,0.00,0.00,0.00,0.00,0.00,0.00,0.00,0.00"
do uconn students get basketball tickets,0,,0.00,0.00,,,,"0.00,0.00,0.00,0.00,0.00,0.00,0.00,0.00,0.00,0.00,0.00"
do uf basketball tickets cost money for students,0,,0.00,0.00,,,,"0.00,0.00,0.00,0.00,0.00,0.00,0.00,0.00,0.00,0.00,0.00"
do uf students get free basketball tickets,0,,0.00,0.00,,,,"0.00,0.00,0.00,0.00,0.00,0.00,0.00,0.00,0.00,0.00,0.00"
do uf students have to pickup basketball tickets,0,,0.00,0.00,,,,"0.00,0.00,0.00,0.00,0.00,0.00,0.00,0.00,0.00,0.00,0.00"
do wright state students get free basketball tickets,0,,0.00,0.00,,,,"0.00,0.00,0.00,0.00,0.00,0.00,0.00,0.00,0.00,0.00,0.00"
do yiu need tickets for uccs basketball games,0,,0.00,0.00,,,,"0.00,0.00,0.00,0.00,0.00,0.00,0.00,0.00,0.00,0.00,0.00"
do you need tickets for clearfield high girls basketball games,0,,0.00,0.00,,,,"0.00,0.00,0.00,0.00,0.00,0.00,0.00,0.00,0.00,0.00,0.00"
do you need tickets for fsu basketball game,0,,0.00,0.00,,,,"0.00,0.00,0.00,0.00,0.00,0.00,0.00,0.00,0.00,0.00,0.00"
does 3 years old need basketball game tickets,0,,0.00,0.00,,,,"0.00,0.00,0.00,0.00,0.00,0.00,0.00,0.00,0.00,0.00,0.00"
does cougar still have season tickets for iu basketball,0,,0.00,0.00,,,,"0.00,0.00,0.00,0.00,0.00,0.00,0.00,0.00,0.00,0.00,0.00"
does duke allow resale of basketball tickets,0,,0.00,0.00,,,,"0.00,0.00,0.00,0.00,0.00,0.00,0.00,0.00,0.00,0.00,0.00"
does ku basketball have a ticket booth,0,,0.00,0.00,,,,"0.00,0.00,0.00,0.00,0.00,0.00,0.00,0.00,0.00,0.00,0.00"
does mellencamp still have season tickets for iu basketball,0,,0.00,0.00,,,,"0.00,0.00,0.00,0.00,0.00,0.00,0.00,0.00,0.00,0.00,0.00"
has ku basketball sent out season tickets yet,0,,0.00,0.00,,,,"0.00,0.00,0.00,0.00,0.00,0.00,0.00,0.00,0.00,0.00,0.00"
have lady vols basketball tickets been mailed,0,,0.00,0.00,,,,"0.00,0.00,0.00,0.00,0.00,0.00,0.00,0.00,0.00,0.00,0.00"
how are visitor tickets handled for southern conference basketball games,0,,0.00,0.00,,,,"0.00,0.00,0.00,0.00,0.00,0.00,0.00,0.00,0.00,0.00,0.00"
how can an illinois state university student get basketball tickets,0,,0.00,0.00,,,,"0.00,0.00,0.00,0.00,0.00,0.00,0.00,0.00,0.00,0.00,0.00"
how can depaul students buy basketball tickets,0,,0.00,0.00,,,,"0.00,0.00,0.00,0.00,0.00,0.00,0.00,0.00,0.00,0.00,0.00"
how can i buy fau basketball tickets,0,,0.00,0.00,,,,"0.00,0.00,0.00,0.00,0.00,0.00,0.00,0.00,0.00,0.00,0.00"
