Keyword,Volume,Keyword Difficulty,CPC (USD),Competitive Density,Number of Results,Intent,SERP Features,Trend
what happened to hartsock byu basketball player,0,,0.00,0.00,,,,"0.00,0.00,0.00,0.00,0.00,0.00,0.00,0.00,0.00,0.00,0.00"
what happened to hayward basketball player,0,,0.00,0.00,,,,"0.00,0.00,0.00,0.00,0.00,0.00,0.00,0.00,0.00,0.00,0.00"
what happened to high school basketball national teams rankings history,0,,0.00,0.00,,,,"0.00,0.00,0.00,0.00,0.00,0.00,0.00,0.00,0.00,0.00,0.00"
what happened to husker basketball team this season,0,,0.00,0.00,,,,"0.00,0.00,0.00,0.00,0.00,0.00,0.00,0.00,0.00,0.00,0.00"
what happened to ice cube's basketball league,0,,0.00,0.00,,,,"0.00,0.00,0.00,0.00,0.00,0.00,0.00,0.00,0.00,0.00,0.00"
what happened to ice cubes basketball league,0,,0.00,0.00,,,,"0.00,0.00,0.00,0.00,0.00,0.00,0.00,0.00,0.00,0.00,0.00"
what happened to illinois basketball,0,,0.00,0.00,,,,"0.00,0.00,0.00,0.00,0.00,0.00,0.00,0.00,0.00,0.00,0.00"
what happened to illinois basketball player,0,,0.00,0.00,,,,"0.00,0.00,0.00,0.00,0.00,0.00,0.00,0.00,0.00,0.00,0.00"
what happened to illinois basketball today,0,,0.00,0.00,,,,"0.00,0.00,0.00,0.00,0.00,0.00,0.00,0.00,0.00,0.00,0.00"
what happened to imani from basketball wives,0,,0.00,0.00,,,,"0.00,0.00,0.00,0.00,0.00,0.00,0.00,0.00,0.00,0.00,0.00"
what happened to imani on basketball wives,0,,0.00,0.00,,,,"0.00,0.00,0.00,0.00,0.00,0.00,0.00,0.00,0.00,0.00,0.00"
what happened to indiana state basketball,0,,0.00,0.00,,,,"0.00,0.00,0.00,0.00,0.00,0.00,0.00,0.00,0.00,0.00,0.00"
what happened to injured auburn basketball player,0,,0.00,0.00,,,,"0.00,0.00,0.00,0.00,0.00,0.00,0.00,0.00,0.00,0.00,0.00"
what happened to iowa basketball coach,0,,0.00,0.00,,,,"0.00,0.00,0.00,0.00,0.00,0.00,0.00,0.00,0.00,0.00,0.00"
what happened to iowa basketball player pensel,0,,0.00,0.00,,,,"0.00,0.00,0.00,0.00,0.00,0.00,0.00,0.00,0.00,0.00,0.00"
what happened to iso basketball,0,,0.00,0.00,,,,"0.00,0.00,0.00,0.00,0.00,0.00,0.00,0.00,0.00,0.00,0.00"
what happened to iu basketball vs indana state,0,,0.00,0.00,,,,"0.00,0.00,0.00,0.00,0.00,0.00,0.00,0.00,0.00,0.00,0.00"
what happened to iu hoosiers basketball team,0,,0.00,0.00,,,,"0.00,0.00,0.00,0.00,0.00,0.00,0.00,0.00,0.00,0.00,0.00"
what happened to jack taylor basketball,0,,0.00,0.00,,,,"0.00,1.00,0.00,0.00,0.00,0.00,0.00,0.00,0.00,0.00,0.00"
what happened to jackie from basketball wives grandson,0,,0.00,0.00,,,,"0.00,0.00,0.00,0.00,0.00,0.00,0.00,0.00,0.00,0.00,0.00"
what happened to jalen hill ucla basketball,0,,0.00,0.00,,,,"0.00,0.00,0.00,0.00,0.00,0.00,0.00,0.00,0.00,0.00,0.00"
what happened to jason williams basketball,0,,0.00,0.00,,,,"0.00,0.00,0.00,0.00,0.00,0.00,0.00,0.00,0.00,0.00,0.00"
what happened to jason williams nba basketball player,0,,0.00,0.00,,,,"0.00,0.00,0.00,0.00,0.00,0.00,0.00,0.00,0.00,0.00,0.00"
what happened to jason williams the basketball player,0,,0.00,0.00,,,,"1.00,0.00,0.00,0.00,0.00,0.00,0.00,0.00,0.00,0.00,0.00"
what happened to jay williams basketball,0,,0.00,0.00,,,,"0.00,0.00,0.00,0.00,0.00,0.00,0.00,0.00,0.00,0.00,0.00"
what happened to jayson williams basketball player,0,,0.00,0.00,,,,"0.00,0.00,0.00,0.00,0.00,0.00,0.00,0.00,0.00,0.00,0.00"
what happened to jelly basketball player,0,,0.00,0.00,,,,"0.00,0.00,0.00,0.00,0.00,0.00,0.00,0.00,0.00,0.00,0.00"
what happened to jen on basketball wives,0,,0.00,0.00,,,,"0.00,0.00,0.00,0.00,0.00,0.00,0.00,0.00,0.00,0.00,0.00"
what happened to jennifer and evelyn from basketball wives,0,,0.00,0.00,,,,"0.00,0.00,0.00,0.00,0.00,0.00,0.00,0.00,0.00,0.00,0.00"
what happened to jeremy lin basketball player,0,,0.00,0.00,,,,"0.00,0.00,0.00,0.00,0.00,0.00,0.00,0.00,0.00,0.00,0.00"
what happened to joe good napoleon high school basketball coach,0,,0.00,0.00,,,,"0.00,0.00,0.00,0.00,0.00,0.00,0.00,0.00,0.00,0.00,0.00"
what happened to joey hassett basketball,0,,0.00,0.00,,,,"0.00,0.00,0.00,0.00,0.00,0.00,0.00,0.00,0.00,0.00,0.00"
what happened to jump ball in basketball,0,,0.00,0.00,,,,"0.00,0.00,0.00,0.00,0.00,0.00,0.00,0.00,0.00,0.00,0.00"
what happened to kansas basketball this year,0,,0.00,0.00,,,,"0.00,0.00,0.00,0.00,0.00,0.00,0.00,0.00,0.00,0.00,0.00"
what happened to kansas state basketball coach,0,,0.00,0.00,,,,"0.00,0.00,0.00,0.00,0.00,0.00,0.00,0.00,0.00,0.00,0.00"
what happened to katie benzen on harvard basketball,0,,0.00,0.00,,,,"0.00,0.00,0.00,0.00,0.00,0.00,0.00,0.00,0.00,0.00,0.00"
what happened to keith williams uc basketball,0,,0.00,0.00,,,,"0.00,0.00,0.00,0.00,0.00,0.00,0.00,0.00,0.00,0.00,0.00"
what happened to kenny george basketball,0,,0.00,0.00,,,,"0.00,0.00,0.00,0.00,0.00,0.00,0.00,0.00,0.00,0.00,0.00"
what happened to kenny george the 7'7 basketball player,0,,0.00,0.00,,,,"0.00,0.00,0.00,0.00,0.00,0.00,0.00,0.00,0.00,0.00,0.00"
what happened to kenny on basketball wifes,0,,0.00,0.00,,,,"0.00,0.00,0.00,0.00,0.00,0.00,0.00,0.00,0.00,0.00,0.00"
what happened to kentucky basketball player,0,,0.00,0.00,,,,"0.00,0.00,0.00,0.00,0.00,0.00,0.00,0.00,0.00,0.00,0.00"
what happened to kentucky basketball team,0,,0.00,0.00,,,,"0.00,0.00,0.00,0.00,0.00,0.00,0.00,0.00,0.00,0.00,0.00"
what happened to kentucky basketball this year,0,,0.00,0.00,,,,"0.00,0.00,0.00,0.00,0.00,0.00,0.00,0.00,0.00,0.00,0.00"
what happened to kentucky women's basketball coach,0,,0.00,0.00,,,,"0.00,0.00,0.00,0.00,0.00,0.00,0.00,0.00,0.00,0.00,0.00"
what happened to kevin durant basketball player,0,,0.00,0.00,,,,"0.00,0.00,0.00,0.00,0.00,0.00,0.00,0.00,0.00,0.00,0.00"
what happened to kobe basketball player,0,,0.00,0.00,,,,"0.00,0.00,0.00,0.00,0.00,0.00,0.00,0.00,0.00,0.00,0.00"
what happened to kobe bryant the basketball player,0,,0.00,0.00,,,,"0.00,0.00,0.00,0.00,0.00,0.00,0.00,0.00,0.00,0.00,0.00"
what happened to ku basketball player vick,0,,0.00,0.00,,,,"0.00,0.00,0.00,0.00,0.00,0.00,0.00,0.00,0.00,0.00,0.00"
what happened to ky basketball,0,,0.00,0.00,,,,"0.00,0.00,0.00,0.00,0.00,0.00,0.00,0.00,0.00,0.00,0.00"
what happened to ky colonels basketball team,0,,0.00,0.00,,,,"0.00,0.00,0.00,0.00,0.00,0.00,0.00,0.00,0.00,0.00,0.00"
what happened to lackawanna colleges basketball,0,,0.00,0.00,,,,"0.00,0.00,0.00,0.00,0.00,0.00,0.00,0.00,0.00,0.00,0.00"
what happened to lady assistant coach on beaver women's basketball,0,,0.00,0.00,,,,"0.00,0.00,0.00,0.00,0.00,0.00,0.00,0.00,0.00,0.00,0.00"
what happened to lady assistant coach on osu women's basketball,0,,0.00,0.00,,,,"0.00,0.00,0.00,0.00,0.00,0.00,0.00,0.00,0.00,0.00,0.00"
what happened to lady assistant on osu women's basketball,0,,0.00,0.00,,,,"0.00,0.00,0.00,0.00,0.00,0.00,0.00,0.00,0.00,0.00,0.00"
what happened to lady vols basketball,0,,0.00,0.00,,,,"0.00,0.00,0.00,0.00,0.00,0.00,0.00,0.00,0.00,0.00,0.00"
what happened to lagerald vick kansas basketball,0,,0.00,0.00,,,,"0.00,0.00,0.00,0.00,0.00,0.00,0.00,0.00,0.00,0.00,0.00"
what happened to lamar odom basketball,0,,0.00,0.00,,,,"0.00,0.00,0.00,0.00,0.00,0.00,0.00,0.00,0.00,0.00,0.00"
what happened to lamar odom basketball player,0,,0.00,0.00,,,,"0.00,0.00,0.00,0.00,0.00,0.00,0.00,0.00,0.00,0.00,0.00"
what happened to lamar odom's basketball career,0,,0.00,0.00,,,,"0.00,0.00"
what happened to lamar the basketball player,0,,0.00,0.00,,,,"0.00,0.00,0.00,0.00,0.00,0.00,0.00,0.00,0.00,0.00,0.00"
what happened to larry johnson basketball,0,,0.00,0.00,,,,"0.00,0.00,0.00,0.00,0.00,0.00,0.00,0.00,0.00,0.00,0.00"
what happened to larry johnson the basketball player,0,,0.00,0.00,,,,"0.00,0.00,0.00,0.00,0.00,0.00,0.00,0.00,0.00,0.00,0.00"
what happened to last chance u basketball,0,,0.00,0.00,,,,"0.00,0.00,0.00,0.00,0.00,0.00,0.00,0.00,0.00,0.00,1.00"
what happened to last chance u basketball players,0,,0.00,0.00,,,,"0.00,0.00,0.00,0.00,0.00,0.00,0.00,0.00,0.00,0.00,0.00"
what happened to last chance u players basketball,0,,0.00,0.00,,,,"0.00,0.00,0.00,0.00,0.00,0.00,0.00,0.00,0.00,0.00,0.00"
what happened to last years syracuse mens basketball team,0,,0.00,0.00,,,,"0.00,0.00,0.00,0.00,0.00,0.00,0.00,0.00,0.00,0.00,0.00"
what happened to lavar ball basketball league,0,,0.00,0.00,,,,"0.00,0.00,0.00,0.00,0.00,0.00,0.00,0.00,0.00,0.00,0.00"
what happened to len bias basketball player,0,,0.00,0.00,,,,"0.00,0.00,0.00,0.00,0.00,1.00,0.00,0.00,1.00,0.00,0.00"
what happened to lithuania basketball,0,,0.00,0.00,,,,"0.00,0.00,0.00,0.00,0.00,0.00,0.00,0.00,0.00,0.00,0.00"
what happened to livers from michigan basketball,0,,0.00,0.00,,,,"0.00,0.00,0.00,0.00,0.00,0.00,0.00,0.00,0.00,0.00,0.00"
what happened to livers on michigan basketball team,0,,0.00,0.00,,,,"0.00,0.00,0.00,0.00,0.00,0.00,0.00,0.00,0.00,0.00,0.00"
what happened to louisiana tech women's basketball,0,,0.00,0.00,,,,"0.00,0.00,0.00,0.00,0.00,0.00,0.00,0.00,0.00,0.00,0.00"
what happened to louisville basketball player,0,,0.00,0.00,,,,"0.00,0.00,0.00,0.00,0.00,1.00,0.00,0.00,0.00,0.66,0.00"
what happened to louisville basketball player today,0,,0.00,0.00,,,,"0.00,0.00,0.00,0.00,0.00,0.00,0.00,0.00,0.00,0.00,0.00"
what happened to louisville basketball program,0,,0.00,0.00,,,,"0.00,0.00,0.00,0.00,0.00,0.00,0.00,0.00,0.00,0.00,0.00"
what happened to louisville college basketball player,0,,0.00,0.00,,,,"0.00,0.00,0.00,0.00,0.00,0.00,0.00,0.00,0.00,0.00,0.00"
what happened to louisville's basketball coach,0,,0.00,0.00,,,,"1.00,0.00,0.00"
what happened to love and basketball on netflix,0,,0.00,0.00,,,,"0.00,0.00,0.00,0.00,0.00,0.00,0.00,0.00,0.00,0.00,0.00"
what happened to loyola basketball,0,,0.00,0.00,,,,"0.00,0.00,0.00,0.00,0.00,0.00,0.00,0.00,0.00,0.00,0.00"
what happened to loyola basketball this season,0,,0.00,0.00,,,,"0.00,0.00,0.00,0.00,0.00,0.00,0.00,0.00,0.00,0.00,0.00"
what happened to loyola chicago basketball,0,,0.00,0.00,,,,"0.00,0.00,0.00,0.00,0.00,0.00,0.00,0.00,0.00,0.00,0.00"
what happened to loyola this year basketball,0,,0.00,0.00,,,,"0.00,0.00,0.00,0.00,0.00,0.00,0.00,0.00,0.00,0.00,0.00"
what happened to lsu basketball team,0,,0.00,0.00,,,,"0.00,0.00,0.00,0.00,0.00,0.00,0.00,0.00,0.00,0.00,0.00,1.00"
what happened to lsu head coach basketball,0,,0.00,0.00,,,,"0.00,0.00"
what happened to lsu women's basketball coach,0,,0.00,0.00,,,,"0.00,0.00,0.00,0.00,0.00,0.00,0.00,0.00,0.00,0.00,1.00"
what happened to mahmoud abdul-rauf basketball,0,,0.00,0.00,,,,"0.00,0.00,0.00,0.00,0.00,0.00,0.00,0.00,0.00,0.00,0.00"
what happened to malaysia brother from basketball wives,0,,0.00,0.00,,,,"0.00,0.00,0.00,0.00,0.00,0.00,0.00,0.00,0.00,0.00,0.00"
what happened to malaysia on basketball wives brother,0,,0.00,0.00,,,,"0.00,0.00,0.00,0.00,0.00,0.00,0.00,0.00,0.00,0.00,0.00"
what happened to malaysia's brother from basketball wives,0,,0.00,0.00,,,,"0.00,0.00,0.00,0.00,0.00,0.00,0.00,0.00,0.00,0.00,0.00"
what happened to malaysia's brother on basketball wives,0,,0.00,0.00,,,,"0.00,0.00,0.00,0.00,0.00,0.00,0.00,0.00,0.00,0.00,0.00"
what happened to malik from last chance u basketball,0,,0.00,0.00,,,,"0.00,0.00,0.00,0.00,0.00,0.00,0.00,0.00,0.00,0.00,0.00"
what happened to mamba basketball,0,,0.00,0.00,,,,"0.00,0.00,0.00,0.00,0.00,0.00,0.00,0.00,0.00,0.00,0.00"
what happened to mark eaton the basketball player,0,,0.00,0.00,,,,"0.00,0.00,0.00,0.00,0.00,0.00,0.00,0.00,0.00,0.00,0.00"
what happened to mark from last chance u basketball,0,,0.00,0.00,,,,"0.00,0.00,0.00,0.00,0.00,0.00,0.00,0.00,0.00,0.00,0.00"
what happened to mark from last chance u: basketball,0,,0.00,0.00,,,,"0.00,0.00,0.00,0.00,0.00,0.00,0.00,0.00"
what happened to marlboro high school basketball player chris doherty,0,,0.00,0.00,,,,"0.00,0.00,0.00,0.00,0.00,0.00,0.00,0.00,0.00,0.00,0.00"
what happened to marlborough high school basketball player chris doherty,0,,0.00,0.00,,,,"0.00,0.00,0.00,0.00,0.00,0.00,0.00,0.00,0.00,0.00,0.00"
what happened to marquette basketball coach,0,,0.00,0.00,,,,"0.00,0.00,0.00,0.00,0.00,1.00,0.00,0.00,0.00,0.00,0.00"
what happened to marquette women's basketball coach,0,,0.00,0.00,,,,"0.00,0.00,0.00,0.00,0.00,0.00,0.00,0.00,0.00,0.00,0.00"
what happened to maryland basketball,0,,0.00,0.00,,,,"0.00,0.00,0.00,0.00,0.00,0.00,0.00,0.00,0.00,0.00,0.00"
what happened to maryland vs penn state basketball,0,,0.00,0.00,,,,"0.00,0.00,0.00,0.00,0.00,0.00,0.00,0.00,0.00,0.00,0.00"
what happened to mason jones razorback basketball,0,,0.00,0.00,,,,"0.00,0.00,0.00,0.00,0.00,0.00,0.00,0.00,0.00,0.00,0.00"
what happened to memphis basketball,0,,0.00,0.00,,,,"0.00,0.00,0.00,0.00,0.00,0.00,0.00,0.00,0.00,1.00,0.00"
what happened to michigan basketball coach john beilein,0,,0.00,0.00,,,,"0.00,0.00,0.00,0.00,0.00,0.00,0.00,0.00,0.00,0.00,0.00"
what happened to michigan basketball last night,0,,0.00,0.00,,,,"0.00,0.00,0.00,0.00,0.00,0.00,0.00,0.00,0.00,0.00,0.00"
what happened to michigan basketball player,0,,0.00,0.00,,,,"0.00,0.00,0.00,0.00,0.00,0.00,0.00,0.00,0.00,0.00,0.00"
what happened to michigan basketball player wagner,0,,0.00,0.00,,,,"0.00,0.00,0.00,0.00,0.00,0.00,0.00,0.00,0.00,0.00,0.00"
what happened to michigan basketball this year,0,,0.00,0.00,,,,"0.00,0.00"
what happened to michigan state basketball coach,0,,0.00,0.00,,,,"0.00,0.00,0.00,0.00,0.00,0.00,0.00,0.00,0.00,0.00,0.00"
what happened to michigan state basketball player ahrens,0,,0.00,0.00,,,,"0.00,0.00,0.00,0.00,0.00,0.00,0.00,0.00,0.00,0.00,0.00"
what happened to michigan state basketball team,0,,0.00,0.00,,,,"0.00,0.00,0.00,0.00,0.00,0.00,0.00,0.00,0.00,0.00,0.00"
what happened to michigan's basketball coach belein,0,,0.00,0.00,,,,"0.00,0.00,0.00,0.00,0.00,0.00,0.00,0.00,0.00,0.00,0.00"
what happened to mickey basketball diaries,0,,0.00,0.00,,,,"0.00,0.00,0.00,0.00,0.00,0.00,0.00,0.00,0.00,0.00,0.00"
what happened to mickey from basketball diaries,0,,0.00,0.00,,,,"0.00,0.00,0.00,0.00,0.00,0.00,0.00,0.00,0.00,0.00,0.00"
what happened to mickey in basketball diaries,0,,0.00,0.00,,,,"0.00,0.00,0.00,0.00,0.00,0.00,0.00,0.00,0.00,0.00,0.00"
what happened to mickey mitchell basketball,0,,0.00,0.00,,,,"1.00,1.00,0.00,0.00,0.00,0.00,0.00,0.00,0.00,0.00,0.00"
what happened to mike lipniski rolling meadows basketball,0,,0.00,0.00,,,,"0.00,0.00,0.00,0.00,0.00,0.00,0.00,0.00,0.00,0.00,0.00"
what happened to minnesota basketball,0,,0.00,0.00,,,,"0.00,0.00,0.00,0.00,0.00,0.00,0.00,0.00,0.00,0.00,0.00"
what happened to missouri basketball,0,,0.00,0.00,,,,"0.00,0.00,0.00,0.00,0.00,0.00,0.00,0.00,0.00,0.00,0.00"
what happened to monroes basketball team,0,,0.00,0.00,,,,"0.00,0.00,0.00,0.00,0.00,0.00,0.00,0.00,0.00,0.00,0.00"
what happened to msu basketball,0,,0.00,0.00,,,,"0.00,0.00,0.00,0.00,0.00,0.00,0.00,0.00,1.00,1.00,0.00"
what happened to msu basketball player march 17 2019,0,,0.00,0.00,,,,"0.00,0.00,0.00,0.00,0.00,0.00,0.00,0.00,0.00,0.00,0.00"
what happened to msu basketball this year,0,,0.00,0.00,,,,"0.00,0.00,0.00,0.00,0.00,0.00,0.00,0.00,0.00,0.00,0.00"
what happened to my league espn fantasy basketball got deleted,0,,0.00,0.00,,,,"0.00,0.00,0.00,0.00,0.00,0.00,0.00,0.00,0.00,0.00,0.00"
what happened to nc basketball,0,,0.00,0.00,,,,"0.00,0.00,0.00,0.00,0.00,0.00,0.00,0.00,0.00,0.00,0.00"
what happened to nc basketball coach,0,,0.00,0.00,,,,"0.00,0.00,0.00,0.00,0.00,0.00,0.00,0.00,0.00,0.00,0.00"
what happened to ncaa basketball,0,,0.00,0.00,,,,"0.00,0.00,0.00,0.00,0.00,0.00,0.00,0.00,0.00,0.00,0.00"
what happened to nd women's basketball,0,,0.00,0.00,,,,"0.00,0.00,0.00,0.00,0.00,0.00,0.00,0.00,0.00,0.00,0.00"
what happened to nebraska basketball,0,,0.00,0.00,,,,"0.00,0.00,0.00,0.00,0.00,0.00,0.00,0.00,0.00,0.00,0.00"
what happened to nebraska basketball coach,0,,0.00,0.00,,,,"0.00,0.00,0.00,0.00,0.00,0.00,0.00,0.00,0.00,0.00,0.00"
what happened to nebraska boys basketball roster today,0,,0.00,0.00,,,,"0.00,0.00,0.00,0.00,0.00,0.00,0.00,0.00,0.00,0.00,0.00"
what happened to nevada basketball team,0,,0.00,0.00,,,,"0.00,0.00,0.00,0.00,0.00,0.00,0.00,0.00,0.00,0.00,0.00"
what happened to new mexico basketball,0,,0.00,0.00,,,,"0.00,0.00,0.00,0.00,0.00,0.00,0.00,0.00,0.00,0.00,0.00"
what happened to nick anderson basketball player,0,,0.00,0.00,,,,"0.00,0.00,0.00,0.00,0.00,0.00,0.00,0.00,0.00,0.00,0.00"
what happened to nike's basketball business,0,,0.00,0.00,,,,"0.00,0.00,0.00,0.00,0.00,0.00,0.00,0.00,0.00,0.00,0.00"
what happened to nike+ basketball,0,,0.00,0.00,,,,"0.00,0.00,0.00,0.00,0.00,0.00,0.00,0.00,0.00,0.00,0.00"
what happened to north carolina basketball,0,,0.00,0.00,,,,"0.00,0.00,0.00,0.00,0.00,0.00,0.00,0.00,0.00,1.00,1.00"
what happened to north carolina basketball coach,0,,0.00,0.00,,,,"0.00,0.00,0.00,0.00,0.00,0.00,0.00,0.00,0.00,1.00,1.00"
what happened to north carolina women's basketball,0,,0.00,0.00,,,,"0.00,0.00,0.00,0.00,0.00,0.00,0.00,0.00,0.00,0.00,0.00"
what happened to north carolina's basketball coach,0,,0.00,0.00,,,,"0.00,0.00,0.00,0.00,0.00,0.00,0.00,0.00,0.00,0.00,0.00"
what happened to north carolina's basketball coach today,0,,0.00,0.00,,,,"0.00,0.00,0.00,0.00,0.00,0.00,0.00,0.00,0.00,0.00,0.00"
what happened to notre dame women's basketball team,0,,0.00,0.00,,,,"0.00,0.00,0.00,0.00,0.00,0.00,0.00,0.00,0.00,0.00,0.00"
what happened to notre dame womens basketball,0,,0.00,0.00,,,,"0.00,0.00,0.00,0.00,0.00,0.00,0.00,0.00,0.00,0.00,0.00"
what happened to nyah tate basketball,0,,0.00,0.00,,,,"0.00,0.00,0.00,0.00,0.00,0.00,0.00,0.00,0.00,0.00,0.00"
what happened to nyc basketball,0,,0.00,0.00,,,,"0.00,0.00,0.00,0.00,0.00,0.00,0.00,0.00,0.00,0.00,0.00"
what happened to oden in basketball,0,,0.00,0.00,,,,"1.00,0.00,0.00,0.00"
what happened to oden the basketball player,0,,0.00,0.00,,,,"0.00,0.00,0.00,1.00"
what happened to odu women's basketball,0,,0.00,0.00,,,,"0.00,0.00,0.00,0.00,0.00,0.00,0.00,0.00,0.00,0.00,0.00"
what happened to ogs pinky from basketball wives,0,,0.00,0.00,,,,"0.00,0.00,0.00,0.00,0.00,0.00,0.00,0.00,0.00,0.00,0.00"
what happened to ohio state basketball,0,,0.00,0.00,,,,"0.00,0.00,0.00,0.00,0.00,0.00,0.00,0.00,0.00,1.00,0.00"
what happened to ohio state basketball coach,0,,0.00,0.00,,,,"0.00,0.00,0.00,0.00,0.00,0.00,0.00,0.00,0.00,0.00,0.00"
what happened to ohio state basketball player caleb,0,,0.00,0.00,,,,"0.00,0.00,0.00,0.00,0.00,0.00,0.00,0.00,0.00,0.00,0.00"
what happened to ohio state football or basketball,0,,0.00,0.00,,,,"0.00,0.00,0.00,0.00,0.00,0.00,0.00,0.00,0.00,0.00,0.00"
what happened to oklahoma basketball,0,,0.00,0.00,,,,"0.00,0.00,0.00,0.00,0.00,0.00,0.00,0.00,0.00,0.00,0.00"
what happened to oklahoma state basketball coach,0,,0.00,0.00,,,,"0.00,0.00,0.00,0.00,0.00,0.00,0.00,0.00,0.00,0.00,0.00"
what happened to oklahoma state basketball players,0,,0.00,0.00,,,,"0.00,0.00,0.00,0.00,0.00,0.00,0.00,0.00,0.00,0.00,0.00"
what happened to oklahoma state basketball team,0,,0.00,0.00,,,,"0.00,0.00,0.00,0.00,0.00,0.00,0.00,0.00,0.00,0.00,0.00"
what happened to ole miss basketball coach,0,,0.00,0.00,,,,"0.00,0.00,0.00,0.00,0.00,0.00,0.00,0.00,0.00,0.00,0.00"
what happened to ole miss basketball record,0,,0.00,0.00,,,,"0.00,0.00,0.00,0.00,0.00,0.00,0.00,0.00,0.00,0.00,0.00"
what happened to oregon basketball,0,,0.00,0.00,,,,"0.00,0.00,0.00,0.00,0.00,0.00,0.00,0.00,0.00,0.00,0.00"
what happened to oregon basketball game,0,,0.00,0.00,,,,"0.00,0.00,0.00,0.00,0.00,0.00,0.00,0.00,0.00,0.00,0.00"
what happened to oregon state men's basketball,0,,0.00,0.00,,,,"0.00,0.00"
what happened to pac 12 basketball,0,,0.00,0.00,,,,"0.00,0.00,0.00,0.00,0.00,0.00,0.00,0.00,0.00,0.00,0.00"
what happened to patrice basketball wives,0,,0.00,0.00,,,,"0.00,0.00,0.00,0.00,0.00,0.00,0.00,0.00,0.00,0.00,0.00"
what happened to patrice on basketball wives la,0,,0.00,0.00,,,,"0.00,0.00,0.00,0.00,0.00,0.00,0.00,0.00,0.00,0.00,0.00"
what happened to paul pierce basketball player,0,,0.00,0.00,,,,"0.00,0.00,0.00,0.00,0.00,0.00,0.00,0.00,0.00,0.00,0.00"
what happened to pedro from basketball diaries,0,,0.00,0.00,,,,0.00
what happened to penn state basketball,0,,0.00,0.00,,,,"0.00,0.00,0.00,0.00,0.00,0.00,0.00,0.00,0.00,0.00,0.00"
what happened to penn state basketball coach,0,,0.00,0.00,,,,"0.00,0.00,0.00,0.00,0.00,0.00,0.00,0.00,0.00,0.00,0.00"
what happened to penn state women's basketball,0,,0.00,0.00,,,,"0.00,0.00,0.00,0.00,0.00,0.00,0.00,0.00,0.00,0.00,0.00"
what happened to penn state's basketball coach,0,,0.00,0.00,,,,"0.00,0.00,0.00,0.00,0.00,0.00,0.00,0.00,0.00,0.00,0.00"
what happened to penn states ladies basketball coach,0,,0.00,0.00,,,,"0.00,0.00,0.00,0.00,0.00,0.00,0.00,0.00,0.00,0.00,0.00"
what happened to peru state college men's basketball coach,0,,0.00,0.00,,,,"0.00,0.00,0.00,0.00,0.00,0.00,0.00,0.00,0.00,0.00,0.00"
what happened to pittsburgh basketball,0,,0.00,0.00,,,,"0.00,0.00,0.00,0.00,0.00,0.00,0.00,0.00,0.00,0.00,0.00"
what happened to pittsburgh men's basketball coach,0,,0.00,0.00,,,,"0.00,0.00,0.00,0.00,0.00,0.00,0.00,0.00,0.00,0.00,0.00"
what happened to player basketball,0,,0.00,0.00,,,,"0.00,0.00,0.00,0.00,0.00,0.00,0.00,0.00,0.00,0.00,0.00"
what happened to player basketball in helicopter,0,,0.00,0.00,,,,"0.00,0.00,0.00,0.00,0.00,0.00,0.00,0.00,0.00,0.00,0.00"
what happened to players from last chance u basketball,0,,0.00,0.00,,,,"0.00,0.00,0.00,0.00,0.00,0.00,0.00,0.00,0.00,0.00,0.00"
what happened to previous georgia tech basketball coach,0,,0.00,0.00,,,,"0.00,0.00,0.00,0.00,0.00,0.00,0.00,0.00,0.00,0.00,0.00"
what happened to providence basketball coach head,0,,0.00,0.00,,,,"0.00,0.00,0.00,0.00,0.00,0.00,0.00,0.00,0.00,0.00,0.00"
what happened to racist basketball owner,0,,0.00,0.00,,,,"0.00,0.00,0.00,0.00,0.00,0.00,0.00,0.00,0.00,0.00,0.00"
what happened to radio station 94.7 country it's broadcasting basketball,0,,0.00,0.00,,,,"0.00,0.00,0.00,0.00,0.00,0.00,0.00,0.00,0.00,0.00,0.00"
what happened to radio station 94.7 country now broadcasting basketball,0,,0.00,0.00,,,,"0.00,0.00,0.00,0.00,0.00,0.00,0.00,0.00,0.00,0.00,0.00"
what happened to real people from basketball diaries,0,,0.00,0.00,,,,"0.00,0.00,0.00,0.00,0.00,0.00,0.00,0.00,0.00,0.00,0.00"
what happened to red hacker basketball tournaments,0,,0.00,0.00,,,,"0.00,0.00,0.00,0.00,0.00,0.00,0.00,0.00,0.00,0.00,0.00"
what happened to reebok basketball,0,,0.00,0.00,,,,"0.00,0.00,0.00,0.00,0.00,0.00,0.00,0.00,0.00,0.00,0.00"
what happened to reese from basketball wives,0,,0.00,0.00,,,,"0.00,0.00,0.00,0.00,0.00,0.00,0.00,0.00,0.00,0.00,0.00"
what happened to richard cobbs basketball,0,,0.00,0.00,,,,"0.00,0.00,0.00,0.00,0.00,0.00,0.00,0.00,0.00,0.00,0.00"
what happened to rob williams basketball,0,,0.00,0.00,,,,"0.00,0.00,0.00,0.00,0.00,0.00,0.00,0.00,0.00,0.00,0.00"
what happened to rob williams basketball player,0,,0.00,0.00,,,,"0.00,0.00,0.00,0.00,0.00,0.00,0.00,0.00,0.00,0.00,0.00"
what happened to rob williams houston basketball,0,,0.00,0.00,,,,"0.00,0.00,0.00,0.00,0.00,0.00,0.00,0.00,0.00,0.00,0.00"
what happened to roy williams unc basketball coach,0,,0.00,0.00,,,,"0.00,0.00,0.00,0.00,0.00,0.00,0.00,0.00,0.00,0.00,0.00"
what happened to royce on basketball wives,0,,0.00,0.00,,,,"0.00,0.00,0.00,0.00,0.00,0.00,0.00,0.00,0.00,0.00,0.00"
what happened to russia basketball,0,,0.00,0.00,,,,"0.00,0.00,0.00,0.00,0.00,0.00,0.00,0.00,0.00,0.00,0.00"
what happened to rutgers basketball,0,,0.00,0.00,,,,"0.00,0.00,0.00,0.00,0.00,0.00,0.00,0.00,0.00,0.00,0.00"
what happened to rutgers women's basketball,0,,0.00,0.00,,,,"0.00,0.00,0.00,0.00,0.00,0.00,0.00,0.00,0.00,0.00,0.00"
what happened to sdsu women's basketball,0,,0.00,0.00,,,,"0.00,0.00,0.00,0.00,0.00,0.00,0.00,0.00,0.00,0.00,0.00"
what happened to season 9 of basketball wives,0,,0.00,0.00,,,,"0.00,0.00,0.00,0.00,0.00,0.00,0.00,0.00,0.00,0.00,0.00"
what happened to seton hall basketball,0,,0.00,0.00,,,,0.00
what happened to seventh woods north carolina basketball,0,,0.00,0.00,,,,"0.00,0.00,0.00,0.00,0.00,0.00,0.00,0.00,0.00,0.00,0.00"
what happened to shaina pellington for oklahoma basketball last season,0,,0.00,0.00,,,,"0.00,0.00,0.00,0.00,0.00,0.00,0.00,0.00,0.00,0.00,0.00"
what happened to shaquille johnson basketball,0,,0.00,0.00,,,,"0.00,0.00,0.00,0.00,0.00,0.00,0.00,0.00,0.00,0.00,0.00"
what happened to shawn kemp basketball player,0,,0.00,0.00,,,,"0.00,0.00,0.00,0.00,0.00,0.00,0.00,0.00,0.00,0.00,0.00"
what happened to simulation basketball game charazay,0,,0.00,0.00,,,,"0.00,0.00,0.00,0.00,0.00,0.00,0.00,0.00,0.00,0.00,0.00"
what happened to simulation basketball game charazey,0,,0.00,0.00,,,,"0.00,0.00,0.00,0.00,0.00,0.00,0.00,0.00,0.00,0.00,0.00"
what happened to south carolina basketball,0,,0.00,0.00,,,,"0.00,0.00,0.00,0.00,0.00,0.00,0.00,0.00,0.00,0.00,0.00"
what happened to spalding basketball,0,,0.00,0.00,,,,"0.00,0.00,0.00,0.00,0.00,0.00"
what happened to stanford basketball,0,,0.00,0.00,,,,"0.00,0.00,0.00,0.00,0.00,0.00,0.00,0.00,0.00,0.00,0.00"
what happened to susie on basketball wives,0,,0.00,0.00,,,,"0.00,0.00,0.00,0.00,0.00,0.00,0.00,0.00,0.00,0.00,0.00"
what happened to suzie basketball wives jaw,0,,0.00,0.00,,,,"0.00,0.00,0.00,0.00,0.00,0.00,0.00,0.00,0.00,0.00,0.00"
what happened to suzie from basketball wives mouth,0,,0.00,0.00,,,,"0.00,0.00,0.00,0.00,0.00,0.00,0.00,0.00,0.00,0.00,0.00"
what happened to suzie on basketball wives,0,,0.00,0.00,,,,"0.00,0.00,0.00,0.00,0.00,0.00,0.00,0.00,0.00,0.00,0.00"
what happened to syracuse basketball coach,0,,0.00,0.00,,,,"0.00,0.00,0.00,0.00,0.00,0.00,0.00,0.00,0.00,0.00,0.00"
what happened to syracuse basketball coach killed in auto accident,0,,0.00,0.00,,,,"0.00,0.00,0.00,0.00,0.00,0.00,0.00,0.00,0.00,0.00,0.00"
what happened to syracuse women's basketball,0,,0.00,0.00,,,,"1.00,0.00,0.00,0.00,0.00,0.00"
what happened to syracuse women's basketball coach,0,,0.00,0.00,,,,"1.00,1.00,0.00,0.00"
what happened to tami from basketball wives,0,,0.00,0.00,,,,"0.00,0.00,0.00,0.00,0.00,0.00"
what happened to tami roman after basketball wives reunion,0,,0.00,0.00,,,,"0.00,0.00,0.00,0.00,0.00,0.00,0.00,0.00,0.00,0.00,0.00"
what happened to taxes mens basketball coach,0,,0.00,0.00,,,,"0.00,0.00,0.00,0.00,0.00,0.00,0.00,0.00,0.00,0.00,0.00"
what happened to team usa basketball,0,,0.00,0.00,,,,"0.00,1.00,0.00,0.00,0.00,0.00,0.00,0.00,0.00,0.00,0.00"
