Keyword,Volume,Keyword Difficulty,CPC (USD),Competitive Density,Number of Results,Intent,SERP Features,Trend
may is when professional basketball champioship happens,0,,0.00,0.00,,,,"0.00,0.00,0.00,0.00,0.00,0.00,0.00,0.00,0.00,0.00,0.00"
what ever happened to barnibarus jones basketball,0,,0.00,0.00,,,,"0.00,0.00,0.00,0.00,0.00,0.00,0.00,0.00,0.00,0.00,0.00"
what ever happened to basketball star david wingate,0,,0.00,0.00,,,,"0.00,0.00,0.00,0.00,0.00,0.00,0.00,0.00,0.00,0.00,0.00"
what ever happened to jump ball in basketball,0,,0.00,0.00,,,,"0.00,0.00,0.00,0.00,0.00,0.00,0.00,0.00,0.00,0.00,0.00"
what ever happened to memphis basketball coach,0,,0.00,0.00,,,,"0.00,0.00,0.00,0.00,0.00,0.00,0.00,0.00,0.00,0.00,0.00"
what ever happened to moses the ucla basketball player,0,,0.00,0.00,,,,"0.00,0.00,0.00,0.00,0.00,0.00,0.00,0.00,0.00,0.00,0.00"
what ever happened to the deaf baylor basketball player,0,,0.00,0.00,,,,"0.00,0.00,0.00,0.00,0.00,0.00,0.00,0.00,0.00,0.00,0.00"
what ever happened to ucla basketball players,0,,0.00,0.00,,,,"0.00,0.00,0.00,0.00,0.00,0.00,0.00,0.00,0.00,0.00,0.00"
what ever happened to villa nova basketball,0,,0.00,0.00,,,,"0.00,0.00,0.00,0.00,0.00,0.00,0.00,0.00,0.00,0.00,0.00"
what ever happened to womens basketball star skuye,0,,0.00,0.00,,,,"0.00,0.00,0.00,0.00,0.00,0.00,0.00,0.00,0.00,0.00,0.00"
what happened after 1929 in basketball,0,,0.00,0.00,,,,"0.00,0.00,0.00,0.00,0.00,0.00,0.00,0.00,0.00,0.00,0.00"
what happened after ot2 in basketball,0,,0.00,0.00,,,,"0.00,0.00,0.00,0.00,0.00,0.00,0.00,0.00,0.00,0.00,0.00"
what happened after the basketball exhibition,0,,0.00,0.00,,,,"0.00,0.00,0.00,0.00,0.00,0.00,0.00,0.00,0.00,0.00,0.00"
what happened after the basketball exhibition north korea,0,,0.00,0.00,,,,"0.00,0.00,0.00,0.00,0.00,0.00,0.00,0.00,0.00,0.00,0.00"
what happened after the duke basketball loss,0,,0.00,0.00,,,,"0.00,0.00,0.00,0.00,0.00,0.00,0.00,0.00,0.00,0.00,0.00"
what happened arizona basketball,0,,0.00,0.00,,,,"0.00,0.00,0.00,0.00,0.00,0.00,0.00,0.00,0.00,0.00,0.00"
what happened at end of iowa illinois basketball game,0,,0.00,0.00,,,,"0.00,0.00,0.00,0.00,0.00,0.00,0.00,0.00,0.00,0.00,0.00"
what happened at georgetown basketball,0,,0.00,0.00,,,,"0.00,0.00,0.00,0.00,0.00,0.00,0.00,0.00,0.00,0.00,0.00,0.00"
what happened at kansas basketball game,0,,0.00,0.00,,,,"0.00,0.00,0.00,0.00,0.00,0.00,0.00,0.00,0.00,0.00,0.00"
what happened at kentucky basketball game last night,0,,0.00,0.00,,,,"0.00,0.00,0.00,0.00,0.00,0.00,0.00,0.00,0.00,0.00,0.00"
what happened at michigan state basketball,0,,0.00,0.00,,,,"0.00,0.00,0.00,0.00,0.00,0.00,0.00,0.00,0.00,0.00,0.00"
what happened at michigan state who died basketball,0,,0.00,0.00,,,,"0.00,0.00,0.00,0.00,0.00,0.00,0.00,0.00,0.00,0.00,0.00"
what happened at nc state basketball game,0,,0.00,0.00,,,,"0.00,0.00,0.00,0.00,0.00,0.00,0.00,0.00,0.00,0.00,0.00"
what happened at nc state basketball game today,0,,0.00,0.00,,,,"0.00,0.00,0.00,0.00,0.00,0.00,0.00,0.00,0.00,0.00,0.00"
what happened at semo basketball game yesterday,0,,0.00,0.00,,,,"0.00,0.00,0.00,0.00,0.00,0.00,0.00,0.00,0.00,0.00,0.00"
what happened at texas tech women's basketball,0,,0.00,0.00,,,,"0.00,0.00,0.00,0.00,0.00,0.00,0.00,0.00,0.00,0.00,0.00"
what happened at the duke basketball game yesterday,0,,0.00,0.00,,,,"0.00,0.00,0.00,0.00,0.00,0.00,0.00,0.00,0.00,0.00,0.00"
what happened at the end of last chance u basketball,0,,0.00,0.00,,,,"0.00,0.00,0.00,0.00,0.00,0.00,0.00,0.00,0.00,0.00,0.00"
what happened at the kansas basketball game,0,,0.00,0.00,,,,"0.00,0.00,0.00,0.00,0.00,0.00,0.00,0.00,0.00,0.00,0.00"
what happened at the kentucky basketball game last night,0,,0.00,0.00,,,,"0.00,0.00,0.00,0.00,0.00,0.00,0.00,0.00,0.00,0.00,0.00"
what happened at the nc state basketball game today,0,,0.00,0.00,,,,"0.00,0.00,0.00,0.00,0.00,0.00,0.00,0.00,0.00,0.00,0.00"
what happened at the nevada utah state basketball game,0,,0.00,0.00,,,,"0.00,0.00,0.00,0.00,0.00,0.00,0.00,0.00,0.00,0.00,0.00"
what happened at the ohio state basketball game,0,,0.00,0.00,,,,"0.00,0.00,0.00,0.00,0.00,0.00,0.00,0.00,0.00,0.00,0.00"
what happened at the texas tech basketball game on today,0,,0.00,0.00,,,,"0.00,0.00,0.00,0.00,0.00,0.00,0.00,0.00,0.00,0.00,0.00"
what happened at the wagner bryant basketball game,0,,0.00,0.00,,,,"1.00,0.00"
what happened at the wisconsin basketball game,0,,0.00,0.00,,,,"0.00,0.00,0.00"
what happened at unc women's basketball team,0,,0.00,0.00,,,,"0.00,0.00,0.00,0.00,0.00,0.00,0.00,0.00,0.00,0.00,0.00"
what happened at western kentucky basketball,0,,0.00,0.00,,,,"0.00,0.00,0.00,0.00,0.00,0.00,0.00,0.00,0.00,0.00,0.00"
what happened at wisconsin michigan basketball game,0,,0.00,0.00,,,,"1.00,0.00,0.00"
what happened between evelyn and jennifer from basketball wives,0,,0.00,0.00,,,,"0.00,0.00,0.00,0.00,0.00,0.00,0.00,0.00,0.00,0.00,0.00"
what happened duke basketball,0,,0.00,0.00,,,,"0.00,0.00,0.00,0.00,0.00,0.00,0.00,0.00,0.00,0.00,0.00"
what happened in 1972 olympics basketball,0,,0.00,0.00,,,,"0.00,0.00,0.00,0.00,0.00,0.00,0.00,0.00,0.00,0.00,0.00"
what happened in alabama basketball game,0,,0.00,0.00,,,,"0.00,0.00,0.00,0.00,0.00,0.00,0.00,0.00,0.00,0.00,0.00"
what happened in arizona basketball,0,,0.00,0.00,,,,"0.00,0.00,0.00,0.00,0.00,0.00,0.00,0.00,0.00,0.00,0.00"
what happened in basketball last night,0,,0.00,0.00,,,,"0.00,0.00,0.00,0.00,0.00,0.00,0.00,0.00,0.00,0.00,0.00"
what happened in basketball on 11 15,0,,0.00,0.00,,,,"0.00,0.00,0.00,0.00,0.00,0.00,0.00,0.00,0.00,0.00,0.00"
what happened in basketball on november 5,0,,0.00,0.00,,,,"0.00,0.00,0.00,0.00,0.00,0.00,0.00,0.00,0.00,0.00,0.00"
what happened in byu basketball,0,,0.00,0.00,,,,"0.00,0.00,0.00,0.00,0.00,0.00,0.00,0.00,0.00,0.00,0.00"
what happened in kansas basketball game tonight,0,,0.00,0.00,,,,"0.00,0.00,0.00,0.00,0.00,0.00,0.00,0.00,0.00,0.00,0.00"
what happened in kansas basketball tonight,0,,0.00,0.00,,,,"0.00,0.00,0.00,0.00,0.00,0.00,0.00,0.00,0.00,0.00,0.00"
what happened in last chance u basketball,0,,0.00,0.00,,,,"0.00,0.00,0.00,0.00,0.00,0.00,0.00,0.00,0.00,0.00,0.00"
what happened in men's big ten basketball yesterday,0,,0.00,0.00,,,,"0.00,0.00,0.00,0.00,0.00,0.00,0.00,0.00,0.00,0.00,0.00"
what happened in michigan basketball game,0,,0.00,0.00,,,,"1.00,0.00,0.00"
what happened in nc state basketball game,0,,0.00,0.00,,,,"0.00,0.00,0.00,0.00,0.00,0.00,0.00,0.00,0.00,0.00,0.00"
what happened in ncaa basketball,0,,0.00,0.00,,,,"0.00,0.00,0.00,0.00,0.00,0.00,0.00,0.00,0.00,0.00,0.00"
what happened in the 2004 olympic basketball team,0,,0.00,0.00,,,,"0.00,0.00,0.00,0.00,0.00,0.00,0.00,0.00,0.00,0.00,0.00"
what happened in the alabama basketball game today,0,,0.00,0.00,,,,"0.00,0.00,0.00,0.00,0.00,0.00,0.00,0.00,0.00,0.00,0.00"
what happened in the auburn basketball game tonight,0,,0.00,0.00,,,,"0.00,0.00,0.00,0.00,0.00,0.00,0.00,0.00,0.00,0.00,0.00"
what happened in the duke basketball game last night,0,,0.00,0.00,,,,"0.00,0.00,0.00,0.00,0.00,0.00,0.00,0.00,0.00,0.00,0.00"
what happened in the kansas basketball game,0,,0.00,0.00,,,,"0.00,0.00,0.00,0.00,0.00,0.00,0.00,0.00,0.00,0.00,0.00"
what happened in the last play uva basketball,0,,0.00,0.00,,,,"0.00,0.00,0.00,0.00,0.00,0.00,0.00,0.00,0.00,0.00,0.00"
what happened in the michigan basketball game,0,,0.00,0.00,,,,"0.00,0.00,0.00,0.00,0.00,0.00,0.00,0.00,0.00,1.00,0.66,0.00"
what happened january 2006 basketball,0,,0.00,0.00,,,,"0.00,0.00,0.00,0.00,0.00,0.00,0.00,0.00,0.00,0.00,0.00"
what happened july 22 1997 basketball,0,,0.00,0.00,,,,"1.00,0.00,0.00,0.00,0.00,0.00"
what happened last chance u basketball,0,,0.00,0.00,,,,"0.00,0.00,0.00,0.00,0.00,0.00,0.00,0.00,0.00,0.00,0.00"
what happened meme basketball,0,,0.00,0.00,,,,"0.00,0.00,0.00,0.00,0.00,0.00,0.00,0.00,0.00,0.00,0.00"
what happened monday night in utah jass basketball,0,,0.00,0.00,,,,"0.00,0.00,0.00,0.00,0.00,0.00,0.00,0.00,0.00,0.00,0.00"
what happened on basketball wives,0,,0.00,0.00,,,,"0.00,0.00,0.00,0.00,0.00,0.00,0.00,0.00,0.00,0.00,0.00,0.00"
what happened on basketball wives last night,0,,0.00,0.00,,,,"0.00,0.00,0.00,0.00,0.00,1.00,0.00,0.00,0.00,0.00,0.00"
what happened on basketball wives reunion,0,,0.00,0.00,,,,"0.00,0.00,0.00,0.00,0.00,0.00,0.00,0.00,0.00,0.00,0.00"
what happened on basketball wives tonight,0,,0.00,0.00,,,,"0.00,0.00,0.00,0.00,0.00,0.00,0.00,0.00,0.00,0.00,0.00"
what happened on jan 19th basketball 2019 virginia,0,,0.00,0.00,,,,"0.00,0.00,0.00,0.00,0.00,0.00,0.00,0.00,0.00,0.00,0.00"
what happened on july 22 1997 basketball,0,,0.00,0.00,,,,"1.00,0.00,0.00,0.00,0.00,0.00"
what happened on love and basketball,0,,0.00,0.00,,,,"0.00,0.00,0.00,0.00,0.00,0.00,0.00,0.00,0.00,0.00,0.00"
what happened on march 28 1993 ncaa men's basketball,0,,0.00,0.00,,,,"0.00,0.00,0.00,0.00,0.00,0.00,0.00,0.00,0.00,0.00,0.00"
what happened on may17 1993 in basketball,0,,0.00,0.00,,,,"0.00,0.00,0.00,0.00,0.00,0.00,0.00,0.00,0.00,0.00,0.00"
what happened op unc basketball player theo pinson,0,,0.00,0.00,,,,"0.00,0.00,0.00,0.00,0.00,0.00,0.00,0.00,0.00,0.00,0.00"
what happened to 2005 unc basketball team,0,,0.00,0.00,,,,"0.00,0.00,0.00,0.00,0.00,0.00,0.00,0.00,0.00,0.00,0.00"
what happened to 2015 ou basketball star,0,,0.00,0.00,,,,"0.00,0.00,0.00,0.00,0.00,0.00,0.00,0.00,0.00,0.00,0.00"
what happened to 50 pitt men's basketball,0,,0.00,0.00,,,,"0.00,0.00,0.00,0.00,0.00,0.00,0.00,0.00,0.00,0.00,0.00"
what happened to aba basketball league,0,,0.00,0.00,,,,"0.00,0.00,0.00,0.00,0.00,0.00,0.00,0.00,0.00,0.00,0.00"
what happened to alabama basketball coach,0,,0.00,0.00,,,,"0.00,0.00,0.00,0.00,0.00,0.00,0.00,0.00,0.00,0.00,0.00"
what happened to alabama head basketball coach,0,,0.00,0.00,,,,"0.00,0.00,0.00,0.00,0.00,0.00,0.00,0.00,0.00,0.00,0.00"
what happened to albama basketball coach,0,,0.00,0.00,,,,"0.00,0.00,0.00,0.00,0.00,0.00,0.00,0.00,0.00,0.00,0.00"
what happened to alex lopez basketball,0,,0.00,0.00,,,,"0.00,0.00,0.00,0.00,0.00,0.00,0.00,0.00,0.00,0.00,0.00"
what happened to american basketball player in russia,0,,0.00,0.00,,,,0.00
what happened to anthony mason basketball player,0,,0.00,0.00,,,,"0.00,0.00,0.00,0.00,0.00,0.00,0.00,0.00,0.00,0.00,0.00"
what happened to arizona basketball,0,,0.00,0.00,,,,"0.00,0.00,0.00,0.00,0.00,0.00,0.00,0.00,0.00,0.00,0.00"
what happened to arizona basketball coach,0,,0.00,0.00,,,,"0.00,0.00"
what happened to arizona state basketball,0,,0.00,0.00,,,,"0.00,0.00,0.00,0.00,0.00,0.00,0.00,0.00,0.00,0.00,0.00"
what happened to arizona's men's basketball team,0,,0.00,0.00,,,,"0.00,0.00,0.00,0.00,0.00,0.00,0.00,0.00,0.00,0.00,0.00"
what happened to arkansas basketball,0,,0.00,0.00,,,,"0.00,0.00,0.00,0.00,0.00,0.00,0.00,0.00,0.00,0.00,0.00"
what happened to arkansas basketball coach arm,0,,0.00,0.00,,,,"0.00,0.00"
what happened to auburn basketball player kiki,0,,0.00,0.00,,,,"0.00,0.00,0.00,0.00,0.00,0.00,0.00,0.00,0.00,0.00,0.00"
what happened to auburn basketball player okeke,0,,0.00,0.00,,,,"0.00,0.00,0.00,0.00,0.00,0.00,0.00,0.00,0.00,0.00,0.00"
what happened to auburn basketball player today,0,,0.00,0.00,,,,"0.00,0.00,0.00,0.00,0.00,0.00,0.00,0.00,0.00,0.00,0.00"
what happened to auburn basketball player tonight,0,,0.00,0.00,,,,"0.00,0.00,0.00,0.00,0.00,0.00,0.00,0.00,0.00,0.00,0.00"
what happened to basketball,0,,0.00,0.00,,,,"0.00,0.00,0.00,0.00,0.00,0.00,0.00,0.00,0.00,0.00,0.00"
what happened to basketball birdman,0,,0.00,0.00,,,,"0.00,0.00,0.00,0.00,0.00,0.00,0.00,0.00,0.00,0.00,0.00"
what happened to basketball fundamentals,0,,0.00,0.00,,,,"0.00,0.00,0.00,0.00,0.00,0.00,0.00,0.00,0.00,0.00,0.00"
what happened to basketball player cliff robinson,0,,0.00,0.00,,,,"0.00,0.00,0.00,0.00,0.00,0.00,0.00,0.00,0.00,0.00,0.00"
what happened to basketball player clifford robinson,0,,0.00,0.00,,,,"0.00,0.00,0.00,0.00,0.00,0.00,0.00,0.00,0.00,0.00,0.00"
what happened to basketball player darius washington,0,,0.00,0.00,,,,"0.00,0.00,0.00,0.00,0.00,0.00,0.00,0.00,0.00,0.00,0.00"
what happened to basketball player harold miner,0,,0.00,0.00,,,,"0.00,0.00,0.00,0.00,0.00,0.00,0.00,0.00,0.00,0.00,0.00"
what happened to basketball player jason williams,0,,0.00,0.00,,,,"0.00,0.00,0.00,0.00,0.00,0.00,0.00,0.00,0.00,0.00,0.00"
what happened to basketball player jeremy lin,0,,0.00,0.00,,,,"0.00,0.00,0.00,0.00,0.00,0.00,0.00,0.00,0.00,0.00,0.00"
what happened to basketball player jeremy tyler,0,,0.00,0.00,,,,"0.00,0.00,0.00,0.00,0.00,0.00,0.00,0.00,0.00,0.00,0.00"
what happened to basketball player keith lee,0,,0.00,0.00,,,,"0.00,0.00,0.00,0.00,0.00,0.00,0.00,0.00,0.00,0.00,0.00"
what happened to basketball player kobe bryant,0,,0.00,0.00,,,,"0.00,0.00,0.00,0.00,0.00,0.00,0.00,0.00,0.00,0.00,0.00"
what happened to basketball player lamar odom,0,,0.00,0.00,,,,"0.00,0.00,0.00,0.00,0.00,0.00,0.00,0.00,0.00,0.00,0.00"
what happened to basketball player nurkic,0,,0.00,0.00,,,,"0.00,0.00,0.00,0.00,0.00,0.00,0.00,0.00,0.00,0.00,0.00"
what happened to basketball player oden,0,,0.00,0.00,,,,"0.00,0.00,0.00,0.00"
what happened to basketball player terrence clarke,0,,0.00,0.00,,,,"0.00,1.00,0.00,0.00,0.00,0.00,0.00,0.00,0.00,0.00,0.00"
what happened to basketball player that collapsed,0,,0.00,0.00,,,,"0.00,0.00,0.00,0.00,0.00,0.00,0.00,0.00,0.00,0.00,0.00"
what happened to basketball player who collapsed,0,,0.00,0.00,,,,"0.00,0.00,0.00,0.00,0.00,0.00,0.00,0.00,0.00,0.00,0.00"
what happened to basketball player who collapsed on court,0,,0.00,0.00,,,,"0.00,0.00,0.00,0.00,0.00,0.00,0.00,0.00,0.00,0.00,0.00"
what happened to basketball shoes,0,,0.00,0.00,,,,"0.00,0.00,0.00,0.00,0.00,0.00,0.00,0.00,0.00,0.00,0.00"
what happened to basketball star kobe bryant,0,,0.00,0.00,,,,"0.00,0.00,0.00,0.00,0.00,0.00,0.00,0.00,0.00,0.00,0.00"
what happened to basketball tv,0,,0.00,0.00,,,,"0.00,0.00,0.00,0.00,0.00,0.00,0.00,0.00,0.00,0.00,0.00"
what happened to basketball wives 2013,0,,0.00,0.00,,,,"0.00,0.00,0.00,0.00,0.00,0.00,0.00,0.00,0.00,0.00,0.00"
what happened to basketball wives 2015,0,,0.00,0.00,,,,"0.00,0.00,0.00,0.00,0.00,0.00,0.00,0.00,0.00,0.00,0.00"
what happened to basketball wives jennifer,0,,0.00,0.00,,,,"0.00,0.00,0.00,0.00,0.00,0.00,0.00,0.00,0.00,0.00,0.00"
what happened to basketball wives la 2015,0,,0.00,0.00,,,,"0.00,0.00,0.00,0.00,0.00,0.00,0.00,0.00,0.00,0.00,0.00"
what happened to basketball wives la reunion part 2,0,,0.00,0.00,,,,"0.00,0.00,0.00,0.00,0.00,0.00,0.00,0.00,0.00,0.00,0.00"
what happened to basketball wives last night,0,,0.00,0.00,,,,"0.00,0.00,0.00,0.00,0.00,0.00,0.00,0.00,0.00,0.00,0.00"
what happened to basketball wives miami 2013,0,,0.00,0.00,,,,"0.00,0.00,0.00,0.00,0.00,0.00,0.00,0.00,0.00,0.00,0.00"
what happened to basketball wives miami 2015,0,,0.00,0.00,,,,"0.00,0.00,0.00,0.00,0.00,0.00,0.00,0.00,0.00,0.00,0.00"
what happened to basketball wives reunion,0,,0.00,0.00,,,,"0.00,0.00,0.00,0.00,0.00,0.00,0.00,0.00,0.00,0.00,0.00"
what happened to basketball wives reunion part 2,0,,0.00,0.00,,,,"0.00,0.00,0.00,0.00,0.00,0.00,0.00,0.00,0.00,0.00,0.00"
what happened to basketball wives season 5,0,,0.00,0.00,,,,"0.00,0.00,0.00,0.00,0.00,0.00,0.00,0.00,0.00,0.00,0.00"
what happened to basketball wives season 6 reunion part 2,0,,0.00,0.00,,,,"0.00,0.00,0.00,0.00,0.00,0.00,0.00,0.00,0.00,0.00,0.00"
what happened to basketball wives season 7 episode 6,0,,0.00,0.00,,,,"0.00,0.00,0.00,0.00,0.00,0.00,0.00,0.00,0.00,0.00,0.00"
what happened to basketball wives season 9 episode 8,0,,0.00,0.00,,,,"0.00,0.00,0.00,0.00,0.00,0.00,0.00,0.00,0.00,0.00,0.00"
what happened to basketball wives susie,0,,0.00,0.00,,,,"0.00,0.00,0.00,0.00,0.00,0.00,0.00,0.00,0.00,0.00,0.00"
what happened to baylor basketball,0,,0.00,0.00,,,,"0.00,0.00,0.00,0.00,0.00,0.00,0.00,0.00,0.00,0.00,1.00"
what happened to ben gordon basketball,0,,0.00,0.00,,,,"0.00,0.00,0.00,0.00,0.00,0.00,0.00,0.00,0.00,0.00,0.00"
what happened to ben jordan uk basketball,0,,0.00,0.00,,,,"0.00,0.00,0.00,0.00,0.00,0.00,0.00,0.00,0.00,0.00,0.00"
what happened to benny anders basketball player,0,,0.00,0.00,,,,"0.00,0.00,0.00,0.00,0.00,0.00,0.00,0.00,0.00,0.00,0.00"
what happened to big 10 basketball,0,,0.00,0.00,,,,"0.00,0.00,0.00,0.00,0.00,0.00,0.00,0.00,0.00,0.00,0.00"
what happened to big 3 basketball,0,,0.00,0.00,,,,"0.00,0.00,0.00,0.00,0.00,0.00,0.00,0.00,0.00,0.00,0.00"
what happened to big country basketball player,0,,0.00,0.00,,,,"0.00,0.00,0.00,0.00,0.00,0.00,0.00,0.00,0.00,0.00,0.00"
what happened to big country the basketball player,0,,0.00,0.00,,,,"0.00,0.00,0.00,0.00,0.00,0.00,0.00,0.00,0.00,0.00,0.00"
what happened to big east basketball,0,,0.00,0.00,,,,"0.00,0.00,0.00,0.00,0.00,0.00,0.00,0.00,0.00,1.00,0.00"
what happened to billy preston basketball,0,,0.00,0.00,,,,"0.00,0.00,0.00,0.00,0.00,0.00,0.00,0.00,0.00,1.00,0.50"
what happened to birdman basketball,0,,0.00,0.00,,,,"0.00,0.00,0.00,0.00,0.00,0.00,0.00,0.00,0.00,1.00,0.00"
what happened to birdman basketball player,0,,0.00,0.00,,,,"0.00,0.00,0.00,0.00,0.00,0.00,0.00,0.00,0.00,0.00,1.00"
what happened to birdman the basketball player,0,,0.00,0.00,,,,"0.00,0.00,0.00,0.00,0.00,0.00,0.00,0.00,0.00,0.00,0.00"
what happened to bo ryan wisconsin basketball coach,0,,0.00,0.00,,,,"0.00,0.00,0.00,0.00,0.00,0.00,0.00,0.00,0.00,0.00,0.00"
what happened to boogie basketball,0,,0.00,0.00,,,,"0.00,0.00,0.00,0.00,0.00,0.00,0.00,0.00,0.00,0.00,0.00"
what happened to boogie basketball wives,0,,0.00,0.00,,,,"0.00,0.00,0.00,0.00,0.00,0.00,0.00,0.00,0.00,0.00,0.00"
what happened to boston college basketball after point shaving scandal,0,,0.00,0.00,,,,"0.00,0.00,0.00,0.00,0.00,0.00,0.00,0.00,0.00,0.00,0.00"
what happened to brandi from basketball wives,0,,0.00,0.00,,,,"0.00,0.00,0.00,0.00,0.00,0.00,0.00,0.00,0.00,0.00,0.00"
what happened to brian williams basketball player,0,,0.00,0.00,,,,"1.00,1.00,0.00,0.00,0.00,0.00,0.00,0.00,0.00,0.00,0.00"
what happened to brittany the basketball player,0,,0.00,0.00,,,,0.00
what happened to brittish from basketball wives,0,,0.00,0.00,,,,"0.00,0.00,0.00,0.00,0.00,0.00,0.00,0.00,0.00,0.00,0.00"
what happened to brooke from basketball wives,0,,0.00,0.00,,,,"0.00,0.00,0.00,0.00,0.00,0.00,0.00,0.00,0.00,0.00,0.00"
what happened to bryant basketball,0,,0.00,0.00,,,,"0.00,0.00,0.00,0.00,0.00,0.00,0.00,0.00,0.00,0.00,0.00"
what happened to bryce alford of ucla basketball,0,,0.00,0.00,,,,"0.00,0.00,0.00,0.00,0.00,0.00,0.00,0.00,0.00,0.00,0.00"
what happened to cam williams buckeye basketball,0,,0.00,0.00,,,,"0.00,0.00,0.00,0.00,0.00,0.00,0.00,0.00,0.00,0.00,0.00"
what happened to carolina basketball recruiting,0,,0.00,0.00,,,,"0.00,0.00,0.00,0.00,0.00,0.00,0.00,0.00,0.00,0.00,0.00"
what happened to cboa west la unit high school basketball,0,,0.00,0.00,,,,"0.00,0.00,0.00,0.00,0.00,0.00,0.00,0.00,0.00,0.00,0.00"
what happened to cbs sports franchise basketball on facebook,0,,0.00,0.00,,,,"0.00,0.00,0.00,0.00,0.00,0.00,0.00,0.00,0.00,0.00,0.00"
what happened to ccny basketball,0,,0.00,0.00,,,,"0.00,0.00,0.00,0.00,0.00,0.00,0.00,0.00,0.00,0.00,0.00"
what happened to charlie moore for kansas basketball,0,,0.00,0.00,,,,"0.00,0.00,0.00,0.00,0.00,0.00,0.00,0.00,0.00,0.00,0.00"
what happened to chris andersen basketball player,0,,0.00,0.00,,,,"0.00,0.00,0.00,0.00,0.00,0.00,0.00,0.00,0.00,1.00,0.00"
what happened to chris clarke virginia tech basketball,0,,0.00,0.00,,,,"0.00,0.00,0.00,0.00,0.00,0.00,0.00,0.00,0.00,0.00,0.00"
what happened to cincinnati head basketball coach,0,,0.00,0.00,,,,"0.00,0.00,0.00,0.00,0.00,0.00,0.00,0.00,0.00,0.00,0.00"
what happened to citadel basketball coach,0,,0.00,0.00,,,,"1.00,0.00,0.00,0.00,0.00,0.00"
what happened to city of basketball love,0,,0.00,0.00,,,,"0.00,0.00,0.00,0.00,0.00,0.00,0.00,0.00,0.00,0.00,0.00"
what happened to city of basketball love website,0,,0.00,0.00,,,,"0.00,0.00,0.00,0.00,0.00,0.00,0.00,0.00,0.00,0.00,0.00"
what happened to cj young basketball,0,,0.00,0.00,,,,"0.00,0.00,0.00,0.00,0.00,0.00,0.00,0.00,0.00,0.00,0.00"
what happened to cliff robertson the basketball player,0,,0.00,0.00,,,,"0.00,0.00,0.00,0.00,0.00,0.00,0.00,0.00,0.00,0.00,0.00"
what happened to cliff robinson basketball player,0,,0.00,0.00,,,,"0.00,0.00,0.00,0.00,0.00,0.00,0.00,0.00,0.00,0.00,0.00"
what happened to cliff robinson the basketball player,0,,0.00,0.00,,,,"0.00,0.00,0.00,0.00,0.00,0.00,0.00,0.00,0.00,0.00,0.00"
what happened to clifford robinson the basketball player,0,,0.00,0.00,,,,"0.00,0.00,0.00,0.00,0.00,0.00,0.00,0.00,0.00,0.00,0.00"
what happened to college basketball,0,,0.00,0.00,,,,"0.00,0.00,0.00"
what happened to college basketball player who collapsed,0,,0.00,0.00,,,,"0.00,0.00,0.00,0.00,0.00,0.00,0.00,0.00,0.00,0.00,0.00"
what happened to college basketball scandal,0,,0.00,0.00,,,,"0.00,0.00,0.00,0.00,0.00,0.00,0.00,0.00,0.00,0.00,0.00"
what happened to connecticut basketball,0,,0.00,0.00,,,,"0.00,0.00,0.00,0.00,0.00,0.00,0.00,0.00,0.00,0.00,0.00"
what happened to creighton basketball coach,0,,0.00,0.00,,,,"0.00,0.00,0.00,0.00,0.00,0.00,0.00,0.00,0.00,0.00,0.00"
what happened to david dahl in tonights basketball game,0,,0.00,0.00,,,,"0.00,0.00,0.00,0.00,0.00,0.00,0.00,0.00,0.00,0.00,0.00"
what happened to delonte west basketball player,0,,0.00,0.00,,,,"0.00,0.00"
what happened to depaul basketball,0,,0.00,0.00,,,,"0.00,0.00,0.00,0.00,0.00,0.00,0.00,0.00,0.00,1.00,0.00"
what happened to dick ruggles cobden basketball coach,0,,0.00,0.00,,,,"0.00,0.00,0.00,0.00,0.00,0.00,0.00,0.00,0.00,0.00,0.00"
what happened to draya basketball wives,0,,0.00,0.00,,,,"0.00,0.00,0.00,0.00,0.00,0.00,0.00,0.00,0.00,0.00,0.00"
what happened to draya from basketball wives,0,,0.00,0.00,,,,"0.00,0.00,0.00,0.00,0.00,0.00,0.00"
what happened to draya michele from basketball wives,0,,0.00,0.00,,,,"0.00,0.00,0.00,0.00,0.00,0.00,0.00,0.00,0.00,0.00,0.00"
what happened to drea on basketball wives,0,,0.00,0.00,,,,"0.00,0.00,0.00,0.00,0.00,0.00,0.00,0.00,0.00,0.00,0.00"
what happened to duffy from basketball wives,0,,0.00,0.00,,,,"0.00,0.00,0.00,0.00,0.00,0.00,0.00,0.00,0.00,0.00,0.00"
what happened to duffy on basketball wives,0,,0.00,0.00,,,,"0.00,0.00,0.00,0.00,0.00,0.00,0.00,0.00,0.00,0.00,0.00"
what happened to duke and kentucky basketball,0,,0.00,0.00,,,,"0.00,0.00,0.00,0.00,0.00,0.00,0.00,0.00,0.00,0.00,0.00"
what happened to duke basketball player grayson allen,0,,0.00,0.00,,,,"0.00,0.00,0.00,0.00,0.00,0.00,0.00,0.00,0.00,0.00,0.00"
what happened to duke basketball team,0,,0.00,0.00,,,,"0.00,0.00,0.00,0.00,0.00,0.00,0.00,0.00,0.00,0.00,0.00"
what happened to duke basketball this year,0,,0.00,0.00,,,,"0.00,0.00,0.00,0.00,0.00,0.00,0.00,0.00,0.00,0.00,0.00"
what happened to duke carolina basketball,0,,0.00,0.00,,,,"0.00,0.00,0.00,0.00,0.00,0.00,0.00,0.00,0.00,0.00,0.00"
what happened to duke men's basketball,0,,0.00,0.00,,,,"0.00,0.00,0.00,0.00,0.00,0.00,0.00,0.00,0.00,0.00,0.00"
what happened to duke women's basketball,0,,0.00,0.00,,,,"0.00,0.00,0.00,0.00,0.00,0.00,0.00,0.00,0.00,0.00,0.00"
what happened to east la basketball team,0,,0.00,0.00,,,,"0.00,0.00,0.00,0.00,0.00,0.00,0.00,0.00,0.00,0.00,0.00"
what happened to elac basketball,0,,0.00,0.00,,,,"0.00,0.00,0.00,0.00,0.00,0.00,0.00,0.00,0.00,0.00,0.00"
what happened to eric curry from minnesota gopher basketball,0,,0.00,0.00,,,,"0.00,0.00,0.00,0.00,0.00,0.00,0.00,0.00,0.00,0.00,0.00"
what happened to evan smith college basketball career,0,,0.00,0.00,,,,"0.00,0.00,0.00,0.00,0.00,0.00,0.00,0.00,0.00,0.00,0.00"
what happened to evansville basketball coach,0,,0.00,0.00,,,,"0.00,0.00,0.00,0.00,0.00,0.00,0.00,0.00,0.00,0.00,0.00"
what happened to evelyn basketball wives,0,,0.00,0.00,,,,"0.00,0.00,0.00,0.00,0.00,0.00,0.00,0.00,0.00,0.00,0.00"
what happened to felder gamecock basketball,0,,0.00,0.00,,,,"0.00,0.00,0.00,0.00,0.00,0.00,0.00,0.00,0.00,0.00,0.00"
what happened to fila basketball shoes,0,,0.00,0.00,,,,"0.00,0.00,0.00,0.00,0.00,0.00,0.00,0.00,0.00,0.00,0.00"
what happened to florida basketball player,0,,0.00,0.00,,,,"0.00,0.00,0.00,0.00,0.00,0.00,0.00,0.00,0.00,0.00,0.00"
what happened to florida basketball player that collapsed,0,,0.00,0.00,,,,"0.00,0.00,0.00,0.00,0.00,0.00,0.00,0.00,0.00,0.00,0.00"
what happened to florida basketball player today,0,,0.00,0.00,,,,"0.00,0.00,0.00,0.00,0.00,0.00,0.00,0.00,0.00,0.00,0.00"
what happened to florida basketball player who collapsed,0,,0.00,0.00,,,,"0.00,0.00,0.00,0.00,0.00,0.00,0.00,0.00,0.00,0.00,0.00"
what happened to florida gator basketball player,0,,0.00,0.00,,,,"0.00,0.00,0.00,0.00,0.00,0.00,0.00,0.00,0.00,0.00,0.00"
what happened to florida state basketball player,0,,0.00,0.00,,,,"0.00,0.00,0.00,0.00,0.00,0.00,0.00,0.00,0.00,0.00,0.00"
what happened to fresno state basketball coach,0,,0.00,0.00,,,,"0.00,0.00,0.00,0.00,0.00,0.00,0.00,0.00,0.00,0.00,0.00"
what happened to fsu basketball,0,,0.00,0.00,,,,"0.00,0.00,0.00,0.00,0.00,0.00,0.00,0.00,0.50,1.00,0.00"
what happened to gamechanger basketball,0,,0.00,0.00,,,,"0.00,0.00,0.00,0.00,0.00,0.00,0.00,0.00,0.00,0.00,0.00"
what happened to gator basketball player,0,,0.00,0.00,,,,"0.00,0.00,0.00,0.00,0.00,0.00,0.00,0.00,0.00,0.00,0.00"
what happened to gators basketball player,0,,0.00,0.00,,,,"0.00,0.00,0.00,0.00,0.00,0.00,0.00,0.00,0.00,0.00,0.00"
what happened to gcu basketball player,0,,0.00,0.00,,,,"0.00,0.00,0.00,0.00,0.00,0.00,0.00,0.00,0.00,0.00,0.00"
what happened to georgia state basketball coach,0,,0.00,0.00,,,,"0.00,0.00,0.00,0.00,0.00,0.00,0.00,0.00,0.00,0.00,0.00"
what happened to georgia tech basketball,0,,0.00,0.00,,,,"0.00,0.00,0.00,0.00,0.00,0.00,0.00,0.00,0.00,0.00,0.00"
what happened to gonzaga basketball,0,,0.00,0.01,,,,"0.00,0.00,0.00,0.00,0.00,0.00,0.00,0.00,0.00,0.00,1.00"
what happened to grinnell basketball player 138 points,0,,0.00,0.00,,,,"0.00,0.00,0.00,0.00,0.00,0.00,0.00,0.00,0.00,0.00,0.00"
what happened to haas from purdue basketball,0,,0.00,0.00,,,,"0.00,0.00,0.00,0.00,0.00,0.00,0.00,0.00,0.00,0.00,0.00"
what happened to harry smith basketball,0,,0.00,0.00,,,,"0.00,0.00,0.00,0.00,0.00,0.00,0.00,0.00,0.00,0.00,0.00"
