Keyword,Volume,Keyword Difficulty,CPC (USD),Competitive Density,Number of Results,Intent,SERP Features,Trend
how can i get tickets to a unc basketball game,0,,0.00,0.00,,,,"0.00,0.00,0.00,0.00,0.00,0.00,0.00,0.00,0.00,0.00,0.00"
how can i sell my basketball tickets,0,,0.00,0.00,,,,"0.00,0.00,0.00,0.00,0.00,0.00,0.00,0.00,0.00,0.00,0.00"
how can i win tickets to basketball tournament n minneapolis,0,,0.00,0.00,,,,"0.00,0.00,0.00,0.00,0.00,0.00,0.00,0.00,0.00,0.00,0.00"
how can you sell purdue basketball tickets,0,,0.00,0.00,,,,"0.00,0.00,0.00,0.00,0.00,0.00,0.00,0.00,0.00,0.00,0.00"
how do duke employees get basketball tickets,0,,0.00,0.00,,,,"0.00,0.00,0.00,0.00,0.00,0.00,0.00,0.00,0.00,0.00,0.00"
how do e tickets work for basketball games,0,,0.00,0.00,,,,"0.00,0.00,0.00,0.00,0.00,0.00,0.00,0.00,0.00,0.00,0.00"
how do i buy tickets fromkansas university for basketball tickets,0,,0.00,0.00,,,,"0.00,0.00,0.00,0.00,0.00,0.00,0.00,0.00,0.00,0.00,0.00"
how do i exchange duke basketball tickets from friend,0,,0.00,0.00,,,,"0.00,0.00,0.00,0.00,0.00,0.00,0.00,0.00,0.00,0.00,0.00"
how do i get disconunt tickets to lobos mens basketball,0,,0.00,0.00,,,,"0.00,0.00,0.00,0.00,0.00,0.00,0.00,0.00,0.00,0.00,0.00"
how do i get discount tickets to lobos men's basketball,0,,0.00,0.00,,,,"0.00,0.00,0.00,0.00,0.00,0.00,0.00,0.00,0.00,0.00,0.00"
how do i get duke basketball tickets,0,,0.00,0.00,,,,"0.00,0.00,0.00,0.00,0.00,0.00,0.00,0.00,0.00,0.00,0.00"
how do i get fgcu basketball tickets,0,,0.00,0.00,,,,"0.00,0.00,0.00,0.00,0.00,0.00,0.00,0.00,0.00,0.00,0.00"
how do i get free tickets to umt basketball,0,,0.00,0.00,,,,"0.00,0.00,0.00,0.00,0.00,0.00,0.00,0.00,0.00,0.00,0.00"
how do i get gcu basketball tickets,0,,0.00,0.00,,,,"0.00,0.00,0.00,0.00,0.00,0.00,0.00,0.00,0.00,0.00,0.00"
how do i get tickets for cornell women's basketball,0,,0.00,0.00,,,,"0.00,0.00,0.00,0.00,0.00,0.00,0.00,0.00,0.00,0.00,0.00"
how do i get tickets for fsu basketball,0,,0.00,0.00,,,,"0.00,0.00,0.00,0.00,0.00,0.00,0.00,0.00,0.00,0.00,0.00"
how do i get tickets to a duke basketball game,0,,0.00,0.00,,,,"0.00,0.00,0.00,0.00,0.00,0.00,0.00,0.00,0.00,0.00,0.00"
how do i receive duke basketball tickets from friend,0,,0.00,0.00,,,,"0.00,0.00,0.00,0.00,0.00,0.00,0.00,0.00,0.00,0.00,0.00"
how do i sell my msh basketball tickets on stubhub,0,,0.00,0.00,,,,"0.00,0.00,0.00,0.00,0.00,0.00,0.00,0.00,0.00,0.00,0.00"
how do people buy basketball tickets,0,,0.00,0.00,,,,"0.00,0.00,0.00,0.00,0.00,0.00,0.00,0.00,0.00,0.00,0.00"
how do people say basketball tickets in.spanish,0,,0.00,0.00,,,,"0.00,0.00,0.00,0.00,0.00,0.00,0.00,0.00,0.00,0.00,0.00"
how do student tickets work iowa basketball womens,0,,0.00,0.00,,,,"0.00,0.00,0.00,0.00,0.00,0.00,0.00,0.00,0.00,0.00,0.00"
how do students get purdue basketball tickets,0,,0.00,0.00,,,,"0.00,0.00,0.00,0.00,0.00,0.00,0.00,0.00,0.00,0.00,0.00"
how do students get university of arizona basketball tickets,0,,0.00,0.00,,,,"0.00,0.00,0.00,0.00,0.00,0.00,0.00,0.00,0.00,0.00,0.00"
how do unr students get nevada basketball tickets 28,0,,0.00,0.00,,,,"0.00,0.00,0.00,0.00,0.00,0.00,0.00,0.00,0.00,0.00,0.00"
how do you buy courtside basketball tickets for the cavs,0,,0.00,0.00,,,,"0.00,0.00,0.00,0.00,0.00,0.00,0.00,0.00,0.00,0.00,0.00"
how do you buy uva mens basketball season tickets,0,,0.00,0.00,,,,"0.00,0.00,0.00,0.00,0.00,0.00,0.00,0.00,0.00,0.00,0.00"
how does a stanford student buy womens basketball ticket,0,,0.00,0.00,,,,"0.00,0.00,0.00,0.00,0.00,0.00,0.00,0.00,0.00,0.00,0.00"
how early in line to buy uvm basketball tickets,0,,0.00,0.00,,,,"0.00,0.00,0.00,0.00,0.00,0.00,0.00,0.00,0.00,0.00,0.00"
how expensive are basketball tickets,0,,0.00,0.00,,,,0.00
how high can college basketball tickets go,0,,0.00,0.00,,,,"0.00,0.00,0.00,0.00,0.00,0.00,0.00,0.00,0.00,0.00,0.00"
how many season ticket holders does duke basketball have,0,,0.00,0.00,,,,"0.00,0.00,0.00,0.00,0.00,0.00,0.00,0.00,0.00,0.00,0.00"
how many season ticket holders does smu basketball have,0,,0.00,0.00,,,,"0.00,0.00,0.00,0.00,0.00,0.00,0.00,0.00,0.00,0.00,0.00"
how many students buy georgetown basketball season tickets,0,,0.00,0.00,,,,"0.00,0.00,0.00,0.00,0.00,0.00,0.00,0.00,0.00,0.00,0.00"
how many tickets did kentucky basketball make,0,,0.00,0.00,,,,"0.00,0.00,0.00,0.00,0.00,0.00,0.00,0.00,0.00,0.00,0.00"
how many tickets do ncaa basketball players get,0,,0.00,0.00,,,,"0.00,0.00,0.00,0.00,0.00,0.00,0.00,0.00,0.00,0.00,0.00"
how muc are mens du basketball tickets,0,,0.00,0.00,,,,"0.00,0.00,0.00,0.00,0.00,0.00,0.00,0.00,0.00,0.00,0.00"
how much 2017-2018 ucla basketball season tickets,0,,0.00,0.00,,,,"0.00,0.00,0.00,0.00,0.00,0.00,0.00,0.00,0.00,0.00,0.00"
how much are acc basketball season tickets,0,,0.00,0.00,,,,"0.00,0.00,0.00,0.00,0.00,0.00,0.00,0.00,0.00,0.00,0.00"
how much are alabama basketball season tickets,0,,0.00,0.00,,,,"0.00,0.00,0.00,0.00,0.00,0.00,0.00,0.00,0.00,0.00,0.00"
how much are all inclusive basketball tickets,0,,0.00,0.00,,,,"0.00,0.00,0.00,0.00,0.00,0.00,0.00,0.00,0.00,0.00,0.00"
how much are asu nc basketball tickets,0,,0.00,0.00,,,,"0.00,0.00,0.00,0.00,0.00,0.00,0.00,0.00,0.00,0.00,0.00"
how much are auburn men basketball season tickets,0,,0.00,0.00,,,,"0.00,0.00,0.00,0.00,0.00,0.00,0.00,0.00,0.00,0.00,0.00"
how much are badger basketball season tickets,0,,0.00,0.00,,,,"0.00,0.00,0.00,0.00,0.00,0.00,0.00,0.00,0.00,0.00,0.00"
how much are basketball full season tickets,0,,0.00,0.00,,,,"0.00,0.00,0.00,0.00,0.00,0.00,0.00,0.00,0.00,0.00,0.00"
how much are basketball game tickets,0,,0.22,0.17,,,,"0.00,0.00,0.00,0.00,0.00,0.00,1.00,0.00,0.00,0.00,0.00,0.00"
how much are basketball tickets at hope,0,,0.00,0.00,,,,"0.00,0.00,0.00,0.00,0.00,0.00,0.00,0.00,0.00,0.00,0.00"
how much are basketball tickets for unc basketball,0,,0.00,0.00,,,,"0.00,0.00,0.00,0.00,0.00,0.00,0.00,0.00,0.00,0.00,0.00"
how much are basketball tickets front row,0,,0.00,0.00,,,,"0.00,0.00,0.00,0.00"
how much are big ten basketball tournament tickets,0,,0.00,0.00,,,,"0.00,0.00,0.00,0.00,0.00,0.00,0.00,0.00,0.00,0.00,0.00"
how much are boise state basketball season tickets,0,,0.00,0.00,,,,"0.00,0.00,0.00,0.00,0.00,0.00,0.00,0.00,0.00,0.00,0.00"
how much are butler mens basketball season tickets,0,,0.00,0.00,,,,"0.00,0.00,0.00,0.00,0.00,0.00,0.00,0.00,0.00,0.00,0.00"
how much are cat griz basketball game.tickets,0,,0.00,0.00,,,,"0.00,0.00,0.00,0.00,0.00,0.00,0.00,0.00,0.00,0.00,0.00"
how much are cat griz basketball game.tickets 2019,0,,0.00,0.00,,,,"0.00,0.00,0.00,0.00,0.00,0.00,0.00,0.00,0.00,0.00,0.00"
how much are cif basketball game tickets,0,,0.00,0.00,,,,"0.00,0.00,0.00,0.00,0.00,0.00,0.00,0.00,0.00,0.00,0.00"
how much are clemson basketball season tickets,0,,0.00,0.00,,,,"0.00,0.00,0.00,0.00,0.00,0.00,0.00,0.00,0.00,0.00,0.00"
how much are cmu basketball tickets,0,,0.00,0.00,,,,"0.00,0.00,0.00,0.00,0.00,0.00,0.00,0.00,0.00,0.00,0.00"
how much are college basketball playoff tickets,0,,0.00,0.00,,,,"0.00,0.00,0.00,0.00,0.00,0.00,0.00,0.00,0.00,0.00,0.00"
how much are college basketball season tickets,0,,0.00,0.00,,,,"0.00,0.00,0.00,0.00,0.00,0.00,0.00,0.00,0.00,0.00,0.00"
how much are courtside tickets for duke basketball game,0,,0.00,0.00,,,,"0.00,0.00,0.00,0.00,0.00,0.00,0.00,0.00,0.00,0.00,0.00"
how much are courtside tickets to a basketball game,0,,0.00,0.00,,,,"0.00,0.00,0.00,0.00,0.00,0.00,0.00,0.00,0.00,0.00,0.00"
how much are cu boulder basketball tickets,0,,0.00,0.00,,,,"0.00,0.00,0.00,0.00,0.00,0.00,0.00,0.00,0.00,0.00,0.00"
how much are duke banquet basketball tickets,0,,0.00,0.00,,,,"0.00,0.00,0.00,0.00,0.00,0.00,0.00,0.00,0.00,0.00,0.00"
how much are fgcu mens basketball tickets cost,0,,0.00,0.00,,,,"0.00,0.00,0.00,0.00,0.00,0.00,0.00,0.00,0.00,0.00,0.00"
how much are floor tickets at a basketball,0,,0.00,0.00,,,,"0.00,0.00,0.00,0.00,0.00,0.00,0.00,0.00,0.00,0.00,0.00"
how much are georgetown basketball tickets,0,,0.00,0.00,,,,"0.00,0.00,0.00,0.00,0.00,0.00,0.00,0.00,0.00,0.00,0.00"
how much are gonzaga men's basketball season tickets,0,,0.00,0.00,,,,"0.00,0.00,0.00,0.00,0.00,0.00,0.00,0.00,0.00,0.00,0.00"
how much are gonzaga mens basketball season tickets,0,,0.00,0.00,,,,"0.00,0.00,0.00,0.00,0.00,0.00,0.00,0.00,0.00,0.00,0.00"
how much are high point basketball tickets,0,,0.00,0.00,,,,"0.00,0.00,0.00,0.00,0.00,0.00,0.00,0.00,0.00,0.00,0.00"
how much are hilbert basketball tickets,0,,0.00,0.00,,,,"0.00,0.00,0.00,0.00,0.00,0.00,0.00,0.00,0.00,0.00,0.00"
how much are illini basketball season tickets,0,,0.00,0.00,,,,"0.00,0.00,0.00,0.00,0.00,0.00,0.00,0.00,0.00,0.00,0.00"
how much are iowa basketball tickets,0,,0.00,0.00,,,,"0.00,0.00,0.00,0.00,0.00,0.00,0.00,0.00,0.00,0.00,0.00"
how much are iup basketball tickets,0,,0.00,0.00,,,,"0.00,0.00,0.00,0.00,0.00,0.00,0.00,0.00,0.00,0.00,0.00"
how much are jsu basketball tickets,0,,0.00,0.00,,,,"0.00,0.00,0.00,0.00,0.00,0.00,0.00,0.00,0.00,0.00,0.00"
how much are lady raider basketball tickets,0,,0.00,0.00,,,,"0.00,0.00,0.00,0.00,0.00,0.00,0.00,0.00,0.00,0.00,0.00"
how much are loyola mens basketball tickets,0,,0.00,0.00,,,,"0.00,0.00,0.00,0.00,0.00,0.00,0.00,0.00,0.00,0.00,0.00"
how much are lsu basketball season tickets,0,,0.00,0.00,,,,"0.00,0.00,0.00,0.00,0.00,0.00,0.00,0.00,0.00,0.00,0.00"
how much are lsu women's basketball season tickets,0,,0.00,0.00,,,,"0.00,1.00,0.00"
how much are lu tickets to basketball game,0,,0.00,0.00,,,,"0.00,0.00,0.00,0.00,0.00,0.00,0.00,0.00,0.00,0.00,0.00"
how much are miami heat basketball tickets,0,,0.00,0.00,,,,"0.00,0.00,0.00,0.00,0.00,0.00,0.00,0.00,0.00,0.00,0.00"
how much are michigan state basketball season tickets,0,,0.00,0.00,,,,"0.00,0.00,0.00,0.00,0.00,0.00,0.00,0.00,0.00,0.00,0.00"
how much are missouri state university basketball season tickets,0,,0.00,0.00,,,,"0.00,0.00,0.00,0.00,0.00,0.00,0.00,0.00,0.00,0.00,0.00"
how much are national championship basketball game tickets,0,,0.00,0.00,,,,"0.00,0.00,0.00,0.00,0.00,0.00,0.00,0.00,0.00,0.00,0.00"
how much are national championship basketball tickets,0,,0.00,0.00,,,,"0.00,0.00,0.00,0.00,0.00,0.00,0.00,0.00,0.00,0.00,0.00"
how much are nc state women basketball tickets on average,0,,0.00,0.00,,,,"0.00,0.00,0.00,0.00,0.00,0.00,0.00,0.00,0.00,0.00,0.00"
how much are ncaa basketball championship tickets in 2016,0,,0.00,0.00,,,,"0.00,0.00,0.00,0.00,0.00,0.00,0.00,0.00,0.00,0.00,0.00"
how much are ncaa basketball final four tickets,0,,0.00,0.00,,,,"0.00,0.00,0.00,0.00,0.00,0.00,0.00,0.00,0.00,0.00,0.00"
how much are ncaa basketball men's championship tickets in 2016,0,,0.00,0.00,,,,"0.00,0.00,0.00,0.00,0.00,0.00,0.00,0.00,0.00,0.00,0.00"
how much are ncaa basketball mens championship tickets in 2016,0,,0.00,0.00,,,,"0.00,0.00,0.00,0.00,0.00,0.00,0.00,0.00,0.00,0.00,0.00"
how much are nevada basketball season tickets,0,,0.00,0.00,,,,"0.00,0.00,0.00,0.00,0.00,0.00,0.00,0.00,0.00,0.00,0.00"
how much are nit basketball tickets,0,,0.00,0.00,,,,"0.00,0.00,0.00,0.00,0.00,0.00,0.00,0.00,0.00,0.00,0.00"
how much are notre dame men's basketball season tickets,0,,0.00,0.00,,,,"0.00,0.00,0.00,0.00,0.00,0.00,0.00,0.00,0.00,0.00,0.00"
how much are notre dame mens basketball season tickets,0,,0.00,0.00,,,,"0.00,0.00,0.00,0.00,0.00,0.00,0.00,0.00,0.00,0.00,0.00"
how much are providence college basketball tickets,0,,0.00,0.00,,,,"0.00,0.00,0.00,0.00,0.00,0.00,0.00,0.00,0.00,0.00,0.00"
how much are razorback basketball season tickets,0,,0.00,0.00,,,,"0.00,0.00"
how much are regular season basketball tickets,0,,0.00,0.00,,,,"0.00,0.00,0.00,0.00,0.00,0.00,0.00,0.00,0.00,0.00,0.00"
how much are richmind spiders basketball season tickets,0,,0.00,0.00,,,,"0.00,0.00,0.00,0.00,0.00,0.00,0.00,0.00,0.00,0.00,0.00"
how much are sdsu basketball season tickets,0,,0.00,0.00,,,,"0.00,0.00,0.00,0.00,0.00,0.00,0.00,0.00,0.00,0.00,0.00"
how much are season basketball tickets,0,,0.00,0.00,,,,"0.00,0.00,0.00,0.00,0.00,0.00,0.00,0.00,0.00,0.00,0.00"
how much are season tickets for iu mens basketball,0,,0.00,0.00,,,,"0.00,0.00,0.00,0.00,0.00,0.00,0.00,0.00,0.00,0.00,0.00"
how much are season tickets for ku basketball,0,,0.00,0.00,,,,"0.00,0.00,0.00,0.00,0.00,0.00,0.00,0.00,0.00,0.00,0.00"
how much are season tickets for maine womens basketball,0,,0.00,0.00,,,,"0.00,0.00,0.00,0.00,0.00,0.00,0.00,0.00,0.00,0.00,0.00"
how much are season tickets for mississippi state womens basketball,0,,0.00,0.00,,,,"0.00,0.00,0.00,0.00,0.00,0.00,0.00,0.00,0.00,0.00,0.00"
how much are season tickets to wake forest basketball,0,,0.00,0.00,,,,"0.00,0.00,0.00,0.00,0.00,0.00,0.00,0.00,0.00,0.00,0.00"
how much are senior ticket to watch marqutte basketball,0,,0.00,0.00,,,,"0.00,0.00,0.00,0.00,0.00,0.00,0.00,0.00,0.00,0.00,0.00"
how much are single tickets to wku basketball,0,,0.00,0.00,,,,"0.00,0.00,0.00,0.00,0.00,0.00,0.00,0.00,0.00,0.00,0.00"
how much are student guest tickets ucla basketball,0,,0.00,0.00,,,,"0.00,0.00,0.00,0.00,0.00,0.00,0.00,0.00,0.00,0.00,0.00"
how much are student men basketball tickets,0,,0.00,0.00,,,,"0.00,0.00,0.00,0.00,0.00,0.00,0.00,0.00,0.00,0.00,0.00"
how much are student men basketball tickets berkeley,0,,0.00,0.00,,,,"0.00,0.00,0.00,0.00,0.00,0.00,0.00,0.00,0.00,0.00,0.00"
how much are tcu basketball tickets,0,,0.00,0.00,,,,"0.00,0.00,0.00,0.00,0.00,0.00,0.00,0.00,0.00,0.00,0.00"
how much are the tickets for usu basketball,0,,0.00,0.00,,,,"0.00,0.00,0.00,0.00,0.00,0.00,0.00,0.00,0.00,0.00,0.00"
how much are thunder basketball season tickets,0,,0.00,0.00,,,,"0.00,0.00,0.00,0.00,0.00,0.00,0.00,0.00,0.00,0.00,0.00"
how much are ticket for purdue womens basketball,0,,0.00,0.00,,,,"0.00,0.00,0.00,0.00,0.00,0.00,0.00,0.00,0.00,0.00,0.00"
how much are tickets for a basketball game,0,,0.22,0.17,,,,"0.00,0.00,0.00,0.00,0.00,0.00,1.00,0.00,0.00,0.00,0.00,0.00"
how much are tickets for mens basketball,0,,0.00,0.00,,,,"0.00,0.00,0.00,0.00,0.00,0.00,0.00,0.00,0.00,0.00,0.00"
how much are tickets for morehouse college basketball games,0,,0.00,0.00,,,,"0.00,0.00,0.00,0.00,0.00,0.00,0.00,0.00,0.00,0.00,0.00"
how much are tickets for razorback mens basketball,0,,0.00,0.00,,,,"0.00,0.00,0.00,0.00,0.00,0.00,0.00,0.00,0.00,0.00,0.00"
how much are tickets for the ncaa basketball championship,0,,0.28,0.25,,,,"0.00,0.00,0.00,0.00,0.00,0.00,0.00,0.00,0.00,0.00,0.00"
how much are tickets for the tennessee tech girls basketball,0,,0.00,0.00,,,,"0.00,0.00,0.00,0.00,0.00,0.00,0.00,0.00,0.00,0.00,0.00"
how much are tickets for the women's basketball,0,,0.00,0.00,,,,"0.00,0.00,0.00,0.00,0.00,0.00,0.00,0.00,0.00,0.00,0.00"
how much are tickets for wake forest-drake basketball game tonight,0,,0.00,0.00,,,,"0.00,0.00,0.00,0.00,0.00,0.00,0.00,0.00,0.00,0.00,0.00"
how much are tickets to a basketball game,0,,0.22,0.17,,,,"0.00,0.00,0.00,0.00,0.00,0.00,1.00,0.00,0.00,0.50,0.00,0.00"
how much are tickets to a college basketball game,0,,0.00,0.00,,,,"0.00,0.00,0.00,0.00,0.00,0.00,0.00,0.00,0.00,0.00,0.00"
how much are tickets to a sierra canyon basketball game,0,,0.00,0.00,,,,"0.00,0.00,0.00,0.00,0.00,0.00,0.00,0.00,0.00,0.00,0.00"
how much are tickets to ersking basketball game,0,,0.00,0.00,,,,"0.00,0.00,0.00,0.00,0.00,0.00,0.00,0.00,0.00,0.00,0.00"
how much are tickets to otterbein basketball,0,,0.00,0.00,,,,"0.00,0.00,0.00,0.00,0.00,0.00,0.00,0.00,0.00,0.00,0.00"
how much are tickets to the gator basketball game,0,,0.00,0.00,,,,"0.00,0.00,0.00,0.00,0.00,0.00,0.00,0.00,0.00,0.00,0.00"
how much are tickets to the national championship basketball game,0,,0.00,0.17,,,,"0.00,0.00,0.00,0.00,0.00,0.00,0.00,0.00,0.00,0.00,1.00"
how much are tickets to truman state basketball game,0,,0.00,0.00,,,,"0.00,0.00,0.00,0.00,0.00,0.00,0.00,0.00,0.00,0.00,0.00"
how much are tickets to university of arizona basketball game,0,,0.00,0.00,,,,"0.00,0.00,0.00,0.00,0.00,0.00,0.00,0.00,0.00,0.00,0.00"
how much are ualr basketball tickets,0,,0.00,0.00,,,,"0.00,0.00,0.00,0.00,0.00,0.00,0.00,0.00,0.00,0.00,0.00"
how much are uc basketball season tickets,0,,0.00,0.00,,,,"0.00,0.00,0.00,0.00,0.00,0.00,0.00,0.00,0.00,0.00,0.00"
how much are ucla basketball season tickets,0,,0.00,0.00,,,,"0.00,0.00,0.00,0.00,0.00,0.00,0.00,0.00,0.00,0.00,0.00"
how much are ucla basketball season tickets 2017,0,,0.00,0.00,,,,"0.00,0.00,0.00,0.00,0.00,0.00,0.00,0.00,0.00,0.00,0.00"
how much are university of arizona mens basketball season tickets,0,,0.00,0.00,,,,"0.00,0.00,0.00,0.00,0.00,0.00,0.00,0.00,0.00,0.00,0.00"
how much are university of kentucky basketball tickets,0,,0.00,0.00,,,,"0.00,0.00,0.00,0.00,0.00,0.00,0.00,0.00,0.00,0.00,0.00"
how much are university of miami basketball tickets,0,,0.00,0.00,,,,"0.00,0.00,0.00,0.00,0.00,0.00,0.00,0.00,0.00,0.00,0.00"
how much are unr basketball season tickets,0,,0.00,0.00,,,,"0.00,0.00,0.00,0.00,0.00,0.00,0.00,0.00,0.00,0.00,0.00"
how much are utah state basketball tickets,0,,0.00,0.00,,,,"0.00,0.00,0.00,0.00,0.00,0.00,0.00,0.00,0.00,0.00,0.00"
how much are uvm men's basketball season tickets,0,,0.00,0.00,,,,"0.00,0.00,0.00,0.00,0.00,0.00,0.00,0.00,0.00,0.00,0.00"
how much are uvm mens basketball season tickets,0,,0.00,0.00,,,,"0.00,0.00,0.00,0.00,0.00,0.00,0.00,0.00,0.00,0.00,0.00"
how much are uw madison basketball season tickets,0,,0.00,0.00,,,,"0.00,0.00,0.00,0.00,0.00,0.00,0.00,0.00,0.00,0.00,0.00"
how much are vcu basketball season tickets,0,,0.00,0.00,,,,"0.00,0.00,0.00,0.00,0.00,0.00,0.00,0.00,0.00,0.00,0.00"
how much are vcu mens basketball tickets,0,,0.00,0.00,,,,"0.00,0.00,0.00,0.00,0.00,0.00,0.00,0.00,0.00,0.00,0.00"
how much are villanova basketball season tickets,0,,0.00,0.00,,,,"0.00,0.00,0.00,0.00,0.00,0.00,0.00,0.00,0.00,1.00,1.00"
how much are virginia high bearcats basketball tickets,0,,0.00,0.00,,,,"0.00,0.00,0.00,0.00,0.00,0.00,0.00,0.00,0.00,0.00,0.00"
how much are vmi basketball ticket,0,,0.00,0.00,,,,"0.00,0.00,0.00,0.00,0.00,0.00,0.00,0.00,0.00,0.00,0.00"
how much are weber state basketball tickets,0,,0.00,0.00,,,,"0.00,0.00,0.00,0.00,0.00,0.00,0.00,0.00,0.00,0.00,0.00"
how much are wisconsin badger basketball ticket,0,,0.00,0.00,,,,"0.00,0.00,0.00,0.00,0.00,0.00,0.00,0.00,0.00,0.00,0.00"
how much are wolf pack basketball season tickets,0,,0.00,0.00,,,,"0.00,0.00,0.00,0.00,0.00,0.00,0.00,0.00,0.00,0.00,0.00"
how much are women's basketball tickets,0,,0.00,0.00,,,,"0.00,0.00,0.00,0.00,0.00,0.00,0.00,0.00,0.00,0.00,0.00"
how much are women's wisconsin badger basketball tickets,0,,0.00,0.00,,,,"0.00,0.00,0.00,0.00,0.00,0.00,0.00,0.00,0.00,0.00,0.00"
how much are wsu basketball season tickets,0,,0.00,0.00,,,,"0.00,0.00,0.00,0.00,0.00,0.00,0.00,0.00,0.00,0.00,0.00"
how much are yale vs harvard basketball tickets,0,,0.00,0.00,,,,"0.00,0.00,0.00,0.00,0.00,0.00,0.00,0.00,0.00,0.00,0.00"
how much basketball tickets cost,0,,0.00,0.00,,,,"0.00,0.00"
how much can i sell student basketball ticket,0,,0.00,0.00,,,,"0.00,0.00,0.00,0.00,0.00,0.00,0.00,0.00,0.00,0.00,0.00"
how much cowboy basketball season tickets,0,,0.00,0.00,,,,"0.00,0.00,0.00,0.00,0.00,0.00,0.00,0.00,0.00,0.00,0.00"
how much did duke vs north carolina basketball tickets,0,,0.00,0.00,,,,"0.00,0.00,0.00,0.00,0.00,0.00,0.00,0.00,0.00,0.00,0.00"
how much did duke vs north carolina basketball tickets 2018,0,,0.00,0.00,,,,"0.00,0.00,0.00,0.00,0.00,0.00,0.00,0.00,0.00,0.00,0.00"
how much did ucla basketball gross ticket sales 2016,0,,0.00,0.00,,,,"0.00,0.00,0.00,0.00,0.00,0.00,0.00,0.00,0.00,0.00,0.00"
how much do basketball game tickets cost,0,,0.00,0.00,,,,"0.00,0.00,0.00,0.00,0.00,0.00,0.00,0.00,0.00,0.00,0.00"
how much do butler basketball single game tickets sell for,0,,0.00,0.00,,,,"0.00,0.00,0.00,0.00,0.00,0.00,0.00,0.00,0.00,0.00,0.00"
how much do celtics basketball tickets cost,0,,0.00,0.00,,,,"0.00,0.00,0.00,0.00,0.00,0.00,0.00,0.00,0.00,0.00,0.00"
how much do close basketball tickets costs,0,,0.00,0.00,,,,"0.00,0.00,0.00,0.00,0.00,0.00,0.00,0.00,0.00,0.00,0.00"
how much do duke basketball tickets cost for students,0,,0.00,0.00,,,,"0.00,0.00,0.00,0.00,0.00,0.00,0.00,0.00,0.00,0.00,0.00"
how much do georgetown basketball tickets cost,0,,0.00,0.00,,,,"0.00,0.00,0.00,0.00,0.00,0.00,0.00,0.00,0.00,0.00,0.00"
how much do gonzaga basketball season tickets cost,0,,0.00,0.00,,,,"0.00,0.00,0.00,0.00,0.00,0.00,0.00,0.00,0.00,0.00,0.00"
how much do gonzaga basketball tickets cost,0,,0.00,0.00,,,,"0.00,0.00,0.00,0.00,0.00,0.00,0.00,0.00,0.00,0.00,0.00"
how much do hope college basketball tickets cost,0,,0.00,0.00,,,,"0.00,0.00,0.00,0.00,0.00,0.00,0.00,0.00,0.00,0.00,0.00"
how much do iu basketball season tickets cost,0,,0.00,0.00,,,,"0.00,0.00,0.00,0.00,0.00,0.00,0.00,0.00,0.00,0.00,0.00"
how much do kentucky basketball season tickets cost,0,,0.00,0.00,,,,"0.00,0.00,0.00,0.00,0.00,0.00,0.00,0.00,0.00,0.00,0.00"
how much do ku basketball season tickets cost,0,,0.00,0.00,,,,"0.00,0.00,0.00,0.00,0.00,0.00,0.00,0.00,0.00,0.00,0.00"
how much do michigan basketball tickets cost,0,,0.00,0.00,,,,"0.00,0.00,0.00,0.00,0.00,0.00,0.00,0.00,0.00,0.00,0.00"
how much do michigan state basketball season tickets cost,0,,0.00,0.00,,,,"0.00,0.00,0.00,0.00,0.00,0.00,0.00,0.00,0.00,0.00,0.00"
how much do ncaa basketball championship tickets cost,0,,0.00,0.00,,,,"0.00,0.00,0.00,0.00,0.00,0.00,0.00,0.00,0.00,0.00,0.00"
how much do ncaa basketball tickets cost,0,,0.00,0.00,,,,"0.00,0.00,0.00,0.00,0.00,0.00,0.00,0.00,0.00,0.00,0.00"
how much do ncaa basketball tournament tickets cost,0,,0.00,0.00,,,,"0.00,0.00,0.00,0.00,0.00,0.00,0.00,0.00,0.00,0.00,0.00"
how much do ohio state basketball season tickets cost,0,,0.00,0.00,,,,"0.00,0.00,0.00,0.00,0.00,0.00,0.00,0.00,0.00,0.00,0.00"
how much do ohio state basketball tickets cost,0,,0.00,0.00,,,,"0.00,0.00,0.00,0.00,0.00,0.00,0.00,0.00,0.00,0.00,0.00"
how much do season tickets for ku basketball games,0,,0.00,0.00,,,,"0.00,0.00,0.00,0.00,0.00,0.00,0.00,0.00,0.00,0.00,0.00"
how much do season tickets to arizona basketball cost,0,,0.00,0.00,,,,"0.00,0.00,0.00,0.00,0.00,0.00,0.00,0.00,0.00,0.00,0.00"
how much do stanford mens basketball tickets cost,0,,0.00,0.00,,,,"0.00,0.00,0.00,0.00,0.00,0.00,0.00,0.00,0.00,0.00,0.00"
how much do syracuse basketball tickets cost,0,,0.00,0.00,,,,"0.00,0.00,0.00,0.00,0.00,0.00,0.00,1.00,0.00,0.00,0.00"
how much do tickets cost for gmu patriot basketball games,0,,0.00,0.00,,,,"0.00,0.00,0.00,0.00,0.00,0.00,0.00,0.00,0.00,0.00,0.00"
how much do tickets cost for the acc basketball tornament,0,,0.00,0.00,,,,"0.00,0.00,0.00,0.00,0.00,0.00,0.00,0.00,0.00,0.00,0.00"
how much do tickets cost to see a basketball game,0,,0.00,0.00,,,,"0.00,0.00,0.00,0.00,0.00,0.00,0.00,0.00,0.00,0.00,0.00"
how much do uconn basketball season tickets cost,0,,0.00,0.00,,,,"0.00,0.00,0.00,0.00,0.00,0.00,0.00,0.00,0.00,0.00,0.00"
how much do uconn basketball tickets cost,0,,0.00,0.00,,,,"0.00,0.00,0.00,0.00,0.00,0.00,0.00,0.00,0.00,0.00,0.00"
how much do ud basketball tickets cost general public,0,,0.00,0.00,,,,"0.00,0.00,0.00,0.00,0.00,0.00,0.00,0.00,0.00,0.00,0.00"
how much do uk basketball season tickets cost,0,,0.00,0.00,,,,"0.00,0.00,0.00,0.00,0.00,0.00,0.00,0.00,0.00,0.00,0.00"
how much do unlv basketball game tickets cost,0,,0.00,0.00,,,,"0.00,0.00,0.00,0.00,0.00,0.00,0.00,0.00,0.00,0.00,0.00"
how much do uofa basketball season tickets cost,0,,0.00,0.00,,,,"0.00,0.00,0.00,0.00,0.00,0.00,0.00,0.00,0.00,0.00,0.00"
how much do villanova basketball tickets cost,0,,0.00,0.00,,,,"0.00,0.00,0.00,0.00,0.00,0.00,0.00,0.00,0.00,0.00,0.00"
how much do wyo cowboy basketball tickets cost,0,,0.00,0.00,,,,"0.00,0.00,0.00,0.00,0.00,0.00,0.00,0.00,0.00,0.00,0.00"
how much does basketball tickets to howard community college dragons,0,,0.00,0.00,,,,"0.00,0.00,0.00,0.00,0.00,0.00,0.00,0.00,0.00,0.00,0.00"
how much does drake pay for basketball tickets,0,,0.00,0.00,,,,"0.00,0.00,0.00,0.00,0.00,0.00,0.00,0.00,0.00,0.00,0.00"
how much does it cost for season college basketball tickets,0,,0.00,0.00,,,,"0.00,0.00,0.00,0.00,0.00,0.00,0.00,0.00,0.00,0.00,0.00"
how much does kentucky basketball make from ticket sales,0,,0.00,0.00,,,,"0.00,0.00,0.00,0.00,0.00,0.00,0.00,0.00,0.00,0.00,0.00"
how much does tickets to womens basketball game cost,0,,0.00,0.00,,,,"0.00,0.00,0.00,0.00,0.00,0.00,0.00,0.00,0.00,0.00,0.00"
how much for basketball tickets,0,,0.29,0.17,,,,"0.00,0.00,0.00,0.00,0.00,0.00,0.00,0.00,0.00,0.00,0.00,0.00"
how much for season tickets for su men's basketball,0,,0.00,0.00,,,,"0.00,0.00,0.00,0.00,0.00,0.00,0.00,0.00,0.00,0.00,0.00"
how much gonzaga basketball tickets 2019,0,,0.00,0.00,,,,"0.00,0.00,0.00,0.00,0.00,0.00,0.00,0.00,0.00,0.00,0.00"
how much is a basketball game tickets in texas a&m,0,,0.00,0.00,,,,"0.00,0.00,0.00,0.00,0.00,0.00,0.00,0.00,0.00,0.00,0.00"
how much is a college basketball ticket,0,,0.00,0.00,,,,"0.00,0.00,0.00,0.00,0.00,0.00,0.00,0.00,0.00,0.00,0.00"
how much is a college basketball ticket in hawaii,0,,0.00,0.00,,,,"0.00,0.00,0.00,0.00,0.00,0.00,0.00,0.00,0.00,0.00,0.00"
how much is a general admission ticket for colorado basketball,0,,0.00,0.00,,,,"0.00,0.00,0.00,0.00,0.00,0.00,0.00,0.00,0.00,0.00,0.00"
how much is a ku basketball ticket,0,,0.00,0.00,,,,"0.00,0.00,0.00,0.00,0.00,0.00,0.00,0.00,0.00,0.00,0.00"
how much is a nba basketball ticket,0,,0.00,0.00,,,,"0.00,0.00,0.00,0.00,0.00,0.00,0.00,0.00,0.00,0.00,0.00"
how much is a ticket for big 3 basketball,0,,0.00,0.00,,,,"0.00,0.00,0.00,0.00,0.00,0.00,0.00,0.00,0.00,0.00,0.00"
how much is a tickets to arkansas basketball,0,,0.00,0.00,,,,"0.00,0.00,0.00,0.00,0.00,0.00,0.00,0.00,0.00,0.00,0.00"
how much is a virtual basketball ticket,0,,0.00,0.00,,,,"0.00,0.00,0.00,0.00,0.00,0.00,0.00,0.00,0.00,0.00,0.00"
how much is a virtual basketball tickets,0,,0.00,0.00,,,,"0.00,0.00,0.00,0.00,0.00,0.00,0.00,0.00,0.00,0.00,0.00"
how much is basketball tickets,0,,0.29,0.17,,,,"1.00,1.00,0.00,0.00,0.00,0.00,0.00,0.00,0.00,0.00,0.00,1.00"
how much is college basketball tickets,0,,0.00,0.00,,,,"0.00,0.00,0.00,0.00,0.00,0.00,0.00,0.00,0.00,0.00,0.00"
